125815,CANDIDO RONDON MARECHAL,161106,"AVENIDA RUBENS CARAMEZ, 779 - VILA AURORA - 06657000"
128429,ANA MACIEIRA DE OLIVEIRA,161107,"AVENIDA IVO MARIO ISAAC PIRES KM 1, 802 - PEDRAS - 06720480"
72435,PAULO SOARES DA SILVA,161108,"RUA SAO PAULO DAS MISSOES, 176 - TIJUCO PRETO - 06730000"
72436,HENRIQUE SAMMARTINO ALFERES,161109,"MARIA APARECIDA PEDROSA, 35 - JARDIM ROSA EMILIA - 06608430"
72437,JOSE NEYDE CESAR LESSA DOUTOR,161110,"VARGAS PRESIDENTE, 900 - NOVA ITAPEVI - 06694000"
72438,OSWALDO SAMMARTINO,161111,"RUA ALBERTO RUFOLLO, 143 - VILA ANITA COSTA - 06600170"
72439,ELOI LACERDA PROF,161112,"HENRIQUE DIAS, 243 - PIRATININGA - 06233120"
125816,ERNESTO THENN DE BARROS PROFESSOR,161113,"RUA DOUTOR BENTO VIDAL, 1000 - JARDIM NOVO OSASCO - 06142100"
72440,JOSE VERISSIMO DE MATOS,161114,"JULIO NUNES DE REGO, SN - JARDIM ROBERTO - 06170230"
72441,JOAO CAMPESTRINI PROF,161115,"RUA REINALDO CESCHINI, 77 - JD MUNHOZ JR - 06246150"
72442,ACACIO PIEDADE CEL,161116,"AV CEL ACACIO PIEDADE, 657 - CENTRO - 18400000"
72443,JOSE MARIA RODRIGUES LEITE PROFESSOR,161117,"DIMITRI SENSAUD DE LAVOUD, 207 - VILA CAMPESINA - 06023030"
128430,ALCYR OLIVEIRA PORCIUNCULA PROFESSOR,161118,"AVENIDA PRESIDENTE MEDICI, 2386 - VILA MENCK - 06273000"
74092,MARECHAL BITTENCOURT,161119,"LARGO MONTEIRO LOBATO, 443 - CENTRO - 06090060"
72447,ROSA BONFIGLIOLI,161120,"RUA PROFESSORA RAPHAELA GOMES AFONSO, 17 - JARDIM DABRIL - 06038300"
72448,MAX ZENDRON PROF,161121,"RUA JOAO OXISQUE, SN - VILA YARA - 06028160"
72449,QUINTINO BOCAIUVA,161122,"R DOUTOR BENTO VIDAL, 87 - JD N OSASCO - 06045050"
72450,MARINA SADDI HAIDAR,161123,"RUA JOAO ARNUS, 28 - JD ALIANCA - 06236130"
125817,JOSE LIBERATTI PROFESSOR,161124,"CASTELO BRANCO PRESIDENTE, 250 - CENTRO - 06016020"
72451,FRANCISCA LISBOA PERALTA PROFESSORA,161125,"AVENIDA PROFESSOR LOURENCO FILHO, 560 - JARDIM ELVIRA - 06243000"
72452,ANTONIO PAIVA DE SAMPAIO CORONEL,161126,"ANANIAS DE ALMEIDA, 145 - QUITAUNA - 06186190"
72453,FREI GASPAR DA MADRE DE DEUS,161127,"AV OSWALDO COLLINO, 980 - PRES ALTINO - 06210008"
72454,FANNY MONZONI SANTOS PROFESSORA,161128,"DELFINO CERQUEIRA, 136 - VILA YOLANDA - 06120280"
72455,JOAO LARIZZATTI PROF,161129,"AV HILDEBRANDO DE LIMA, 960 - VILA QUITAUNA - 06190160"
72456,MARIA AUGUSTA SIQUEIRA PROFESSORA,161130,"ANTONIO FESTA, 35 - REMEDIOS - 06296060"
72457,TEREZINHA MARTINS PEREIRA PROFA,161131,"PRACA PROF ANESIO CABRAL, 110 - ROCHDALE - 06226010"
72458,LUIZ LUSTOSA DA SILVA PROFESSOR DOUTOR,161132,"LUIZ GATTI, 500 - BARONESA - 06266030"
125818,JOAO BAPTISTA DE BRITO PROFESSOR,161133,"ROSA DANGELO PISAPIA, 115 - VILA YARA - 06020040"
72459,AURELIANO LEITE DOUTOR,161134,"NAIR LUCIOLA RODRIGUES, 75 - VILA MENK - 06270060"
72460,AMERICO MARCO ANTONIO DOUTOR,161135,"RUA JOAO MIRASSOL, 436 - PESTANA - 06122170"
72461,BENEDICTO CALDEIRA PROFESSOR,161136,"JOSE SALVADOR PAZZOBOM, 15 - JAGUARIBE - 06050070"
72462,FRANCISCO CAVALCANTI PONTES DE MIRANDA,161137,"RUA BENEDITO OFURTADO, 100 - VILA IZABEL - 06180010"
127810,HELOISA DE ASSUMPCAO PROFESSORA,161138,"AVENIDA COMANDANTE SAMPAIO, 1399 - KM 18 - 06192010"
72463,MANOEL TERTULIANO DE CERQUEIRA PROF,161139,"R CANDIDO FONTOURA, 20 - JD TEREZA - 06140090"
128431,ALICE VELHO TEIXEIRA PROFESSORA,161140,"RUA MARIA CARMEM PANICA, 284 - PRESIDENTE ALTINO - 06210070"
72464,JULIA LOPES DE ALMEIDA,161141,"CRUZEIRO DO SUL, 357 - ROCHDALE - 06226002"
125819,IVAN FLEURY MEIRELLES DR,161142,"R GERALDO MORAN, 271 - JARDIM UMUARAMA - 06030060"
72465,TOBIAS BARRETO DE MENEZES,161143,"RUA JOANA DARC, 51 - VILA AYROSA - 06283100"
72466,GLORIA AZEDIA BONETTI PROFESSORA,161144,"ALTINO ARANTES, 165 - BELA VISTA - 06070270"
72467,GRACILIANO RAMOS,161145,"ESTRELA, 2003 - NOVO OSASCO - 06045270"
72468,LAERTE JOSE DOS SANTOS PROF,161146,"PRACA DANTE RIVALDO, SN - BELA VISTA - 06080270"
72469,OGUIOMAR RUGGERI PROFESSOR,161147,"BRAULIO TERTULIANO VIEIRA, 135 - VELOSO - 06144170"
72470,GUILHERME DE OLIVEIRA GOMES DEPUTADO,161148,"HIPOLITO DA SILVA, 36 - CIPAVA - 06075150"
72471,TELMO COELHO FILHO MAJOR,161149,"AVENIDA COMANDANTE SAMPAIO, 285 - KM 18 - 06192010"
72472,ANTONIO DE SAMPAIO GENERAL,161150,"AV AUTONOMISTAS DOS, 6565 - VL QUITAUNA - 06194050"
125820,LEONARDO VILAS BOAS,161151,"JOSE BARBOSA DE SIQUEIRA, 71 - PADROEIRA - 06172000"
72473,JOSUE BENEDICTO MENDES PROFESSOR,161152,"SUD MENUCCI PROFESSOR, 353 - JARDIM ELVIRA - 06250250"
125821,JOAO EUCLYDES PEREIRA PROF,161153,"R OSVALDO MUNHOZ, SN - VL SERVENTINA - 06250030"
125822,VICENTE PEIXOTO PROFESSOR,161154,"DIOGO BENITEZ, 3 - VILA OSASCO - 06086130"
74122,ANTONIO RAPOSO TAVARES,161155,"VINTE E UM DE DEZEMBRO, 22 - CENTRO - 06097080"
72476,ALIPIO DA SILVA LAVOURA PROF,161156,"R GUILHERME LUIZ DE CARVALHO, SN - VL BELA - 06288220"
72477,FRANCISCO CASABONA PROFESSOR,161157,"FRANCISCO HARO ALAMINOS, 276 - AYROSA - 06290050"
72478,BENEDICTO WESCHENFELDER,161158,"RUA RIO TOCANTINS, SN - JD PIRATININGA - 06236060"
125823,NEWTON ESPIRITO SANTO AYRES PROFESSOR,161159,"IMPERIAL, SN - SANTO ANTONIO - 06130140"
72479,LUCY ANNA CARROZO LATORRE PROFESSORA,161160,"MIOSOTIS, 431 - JARDIM DAS FLORES - 06110230"
72480,JOSE CELESTINO ARANHA,161161,"RODOVIA OSWALDO CRUZ, KM 05 - HORTO FLORESTAL - 11680000"
72481,FLORENTINA MARTINS SANCHEZ PROFESSORA,161162,"RUA BENEDITO HENRIQUE, 340 - PEREQUE MIRIM - 11680000"
72482,ALTIMIRA SILVA ABIRACHED PROFA,161163,"RUA ROBILLARD DE MARIGNY, 501 - ITAGUA - 11680000"
72483,SEMIRAMIS PRADO DE OLIVEIRA PROFESSORA,161164,"RUA GUILHERME CRISPIM DE MENEZES, 60 - SACO DA RIBEIRA - 11680000"
72484,AUREA MOREIRA RACHOU PROFESSORA,161165,"RUA PADRE JOAO BAYLE, 1763 - SERTAO QUINA - 11680000"
72485,PLINIO GONCALVES DE OLIVEIRA SANTOS,161166,"RUA PEDRO ESBORIOL,  - JUQUEHY - 11623271"
72486,DEOLINDO DE OLIVEIRA SANTOS CAPITAO,161167,"RUA CONCEICAO, 844 - CENTRO - 11680000"
72487,GABRIEL RIBEIRO DOS SANTOS DOUTOR,161168,"RUA MAJOR JOAO NOGUEIRA DE LIMA, 145 - PEREQUE - 11630000"
72489,EVA ESPERANCA SILVA,161169,"RANGELINA PINTO OLIVEIRA, 409 - AGUA BRANCA - 11630000"
72490,ESTEVES DA SILVA DOUTOR,161170,"RUA JORDAO HOMEM DA COSTA, 2 - CENTRO - 11680000"
72491,WALKIR VERGANI,161171,"PRACA ELPIDIO ROMAO TEIXEIRA,  - BOICUCANGA - 11618077"
72492,MARIA FRANCISCA SANTANA DE MOURA TAVOLARO PROFA,161172,"RUA SAO NICOLAU, 567 - PONTAL DA CRUZ - 11600000"
127811,MARIA JOSE DA PENHA FRUGOLI PROFESSORA,161173,"AVENIDA VEREADOR EMILIO GRANATO,  - ENSEADA - 11602170"
72493,EDUARDO CORREA DA COSTA JUNIOR DOUTOR,161174,"ELVIRA PERPETUA, S/N - JARDIM PROGRESSO - 11674670"
72494,CARLOS DE ALMEIDA RODRIGUES DR,161175,"AV PERNAMBUCO, 1101 - INDAIA - 11665070"
72495,ADALY COELHO PASSOS PROFA,161176,"PRACA CANDIDO MOTA, 72 - CENTRO - 11660060"
127812,THOMAZ RIBEIRO DE LIMA,161177,"PACIFICO WAGNER FREI, 757 - CENTRO - 11660280"
72496,ALCIDES DE CASTRO GALVAO,161178,"RUA BENEDITO ZACARIAS AROUCA, 255 - SUMARE - 11661100"
72497,LEONARDO REALI PREFEITO,161179,"ROD GOV JANIO SQUADROS, 4080 - ARMACAO - 11630000"
72498,HENRIQUE BOTELHO,161180,"RUA CARAGUATATUBA, 203 - BCENTRO - 11600000"
128432,MAISA THEODORO DA SILVA PROFESSORA,161181,"RUA CARAGUATATUBA,  - VILA AMELIA - 11609045"
72499,NAIR FERREIRA NEVES PROFESSORA,161182,"AVENIDA MANOEL TEIXEIRA,  - SAO FRANCISCO DA PRAIA - 11629520"
72500,BENEDITO MIGUEL CARLOTA,161183,"HERMAN PEREIRA DE FARIA, 200 - MASSAGUACU - 11677498"
125824,AVELINO FERREIRA,161184,"AVENIDA JOSE HERCULANO, 6605 - JARDIM PORTO NOVO - 11667000"
72501,ISMAEL IGLESIAS,161185,"AVENIDA MANOEL SEVERINO DE CASTRO, 631 - BARRANCO ALTO - 11670000"
69900,VILA PARISI,161186,"R DA UNIAO, 670 - V PARISI - 11500000"
74153,HUMBERTO DE ALENCAR CASTELLO BRANCO MARECHAL,161187,"MARIA GRAZIELA, SN - JARDIM CASQUEIRO - 11533150"
72505,AFONSO SCHIMIDT,161188,"BERNARDO PINTO, 94-96 - VILA PAULISTA - 11510260"
72507,BAIRRO DO BREJAO,161189,"BREJAO, SN -  - 12400000"
125825,JACINTO DO AMARAL NARDUCCI PROF,161190,"AV PRESIDENTE TANCREDO NEVES, 705 - CACHOEIRA - 11435000"
125826,RENE RODRIGUES DE MORAES PROFESSOR,161191,"RUA DOUTOR CARLOS NEHRING, 165 - JARDIM HELENA MARIA - 11431090"
127813,JOSE CAVARIANI PROFESSOR,161192,"RUA NANCY DE FATIMA POWILLEIT, 90 - SITIO PAECARA VICENTE DE CARVALHO - 11460490"
72508,JAYME JOAO OLCESE,161193,"RUA SALGADO FILHO, 96 - JARDIM ANCHIETA - 11500270"
74184,WALTER SCHEPIS PROFESSOR,161194,"RUA JOANA MENEZES DE MELLO FARO, 867 - SITIO PAECARA - 11462000"
72509,NOSSA SENHORA DOS NAVEGANTES,161195,"ORLANDO BOTELHO RIBEIRO, 2008 - SANTA CRUZ DOS NAVEGANTES - 11425150"
72510,THEREZA SILVEIRA DE ALMEIDA PROFESSORA,161196,"RUA SANTO ANTONIO, 41 - VILA JULIA - 11440080"
72511,DINIZ MARTINS PROFESSOR,161197,"RUA LINS, 57 - VILA AUREA - 11454590"
72512,EMIDIO JOSE PINHEIRO PROFESSOR,161198,"CARLOS NERHING DOUTOR, 1293 - VILA SANTA ROSA - 11431091"
72513,PAULO CLEMENTE SANTINI,161199,"RUA MARIO MALHEIRO, 1 - JARDIM PRAIANO - 11440300"
125827,RAQUEL DE CASTRO FERREIRA PROFESSORA,161200,"LEOMIL, 131 - CENTRO - 11410160"
72514,PHILOMENA CARDOSO DE OLIVEIRA PROFESSORA,161201,"GUILHERME BACKEUSER, 250 - SITIO PAECARA VICENTE DE CARVALHO - 11450410"
72515,GALDINO MOREIRA PROFESSOR,161202,"RUA MARIA ALZIRA DA CONCEICAO, 426 - PARQUE ENSEADA - 11443290"
72516,MARCILIO DIAS,161203,"ERNESTINA AMADEU SANTOS, 50 - VILA ALICE VICENTE DE CARVALHO - 11450160"
72517,VICENTE DE CARVALHO,161204,"PUGLISI, 188 - CENTRO - 11410000"
72518,ANTONIO ORTEGA DOMINGUES,161205,"RUA MARTIM AFONSO, 160 - J D CASQUEIRO - 11500000"
125828,ARMANDO BELLEGARD PROFESSOR,161206,"RUA BARTOLOMEU FERNANDES GONCALVES, 600 - CENTRO - 11250270"
72519,WILLIAM AURELI,161207,"RUA ANTONIO GIRAUD, S/N - RIO DA PRAIA - 11256090"
72520,JULIO CONCEICAO,161208,"ANA NERI, 107 - VILA COUTO - 11510150"
72521,LINCOLN FELICIANO,161209,"AVENIDA NOSSA SENHORA DA LAPA, 606 - VILA NOVA - 11525000"
72522,ZENON CLEANTES DE MOURA PROFESSOR,161210,"RUA DO ALOJAMENTO, 137 - FABRIL - 11543100"
72523,TANIA SUSI BONAVITA PROFA,161211,"RUA MARECHAL DEODORO, 245 - V ELIZABETH - 11550010"
72524,EDUARDO GOMES MARECHAL DO AR,161212,"CASTELO BRANCO, SN - JARDIM CUNHAMBEBE VICENTE DE CARVALHO - 11450010"
125829,HUGO SANTOS SILVA DOUTOR,161213,"RUA ANTONIO MARIA MARTINS, 171 - VILA LUIS ANTONIO - 11420425"
72525,JOSE DA COSTA PROFESSOR,161214,"RUA ALMIRANTE BARROSO, SN - JARDIM TRINTA E UM DE MARCO - 11515060"
72526,MARIA HELENA DUARTE CAETANO PROFESSORA,161215,"ONZE, 200 - COTA 200 - 11548000"
72527,AZEVEDO JUNIOR,161216,"RUA DOM PEDRO I, 50 - VILA BELMIRO - 11075550"
72528,CESARIO BASTOS DR,161217,"PC NARCISO DE ANDRADE, SN - VL MATIAS - 11013560"
72529,SAO LEOPOLDO VISCONDE DE,161218,"JOAO GUERRA, 251 - MACUCO - 11015131"
72530,DOS ANDRADAS,161219,"R ALMIRANTE ERNESTO DE MELLO JUNIOR, 130 - APARECIDA - 11035300"
125830,LUIZA MACUCO DONA,161220,"AVENIDA PROFESSOR ARISTOTELES MENEZES, SN - PONTA DA PRAIA - 11035030"
72534,JOSE CARLOS DE AZEVEDO JUNIOR DR,161221,"RUA NICOLAU MORAN, 21 - JD SAO MANOEL - 11095070"
74214,BENEVENUTO MADUREIRA PROFESSOR,161222,"MARIA COELHO LOPES, SN - SANTA MARIA - 11089030"
72535,SUETONIO BITTENCOURT JUNIOR PROFESSOR,161223,"PRACA VISCONDE DE OURO PRETO, SN - ESTUARIO - 11025190"
72536,NEVES PRADO MONTEIRO,161224,"ESTADO DE ISRAEL, SN - VILA SAO JORGE - 11085710"
125831,FERNANDO DE AZEVEDO PROFESSOR,161225,"CORDOVIL FERNANDES LOPES, 68 - CASTELO - 11087160"
127814,PRIMO FERREIRA PROFESSOR,161226,"RUA DOM PEDRO I, 58 - VILA BELMIRO - 11075550"
72537,CANADA,161227,"MATO GROSSO, 163 - BOQUEIRAO - 11055011"
72538,BRAZ CUBAS,161228,"HEITOR PENTEADO, 62 - MARAPE - 11070080"
72539,AVELINO DA PAZ VIEIRA PROF,161229,"RUA SETE DE SETEMBRO, 22 - VILA NOVA - 11013350"
72540,PAULO FILGUEIRAS JUNIOR DOUTOR,161230,"FRANCISCO DE BARROS MELLO, SN - CASTELO - 11087450"
72541,LUIZ HIPOLITO PROFESSOR,161231,"JOAO BATISTA BAZANELLI, SN - VILA DAINESE - 13469305"
72542,ALZIRA MARTINS LICHTI PROFESSORA,161232,"TORQUATO DIAS, 566 - MORRO DE NOVA CINTRA - 11080300"
72543,ANTONIO ABLAS FILHO DOUTOR,161233,"BARTOLOMEU DE GUSMAO, 107 - APARECIDA - 11045401"
72544,BARNABE,161234,"PRACA CORREA DE MELO, SN - CENTRO - 11013220"
72545,BARTOLOMEU DE GUSMAO PADRE,161235,"ITANHAEM, 394 - CHICO DE PAULA - 11085160"
125832,MARQUES DE SAO VICENTE,161236,"AVENIDA DOUTOR BERNARDINO DE CAMPOS, 569 - CAMPO GRANDE - 11065003"
72546,PEDRO CRESCENTI PROF,161237,"AV BRIGADEIRO FARIA LIMA, SN - J RADIO CLUBE - 11080300"
72547,FRANCISCO MEIRA PROFESSOR,161238,"LUIZ SOARES, SN - RADIO CLUB - 11088090"
72548,SILVIA JORGE POLLASTRINI PROFESSORA,161239,"RUA PROFESSORAALICE T C SARAIVA, 32 - JARDIM BELAS ARTES - 11740000"
72549,EUGENIA PITTA RANGEL VELOSO PROFA,161240,"AV JOSE BATISTA CAMPOS, 1320 - C ANCHIETA - 11740000"
72550,VILA MIRIM,161241,"R VINTE E TRES DE OUTUBRO, 176 - VL MIRIM - 11704820"
72551,CIDADE DA CRIANCA,161242,"RODPMANOEL DA NOBREGA, KM 85 - SOLEMAR - 11720760"
72552,FAZENDA MAMBU,161243,"FAZENDA MAMBU, SN - FAZENDA MAMBU - 11740000"
72553,BENEDITO CALIXTO,161244,"AVENIDA RUI BARBOSA, 180 - CENTRO - 11740000"
125833,FRANCISCO MARTINS DOS SANTOS,161245,"AVENIDA PRESIDENTE KENNEDY, 17200 - FLORIDA - 11708000"
72554,DAGOBERTO NOGUEIRA DA FONSECA,161246,"RUA PADRE DE CONDE, SN - JARDIM SUARAO - 11740000"
72555,JON TEODORESCO PROFESSOR,161247,"AVENIDA TIRADENTES, 46 - JARDIM MOSTEIRO - 11740000"
72556,ILDEFONSO GUIMARAES FIGUEIRA PROF,161248,"RUA MALEURICO G DUTRA, 836 - JD MATHILDE - 11700330"
72557,ABRAHAO JACOB LAFER DOUTOR,161249,"RUA LEME, 9562 - GUILHERMINA - 11701470"
127815,ALFREDO REIS VIEGAS DOUTOR,161250,"OLGA DE ALMEIDA MACHADO, SN - VILA SONIA - 11722200"
128433,ANTONIO MOREIRA COELHO DEPUTADO,161251,"PRACA NOSSA SENHORA APARECIDA, SN - VILA FATIMA - 11355340"
72558,ENIO VILAS BOAS PROFESSOR,161252,"JOSE JOAQUIM DE AZEVEDO, 1166 - CIDADE NAUTICA - 11355040"
72559,RENAN ALVES LEITE PROF,161253,"AV ALCIDES ARAUJO, 1030 - JD PARAISO - 11370200"
72560,OCTAVIO DE CESARE PROF,161254,"RUA TENDURVAL DO AMARAL, 183 - CATIAPOA - 11390300"
69928,UNIAO CIVICA FEMININA,161255,"PRACA RUI BARBOSA, SN - PRQ S VICENTE - 11360040"
74273,MARIA THEREZA DA CUNHA PEDROSO PROFESSORA,161256,"VITORIA DE SANTO ANTAO, SN - CATIAPOA - 11370480"
72564,JOSE NIGRO PROFESSOR,161257,"TRAVESSA DO PARQUE, SN - CATIAPOA - 11365330"
72565,ZULMIRA DE ALMEIDA LAMBERT PROFESSORA,161258,"CAMPOS, SN - JARDIM INDEPENDENCIA - 11380560"
72566,ZINA DE CASTRO BICUDO PROFA,161259,"PRACA CORONEL LOPES, 387 - CENTRO - 11310020"
72567,ARMINDO RAMOS,161260,"RUA SERGIPE, 131 - SAMARITA - 11345050"
72568,JARDIM BOPEVA,161261,"MONTEIRO LOBATO, 883 - OCIAN - 11704150"
72569,SITIO DO CAMPO,161262,"AV PROF OLAVO P BORGES, 339 - SITIO DO CAMPO - 11725410"
125834,AUGUSTO PAES D AVILA REVERENDO,161263,"RUA DOUTOR JULIO DE MESQUITA FILHO, 729 - AVIACAO - 11702350"
72570,AUGUSTO DE SAINT HILAIRE,161264,"AV MARTINS FONTES, 1000 - CATIAPOA - 11340010"
72571,MARTIM AFONSO,161265,"JOSE BONIFACIO, 102 - CENTRO - 11310080"
125835,LAUDELINO FERNANDES DOS SANTOS PROFESSOR,161266,"RUA SAO BENEDITO, 762 - CAICARA - 11706250"
128434,MARIA PACHECO NOBRE PROFESSORA,161267,"GUANABARA, 200 - BOQUEIRAO - 11700030"
128435,YOLANDA CONTE PROFESSORA,161268,"JOSE ADRIANO MARREY JUNIOR, 503 - ESPLANADA DOS BARREIROS - 11340310"
72572,JOSE CESARIO PEREIRA FILHO,161269,"AV WASHINGTON LUIZ, 855 - VILA ATLANTICA - 11730000"
72573,ARACY DA SILVA FREITAS PROFESSORA,161270,"AVENIDA SAO PAULO, 1774 - CENTRO - 11730000"
72574,JOSE VENEZA MONTEIRO,161271,"RUA FIRMINO PSANTOS, 322 - JD VENEZA - 11750000"
72575,TEREZINHA RODRIGUES KALIL PROFA,161272,"AV DOMINGOS CGRIMALDI, 80 - JD BRASIL - 11750000"
72576,FRANCISCO PEREIRA DA ROCHA DOUTOR,161273,"RIACHUELO, 110 - JARDIM DOS PRADOS - 11750000"
72577,MARGARIDA PINHO RODRIGUES,161274,"RUA DOUTOR POLYDORO DE OLIVEIRA BITTENCOURT, 300 - VILA MARGARIDA - 11330570"
72578,LUCIO MARTINS RODRIGUES PROF,161275,"RODAIR MULLER A MARQUES, 434 - V MARGARIDA - 11330690"
125836,ARMANDO VICTORIO BEI,161276,"CARIJOS, 1020 - PARQUE SAO VICENTE - 11360100"
72579,CONSTANTE LUCIANO CLEMENTE HOULMONT PROF,161277,"AV ANTONIO EMERICK, 504 - VILA VALENCA - 11380000"
72580,LEOPOLDO JOSE DE SANT ANNA PROFESSOR,161278,"RUA PROFESSOR JOSE GONCALVES PAIM, 60 - PARQUE BITARU - 11310340"
72581,REYNALDO KUNTZ BUSCH DR,161279,"PRACA GUARANI, 31 - BOQUEIRAO - 11701170"
72582,HERMOGENES MAJOR,161280,"IPIRANGA, SN - VILA PAULISTA - 12701210"
72583,HUMBERTO TURNER,161281,"LUIZ BITTENCOURT, 525 - ITAGACABA - 12730160"
72584,VIRGILIO ANTUNES PROF,161282,"ANTONIO PINTO, 302 - VILA DOUTOR JOAO BATISTA PARTE ALTA - 12720100"
125837,MARIO DA SILVA PINTO DR,161283,"NICOTA FORTES DONA, 235 - VILA ANA ROSA NOVAES - 12705170"
72585,HORTA CORONEL,161284,"RUA MANOEL MACHADO, 680 - CENTRO - 12760000"
72586,TONICO VARAJAO PROF,161285,"AVPREFJOAQUIM NOVAES, SN - DIST PINHEIROS - 12770000"
72587,JOSE DE PAULA FRANCA PROF,161286,"LADEIRA MANOEL RODRIGUES, 132 - CENTRO - 12800000"
72588,JOSE CARLOS DE OLIVEIRA GARCEZ CAPITAO,161287,"PCA FRANCISCO CHAGAS LIMA, 168 - CENTRO - 12800000"
72589,MIGUEL PEREIRA,161288,"PRACA CEL CUNHA LARA, 50 - CENTRO - 12830000"
125838,ADEMAR CAMPOS PROF,161289,"ROD TROPEIROS SP 66 K278, 900 - FORMOSO - 12840000"
72590,SAO LAURINDO VISCONDE,161290,"RUA JOAO R NOGUEIRA FRAGOSO, 77 - CENTRO - 12850000"
72591,NOGUEIRA COBRA CEL,161291,"RUA DR LEON GILSON, 33 - CENTRO - 12850000"
74303,VICENTE DE PAULA ALMEIDA,161292,"AVENIDA SEBASTIAO ANGELO COSTA, 701 - CENTRO - 12870000"
72595,OSWALDO CRUZ,161293,"OTAVIO RAMOS CAPITAO, 593 - CENTRO - 12701360"
72597,ARNOLFO AZEVEDO DR,161294,"AV MAJOR NOVAES, 126 - CENTRO - 12701330"
128436,JOSE RODRIGUES ALVES SOBRINHO DR,161295,"RUA DR CELESTINO, 1711 - VILA CANEVARI - 12710260"
72598,BARAO DA BOCAINA,161296,"RUA COMENDADOR SAMPAIO, 32 - CENTRO - 12820000"
72599,HILDEBRANDO MARTINS SODERO PROF,161297,"AVENIDA CYRO MOREIRA DE ANDRADE, 1461 - CENTRO - 12690000"
127817,SALGADO COMENDADOR,161298,"RUA PEDRO MARIA FILIPPO, 219 - VILA MARIANA - 12570000"
127818,EDGARD DE SOUZA DR,161299,"RUA ITACOLOMI, SN - ITAGUACU - 12570000"
125840,MARIA CONCEICAO PIRES DO RIO PROFA,161300,"RUA PADRE JOAO BATISTA, 93 - SANTA RITA - 12570000"
72600,AMERICO ALVES,161301,"PRACA PADRE VICTOR COELHO DE ALMEIDA, 113 - JARDIM SAO PAULO - 12570000"
72601,NAIR NOGUEIRA TEIXEIRA PROFA,161302,"PCA CAP OCTAVIO DE MELLO, SN - PEDRINHAS - 12500000"
72602,ANTONIO VIEIRA FILHO PROF,161303,"ESTVICINAL PLINIO G CES, SN - PILOES - 12500000"
72603,CLOTILDE AYELLO ROCHA PROFA,161304,"LOTEAMENTO SAO BENEDITO, 5000 - RETIRO - 12500010"
125841,MARIA DA CONCEICAO QUERIDO PROFA,161305,"RUA DR ALFREDO CASEMIRO DA ROCHA FILHO, 156 - CAJURU - 12530000"
72605,RODRIGUES ALVES CONSELHEIRO,161306,"RUA VISCONDE DE GUARATINGUETA, 224 - CENTRO - 12501290"
72606,RODRIGUES ALVES EMBAIXADOR,161307,"PRACA JOAQUIM VILELA, 470 - SAO BENEDITO - 12500000"
72607,JOAQUIM VILELA DE OLIVEIRA MARCONDES,161308,"AV PRESIDENTE VARGAS, 1375 - NOVA GUARA - 12515320"
72608,ERNESTO QUISSAK PROF,161309,"GUILHERME DE ALMEIDA, 1463 - ENGENHEIRO NEIVA - 12521180"
72609,MARIA DA CONCEICAO CURSINO PROFA,161310,"ROD PAULO VIRGINIO KM 30, SN - PARAITINGA - 12530000"
72610,JOSE BENEDITO AVERALDO GALHARDO PROF,161311,"RUA JOSE LUIZ CARLI, 30 - PEDREGULHO - 12500000"
72611,JOSE FELIX PROF,161312,"PRACA MIGUEL CORREA DOS OUROS, 32 - CENTRO - 12525000"
72612,VIRGILIO ROSAS DA SILVA PROF,161313,"AV RUI BARBOSA, 1573 - CAMPINHO - 12500000"
72613,ALCINA SOARES NOVAES PROFA,161314,"RUA PRINCESA ISABEL, 1030 - NOVA GUARA - 12500000"
125842,MARIA AMALIA DE MAGALHAES TURNER PROFA,161315,"BENEDITO MARTINIANO GONCALVES, 39 - CAMPINHO - 12502350"
72614,MARIA APARECIDA BROCA MEIRELLES PROFA,161316,"RUA ALVARES CABRAL, 321 - CAMPO GALVAO - 12500000"
72615,PAULO VIRGINIO,161317,"LADEIRA 20 DE ABRIL, 134 - CENTRO - 12530000"
128437,GERALDO COSTA,161318,"RUA DA PALHA, 40 - CAMPOS DE CUNHA - 12540000"
72616,CASEMIRO DA ROCHA DR,161319,"PRACA DO ROSARIO, 205 - CENTRO - 12530000"
72617,ANISIO NOVAES PROF,161320,"RUA JOAO APRIGIO COSTA, 139 - STA TEREZINHA - 12570000"
72618,MURILLO DO AMARAL PROF,161321,"TRAVESSA ANTONIO FILIPPO, SN - SAO ROQUE - 12570000"
72619,PAULINA CARDOSO PROFA,161322,"RUA CAPITAO EMIDIO MOREIRA, 153 - PONTE ALTA - 12570000"
72620,JOAQUIM DE CAMPOS PROF,161323,"RUA MAJOR VITORIANO, 6 - CENTRO - 12580000"
127819,NILO SANTOS VIEIRA PROF,161324,"SALVADOR, 345 - BELVEDERE CLUB DOS 500 - 12523460"
74333,RAIMUNDO PEREIRA DO NASCIMENTO PROF,161325,"RUA NOVE, 45 - JD ALVORADA - 12520000"
72623,ANDRE FREIRE PROF,161326,"ESTRVICINAL VDE PAULA P, SN - PIAGUI - 12500000"
72624,ANDRE BROCA PROF,161327,"RUA ROQUE VIEIRA, 83 - CENTRO - 12580000"
128438,CHICO PADRE,161328,"AVENIDA CORONEL MANOEL ANTONIO DOMINGUES DE CASTRO, 83 - CENTRO - 12130000"
72625,ANTONIO DA CRUZ PAYAO PROF,161329,"ESTADUAL PAULO VIRGILIO, KM 21 - ROCINHA - 12503790"
72626,DISTRITO DE JACIPORA,161330,"RUA OSVALDO CRUZ, SN - JACIPORA - 17910000"
72627,ROGERIO LACAZ PROF,161331,"GOIAS, SN - ESCOLA ESPECIALISTA DA AERONAUTICA - 12510110"
127820,FRANCISCO AUGUSTO DA COSTA BRAGA PROF,161332,"PEDRO CAPPIO, 72 - PEDREGULHO - 12515050"
72628,FLAMINIO LESSA DR,161333,"TAMANDARE, 145 - CENTRO - 12501150"
125843,GABRIEL PRESTES,161334,"RUA DUQUE DE CAXIAS, 189 - CENTRO - 12600040"
125844,CLIMERIO GALVAO CESAR PROF,161335,"GENESIO VALENTIM CORREA EXPEDICIONARIO, 340 - CRUZ - 12606420"
72629,LUIZ DE CASTRO PINTO PROF,161336,"RUA PROF JOSE MARQUES DE OLIVEIRA, SN - VILA PASSOS - 12605190"
72630,RICARDA GODOY LOPES PROFA,161337,"TRAVESSA ARLINDO DE MOURA, 97 - SANTO ANTONIO - 12600000"
72631,GUIMARAES ROSA,161338,"RMESTRE BOATTINE CHARLES, 56 - V MILITAR - 12620000"
72632,JOAO RENAUDIM DE RANVILLE PADRE,161339,"AV TIRADENTES, 1007 - VL CRISTINA - 12611000"
125845,LEONOR GUIMARAES PROFA,161340,"PRACA DOM PEDRO I, 130 - VILA CELESTE - 12620000"
72633,DARWIN FELIX PROF,161341,"RUA QUINTINO BOCAIUVA, 406 - VILA ESPERANCA - 12620000"
72634,ANTONIO JOAO,161342,"PRACA 15 DE JUNHO, 140 - CENTRO - 12620000"
72635,CARLOS LEONCIO DA SILVA PADRE,161343,"AV DOUTOR EPITACIO SANTIAGO, 199 - CENTRO - 12601050"
72636,DOMINGOS PAULA SILVA PROF,161344,"RUA CECILIA L FLEMING, 189 - QUILOMBO - 12630000"
72637,MARIA IZABEL FONTOURA,161345,"RUA SANTA CRUZ, 235 - EMBAU - 12630000"
72638,EVANGELISTA RODRIGUES DR,161346,"RDR BERNARDINO DE CAMPOS, 103 - CENTRO - 12630000"
72639,OLIVEIRA GOMES COMENDADOR,161347,"RUA JOAO VIEIRA BARROS JUNIOR, 2700 - PARQUE PRIMAVERA - 12630000"
72640,JUCA PADRE,161348,"PRACA EUCLIDES FIGUEIREDO, SN - VILA CARMEM - 12630000"
72641,MOREIRA LIMA CONDE DE,161349,"RUA DR RODRIGUES AZEVEDO, 436 - CENTRO - 12606020"
125846,ARNOLFO AZEVEDO,161350,"TOMAZ ALVES DE FIGUEIREDO, 350 - CIDADE INDUSTRIAL - 12609166"
72642,JOAQUIM FERREIRA PEDRO PROF,161351,"ANTONIO HADDAD, 703 - SANTO ANTONIO - 12608675"
72643,FRANCISCO PRUDENTE DE AQUINO PROF,161352,"R PROF FRANCISCO P AQUINO, 150 - CABELINHA - 12602220"
72644,ALICE VILELA GALVAO PROFA,161353,"RUA HOMERO ORTIZ MARCONDES, 470 - CENTRO - 12615000"
72645,PAULO VIRGINIO,161354,"LARGO BOM JESUS, 107 - MARGINAL ESQUERDA - 12630000"
72646,REGINA POMPEIA PINTO PROFA,161355,"RUA JOSE RODRIGUES FONTES, 128 - SAO JOAO - 12630000"
72647,FRANCISCO MARQUES DE OLIVEIRA JUNIOR PROF,161356,"RUA CARDEAL DOM CARLOS CARMELLO DE VASCONCELOS MOTTA, 5 - PARQUE RODOVIAS - 12605575"
128439,SEVERINO MOREIRA BARBOSA,161357,"AVENIDA DEOCLECIANO DA SILVA AZEVEDO, 333 - CENTRO - 12630000"
72648,JOAO PEDRO CARDOSO DR,161358,"R GODOFREDO PESTANA, 262 - JD ROSELY - 12410740"
72649,JOAO MARTINS DE ALMEIDA PROFESSOR,161359,"RUA FREI MAURICIO, 126 - JARDIM BOA VISTA - 12401080"
125847,PEDRO SILVA PROFESSOR,161360,"JOSE BENEDITO QUIRINO, SN - CAMPINAS - 12415030"
74362,JOSE VITA MONSENHOR,161361,"RUA JACAREI, 110 - ABERNESSIA - 12460000"
125848,ANTONIO NICOLA PADULA DR,161362,"AV ANTONIO NICOLA PADULA, 219 - VILA CAPIVARI - 12460000"
72652,DOMINGOS JAGUARIBE DR,161363,"AV EDUARDO MOREIRA DA CRUZ, 172 - VLNSRAFATIMA - 12460000"
72653,LUCILLA FLORENCE CERQUERA PROFA,161364,"AV MATHEUS DA COSTA PINTO, 1360 - SANTA CRUZ - 12460000"
72654,MARIA JULIA DA SILVA PROFA,161365,"PAIOL GRANDE, SN - PAIOL GRANDE - 12490000"
74392,CLARO CESAR DEPUTADO,161366,"OLIMPIO MARCONDES DE AZEREDO, 78 - LOTEAMENTO JOAO TAMBORINDEGUY FERNANDES - 12441030"
125849,GENESIO CANDIDO PEREIRA DOUTOR,161367,"PRACA GENERAL MARCONDES SALGADO, 57 - CENTRO - 12490000"
72655,THEODORO CORREA CINTRA PROFESSOR,161368,"RUA JOAQUIM CORREA CINTRA, 365 - VILA PAULISTA - 12460000"
72656,AMADEU CARLETTI JUNIOR,161369,"AV ESCOCIA, 251 - VILA BRITANIA - 12460000"
72657,RIBEIRO DA LUZ CEL,161370,"AVDR RUBIAO JUNIOR, 416 - CENTRO - 12490000"
72658,IRENE LOPES SODRE,161371,"RDR LUIZ CARLOS PINOTTI, 300 - V N S FATIMA - 12460000"
72659,DANTE GAZZETTA,161372,"RUA ARISTEU VALENTE, 133 - CENTRO - 13460000"
128440,MARIA FERREIRA SONNEWEND PROFESSORA,161373,"RUA MARIA LUIZA VALVANO AURICCHIO, 30 - CENTRO - 12250000"
72660,MARIO BULCAO GIUDICE PROFESSOR,161374,"RUA IMPERATRIZ LEOPOLDINA, 25 - BAIRRO DO SANTANA - 12403310"
72661,MARTINICO PRADO DR,161375,"AV FAZENDA CORUPUTUBA, SN - CORUPUTUBA - 12402901"
127821,ALZIRA FRANCO PROFESSORA,161376,"RUA CONDESSA DE VIMIEIRO, 122 - ALTO DO CARDOSO - 12420200"
72662,RYOITI YASSUDA,161377,"GUILHERME SCHMIDT, 340 - JARDIM ROSELY - 12410670"
72663,EURIPEDES BRAGA PROFESSOR,161378,"JOAO JOSE DE AZEVEDO MONSENHOR, 705 - CRISPIM - 12402010"
72664,ALFREDO PUJOL DOUTOR,161379,"RUA BARAO HOMEM DE MELLO, 63 - CENTRO - 12400440"
72665,MARIO TAVARES DOUTOR,161380,"GUILHERME NICOLETTI, 247 - VILA SAO BENEDITO - 12445120"
72667,RODRIGO ROMEIRO DOUTOR,161381,"PRUDENTE DE MORAES, 376 - CENTRO - 12400230"
72668,GABRIELLA MONTEIRO DE ATHAYDE MARCONDES PROFESSORA,161382,"CAPITAO AVELINO ALVES PEREIRA, SN - RIBEIRAO GRANDE - 12404018"
72669,JOAO JOSE DE AZEVEDO MONSENHOR,161383,"RODOVIA DOUTOR CAIO GOMES FIGUEIREDO, SN - BOM SUCESSO - 12404010"
72670,YOLANDA BUENO DE GODOY PROFESSORA,161384,"JOAO FRANCISCO DA SILVA, 2805 - FEITAL - 12441240"
127822,AFFONSO DE CARVALHO DESEMBARGADOR,161385,"AVENIDA ANTONIO JOAQUIM OLIVEIRA, 458 - CENTRO - 12450000"
72671,ANTONIO PORFIRIO DA SILVA PROF,161386,"ROD SP/50 B JOSE DA ROSA, 163KM - JOSE DA ROSA - 12450000"
