72672,ALCEU MAYNARD ARAUJO PROFESSOR,161387,"MIOSOTIS, 75 - JARDIM MOTORAMA - 12224100"
72673,EDEWALDO FREITAS GAIA SANT ANA PROFESSOR,161388,"ROSARIO, 540 - JARDIM AMERICA - 12235420"
72674,ZILDA ALTIMIRA SOCI PROFESSORA,161389,"LARGO DA BOA VISTA, 480 - BOA VISTA - 12213690"
72675,EUNICE CORDEIRO DOS SANTOS RODRIGUES PROFESSORA,161390,"RUA MAJOR MANOEL FERNANDES NETTO, 370 - VILA SAO GERALDO - 12213270"
72676,ILZA IRMA MOELLER COPPIO PROFESSORA,161391,"JAGUARI, 362 - VILA SINHA - 12212659"
72677,MARIA APARECIDA SANTOS RONCONI PROFA,161392,"R ANA GONCALVES DA CUNHA, 400 - JARDIM JUSSARA - 12215390"
74421,FELICIO SAVASTANO PROFESSOR,161393,"RUA CAPITAO RAUL FAGUNDES, 341 - MONTE CASTELO - 12215030"
72681,JORGE BARBOSA MOREIRA PROFESSOR,161394,"MARIA CANDIDA DELGADO, 10 - VILA CANDIDA - 12213531"
72682,JOSE VIEIRA MACEDO PROFESSOR,161395,"IPIAU, 162 - JARDIM SATELITE - 12230750"
72683,ANA CANDIDA DE BARROS MOLINA PROFESSORA,161396,"SAIGIRO NAKAMURA, 300 - VILA INDUSTRIAL - 12220280"
72684,PEDRO MAZZA PROFESSOR,161397,"ODETE MIMESSI, 160 - JARDIM DA GRANJA - 12227200"
74451,PEDRO MASCARENHAS DOUTOR,161398,"AMBROSIO MOLINA, 306 - EUGENIO DE MELLO - 12247000"
72685,EUCLIDES BUENO MIRAGAIA,161399,"RODOVIA DOS TAMOIOS, 470 - VILA NAIR - 12231590"
72686,FLAVIO BERLING MACEDO,161400,"RUA PARANA, 111 - VILA MARIA - 12209250"
72687,OLIMPIO CATAO,161401,"PRACA AFONSO PENA, SN - CENTRO - 12210090"
72688,FRANCISCO JOAO LEME,161402,"CONSTITUINTE, 37 - ALTO DA PONTE - 12212380"
125851,YOSHIYA TAKAOKA,161403,"JOSE BONIFACIO DE ARANTES, 272 - VILA PAIVA - 12213350"
72689,SANT ANA DO PARAIBA,161404,"GUARANI, 130 - SANTANA - 12211740"
72690,JOSE FORTUNATO DA SILVA RAMOS CONEGO,161405,"RODOVIA DOS TAMOIOS, 470 - VILA NAIR - 12231490"
72691,BARAO DE JACAREI,161406,"PRACA INDEPENDENCIA, 369 - SAO JOAO - 12300000"
125852,FRANCISCO GOMES DA SILVA PRADO DR,161407,"RUA BARAO DE JACAREI, 910 - CENTRO - 12308001"
72692,JOAQUIM FRANCO DE ALMEIDA CORONEL,161408,"RUA MAJOR GURGEL, 222 - CENTRO - 12270000"
72693,HERMINIA SILVA DE MESQUITA PROFA,161409,"JOSE BENEDITO DUARTE, 59 - PARQUE ITAMARATI - 12307200"
72694,BARAO DE SANTA BRANCA,161410,"R NESTOR SAMUEL OLIVEIRA, 193 - CENTRO - 12380000"
72695,FRANCISCA ROSA GOMES PROFA,161411,"RUA BRIGADEIRO AGUIAR, 508 - CENTRO - 12380000"
125853,ARMANDO D OLIVEIRA COBRA,161412,"TREZE DE MAIO, 295 - CENTRO  DISTRITO DE SAO FRANCISCO XAVIER - 12249000"
72696,ANGELO DE SIQUEIRA AFONSO,161413,"R PORTO PRINCIPE, 100 - VL RUBI - 12245120"
127823,MARIA LUIZA DE GUIMARAES MEDEIROS PROFESSORA,161414,"RUA SAO LUIZ GONZAGA, 89 - SANTANA - 12212200"
72697,MARIANA TEIXEIRA CORNELIO PROFA,161415,"RBENEDITO PEREIRA LIMA, 200 - V DIRCE - 12212700"
72698,WILMA RAGAZZI BOCCARDO PROFESSORA,161416,"BACABAL, 3550 - PARQUE INDUSTRIAL - 12235681"
72699,CARLOS PORTO CORONEL,161417,"LEITAO, 88 - CENTRO - 12327020"
72700,MAURICIO ANISSE CURY DOUTOR,161418,"AVENIDA ENGENHEIRO FRANCISCO JOSE LONGO, 832 - JARDIM SAO DIMAS - 12245001"
72701,POMPILIO MERCADANTE DR,161419,"TAMANDARE ALMIRANTE, 141 - SAO JOAO - 12322470"
125854,DOROTHOVEO GASPAR VIANNA PROF,161420,"PAULO DE OLIVEIRA BRANCO EXPEDICIONARIO, 130 - JARDIM DAS INDUSTRIAS - 12306020"
72702,JOAO FELICIANO,161421,"ALFREDO RAMOS, 40 - CENTRO - 12308420"
72703,LAMARTINE DELAMARE,161422,"RCAP JOAO JOSE DE MACEDO, 90 - CENTRO - 12300000"
72704,ANTONIO JOSE DE SIQUEIRA PROF,161423,"RODOVIA GENERAL EURYALE DE JESUS ZERBINE, 7019 - SAO SILVESTRE - 12340010"
72705,SILVIO SILVEIRA MELLO FILHO PROF,161424,"RUA DANTON SIQUEIRA MALTA, 380 - JD STA MARIA - 12300000"
72706,JOSE MARIOTTO FERREIRA MAJOR AVIADOR,161425,"PRACA MARECHAL EDUARDO GOMES, 50 - VILA DAS ACACIAS - 12228530"
72707,ILGA PUSPLATAIS PROFA,161426,"R UBERLANDIA, 465 - JD ISMENIA - 12220690"
125855,EDUARDO JOSE DE CAMARGO CORONEL,161427,"AVENIDA MAJOR JOAO  ELIAS DE CALAZANS, 190 - CENTRO - 12260000"
125856,SUELY ANTUNES DE MELLO PROFESSORA,161428,"SIQUEIRA CAMPOS, 845 - CENTRO - 12210250"
125857,IGNEZ SAGULA FOSSA PROFA,161429,"R DOUTOR PEDRO LUIZ DE OLIVEIRA COSTA, 1050 - LIMOEIRO - 12241430"
74481,RONDON MARECHAL,161430,"FRANCISCO ESCOBAR, 165 - MONTE CASTELO - 12215170"
72710,RUI RODRIGUES DORIA DOUTOR,161431,"OLIVO GOMES, 329 - VILA ALEXANDRINA - 12211290"
72711,FRANCISCO PEREIRA DA SILVA PROFESSOR,161432,"UIRAPURU, 131 - VILA TATETUBA - 12220190"
72712,JOAO CURSINO,161433,"AVENIDA ENGENHEIRO FRANCISCO JOSE LONGO, 782 - JARDIM SAO DIMAS - 12245001"
72713,BENEDITO RAMOS ARANTES CEL,161434,"MARIA HELENA MARCONDES, 65 - CENTRO - 12350000"
125858,DIRCEU JUNQUEIRA DE SOUZA PROF,161435,"AVENIDA JORGE MALAQUIAS PEREIRA, 62 - JARDIM NOVA ESPERANCA - 12324450"
72715,CERQUEIRA CESAR DOUTOR,161436,"RUA CORONEL CAMARGO, 125 - CENTRO - 12260000"
72716,BENEDITO MARIO CALAZANS PROF,161437,"VILA CAMARGO, SN - VILA CAMARGO - 12260000"
72717,CESAR COSTA DEPUTADO,161438,"GRANADEIRO GUIMARAES DOUTOR, 500 - QUIRIRIM - 12043380"
72718,ROQUE DE CASTRO REIS PROFESSOR,161439,"MANOEL DOS SANTOS, 369 - VILA REGEDOR - 12090800"
72719,JOAO ALVES MONSENHOR,161440,"HELVINO MORAES, 840 - VILA SAO JOSE - 12070450"
72720,QUIRINO DR,161441,"R RENATO BRAGA, 1290 - ESTIVA - 12050500"
72721,JOSE BENEDITO MARCONDES DE MATOS CEL,161442,"R FREI FELICISSIMO MARIA DO PRADO, 133 - BSQ SAUDE - 12082150"
128442,JUVENAL DA COSTA E SILVA PROF,161443,"R PROFESSORA JULIETA ROCHA VASQUEZ, 125 - JD INDEPENDENCIA - 12031400"
72722,FRANCISCA MOURA LUZ PEREIRA PROFESSORA,161444,"FERNANDO PESSOA, 435 - SANTA LUZIA - 12286717"
72723,QUEIROZ CORONEL,161445,"AVENIDA 7 DE SETEMBRO, 251 - CENTRO - 12170000"
125859,JOAO GONCALVES BARBOSA PROFESSOR,161446,"PRACA DA BANDEIRA, 195 - CENTRO - 12281630"
72724,FIGUEIRA DE TOLEDO,161447,"RUA JOSE LOPES FIGUEIRA DE TOLEDO, 45 - CENTRO - 12180000"
127824,ZELIA DE SOUZA MADUREIRA PROFA,161448,"R SARGENTO ANDIRAS NOGUEIRA, 67 - V PANTALEAO - 12280047"
72725,JOAQUIM RAPHAEL DE ARAUJO FILHO PROF,161449,"R FREI SERGIO, 110 - VL M JESUS - 12289006"
72726,JACQUES FELIX,161450,"DOMINGUES RIBAS, 1072 - VILA IAPI - 12060000"
72727,PEREIRA DE BARROS DOM,161451,"PCA 8 DE MAIO, 28 - CENTRO - 12020260"
72728,JOSE DE MOURA REZENDE MINISTRO,161452,"GONCALVES DIAS, 356 - VILA SANTOS - 12280015"
72729,LINDOLPHO MACHADO PROF,161453,"R DONA FRANCISCA DE ALMEIDA SANTOS, 180 - VL SANTOS - 12280010"
72730,LOPES CHAVES DR,161454,"R DOUTOR PEDRO COSTA, 164 - CENTRO - 12010160"
125860,AMADOR BUENO DA VEIGA,161455,"JOSE MARIA DE OLIVEIRA, 190 - PARQUE SANTO ANTONIO - 12061340"
72731,AMALIA GARCIA RIBEIRO PATTO PROFESSORA,161456,"AVENIDA SETE DE JANEIRO, SN - JARDIM SANTANA - 12120000"
72732,RUY BARBOSA,161457,"PC DOUTOR PEDRO DE TOLEDO, 136 - CENTRO - 12281500"
72733,LUIZ AUGUSTO DA SILVA PROF,161458,"R SANTA LUIZA DE MARILLAC, SN - VL S JOSE - 12070350"
72734,BERNARDINO QUERIDO PROFESSOR,161459,"AUGUSTA MOREIRA DE CASTRO GUIMARAES, 250 - PARQUE AEROPORTO - 12051170"
72735,DOMINGUES DE CASTRO CEL,161460,"AV CELESTINO DE C COELHO, 71 - CENTRO - 12140000"
125861,MANUEL CABRAL,161461,"PRACA DA REPUBLICA, SN - CENTRO - 12120000"
72738,MARIA VITORIA DE CAMPOS AZEVEDO PROFA,161462,"ESTR DO BAIRRO DO CHAPEU, SN - CATUCABA - 12150000"
127825,MONTEIRO LOBATO,161463,"RUA PROFESSOR CLOVIS WINTHER, 625 - JARDIM MARIA AUGUSTA - 12080480"
74510,URBANO ALVES DE SOUZA PEREIRA ENGENHEIRO,161464,"RUA ANTONIO RODRIGUES MIRANDA COMENDADOR, 170 - JARDIM INDEPENDENCIA - 12031580"
72739,ANTONIO MAGALHAES BASTOS,161465,"AVENIDA CORONEL FRANCISCO GOMES VIEIRA, 216 - ALTO SAO PEDRO - 12082250"
72740,MARIO CARDOSO FRANCO PROFESSOR,161466,"RUA EMBAIXADOR JOSE CARLOS DE MACEDO SOARES, 745 - CIDADE DE DEUS - 12091400"
72741,NEWTON CAMARA LEAL BARROS,161467,"NARIZINHO, 700 - JARDIM GURILANDIA - 12071400"
125862,DIOGENES RIBEIRO DE LIMA,161468,"RUA ANTONIO MOURA ROLIM, 97 - CENTRO - 18380000"
72743,NASCIMENTO SATIRO DA SILVA,161469,"AVENIDA IPORANGA, 386 - CENTRO - 18330000"
72744,JOAO ANTUNES ALEXANDRE,161470,"RUA AVELINO GOMES DE ALMEIDA, 75 - JARDIM CANUTO - 18310000"
72745,ELIAS LAGES DE MAGALHAES PROF,161471,"AVENIDA INDEPENDENCIA, 17 - CENTRO - 18360000"
72746,REGINA DIAS ANTUNES DA SILVA PROFA,161472,"RUA PEDRO NOLASCO DA SILVA, 232 - SANTA BARBARA - 18320000"
72747,LUIZ JOSE DIAS PROF,161473,"RUA ANGELO SANTOS PENTEADO, 378 - CENTRO - 18430000"
72748,ANTONIA BAPTISTA CALAZANS LUZ PROFA,161474,"RUA 1 DE MAIO, 894 - CENTRO - 18320000"
72749,AMADEU MENDES DR,161475,"RUA TENENTE MARTINS, 480 - CENTRO - 18320000"
72750,THEREZINHA SACCOMANO PASSARO PROFA,161476,"RUA SAO JOSE, 514 - CENTRO - 18310000"
125863,LUIZ DARLY GOMES DE ARAUJO PROFESSOR,161477,"RUA ODORICO CARDOSO DOS SANTOS, 75 - CENTRO - 11955000"
72751,PAULO FRANCISCO DE ASSIS PROF,161478,"RUA JOSE DE OLIVEIRA BARRETO, 172 - CENTRO - 18325000"
72752,AMBROSINA DE OLIVEIRA MATTOS PROFA,161479,"RUA ASTROGILDO A OLIVEIRA, 125 - DISTRITO DE ARACAIBA - 18320000"
72753,GONCALVES DIAS,161480,"RAUGUSTO FCO RCARNEIRO, O0096 - CENTRO - 18320000"
72754,DANUZIA DE SANTI PROFA,161481,"SAO BENEDITO, 549 - CENTRO - 18690000"
72755,ANTONIO LUIZ DUARTE,161482,"RUA JOAQUIM VIEIRA DE MEDEIROS, 1134 - CENTRO - 18720000"
72756,PAULO ARAUJO NOVAES DOUTOR,161483,"JOSE EUFRASIO LEAL, 46 - AGUA BRANCA - 18700300"
125864,ANTONIO TONON,161484,"RUA SAO BENEDITO, 452 - CENTRO - 18745000"
72757,JOAO MICHELIN,161485,"RUA MANOEL JOAQUIM GARCIA, 1045 - CENTRO - 18730055"
72758,JOAO CRUZ CORONEL,161486,"AVENIDA PREFEITO PAULO NOVAES, 871 - CENTRO - 18705000"
72759,PEDRO BENTO ALVES,161487,"RUA JOAO BATISTA PEREIRA, 603 - CENTRO - 18710011"
72760,PAULO DELICIO,161488,"RUA PEDRO DIAS BATISTA, 146 - CENTRO - 18770000"
127826,JOSE LEITE PINHEIRO PROFESSOR,161489,"PRACA MANOEL SOARES NOGUEIRA, 2 - CENTRO - 18760067"
72761,ANTONIO DE FREITAS FILHO PROFESSOR,161490,"AV SANTO ANTONIO, 1120 - CENTRO - 18730000"
72762,JOSE PENNA,161491,"RUA VINTE E QUATRO DE DEZEMBRO, 559 - CENTRO - 18740000"
72763,AVELINO APARECIDO RIBEIRO DOUTOR,161492,"PRACA DA MONCAO, 493 - CENTRO - 18775021"
72764,SALIM ANTONIO CURIATI,161493,"RDR ANTONIO F INOCENCIO, 394 - VILA MARTINS I - 18701510"
72736,ALICE FIUZA SOARES PROFA,161494,"CHACARA VERA CRUZ, SN - VERA CRUZ - 18700000"
125865,JOAO TEIXEIRA DE ARAUJO PROFESSOR,161495,"RUA ANTONIO GONCALVES GUERRA, 333 - BRABANCIA - 18704410"
72767,JULIETA TRINDADE EVANGELISTA PROFA,161496,"AVCEL JOAO QUINTINO, 513 - CENTRO - 18740000"
72768,AVELINO PEREIRA PROF,161497,"PRACA IRMAOS FERREIRA, 2 - CENTRO - 18760000"
72769,MANECO DIONISIO,161498,"PRACA JUCA NOVAES, 1141 - CENTRO - 18705020"
72770,VICTOR LAMPARELLI PROF,161499,"RUA PADRE MAURICIO, SN - BAIRRO ALTO - 18706090"
72771,BENE ANDRADE DONA,161500,"PARANAPANEMA, 150 - BRAZ II - 18701240"
72772,PAULO THOMAZ DA SILVA,161501,"PRACA DA BANDEIRA, 111 - CENTRO - 18690000"
125866,JOSE GONCALVES MENDES,161502,"PRACA CEL JOSE G MENDES, 800 - CENTRO - 18720000"
72773,HOLAMBRA II,161503,"DAS POSSES, 55 - CAMPOS DE HOLAMBRA - 18725000"
74568,MATILDE VIEIRA,161504,"PRACA CORONEL EDMUNDO TRENCH, 104 - CENTRO - 18701053"
72775,ANIZIO FERRAZ GODINHO PROF,161505,"PERNAMBUCO, 482 - CENTRO - 18570000"
72776,ANA PETILO MARACINI PROFA,161506,"RUA PEDRO SALGADO, SN - JUQUIRATIBA - 18570000"
72777,JOSE GOMES PINHEIRO,161507,"PRACA DA BANDEIRA, SN - CENTRO - 18600000"
72778,CARDOSO DE ALMEIDA DR,161508,"PC PROFESSOR MARTINHO NOGUEIRA, SN - CENTRO - 18600021"
72779,VALENTIM DO AMARAL,161509,"NELSON FERNANDES, 15 - CENTRO - 18620000"
72780,NAPOLEAO CORULE,161510,"TIRADENTES, 100 - CENTRO - 18640000"
72781,MANUEL JOSE CHAVES DR,161511,"IRMAS CINTRA, 956 - CENTRO - 18650000"
127828,JOAO BATISTA DE CAMARGO BARROS CEL,161512,"PRACA TIRADENTES, 149 - CENTRO - 18570000"
127829,LUCIO ANTUNES DE SOUZA DOM,161513,"VINTE E TRES DE SETEMBRO, 181 - VILA CARMELO - 18609510"
72782,ANSELMO BERTONCINI,161514,"JOSE RAMOS DE MELO, 27 - CENTRO - 18590000"
72784,CARDOSO DE ALMEIDA,161515,"PROFESSOR PEDRO TORRES, SN - CENTRO - 18600011"
72785,EUCLIDES DE CARVALHO CAMPOS PROF,161516,"ANGELINO DE OLIVEIRA, SN - VILA NOVA BOTUCATU - 18608224"
72786,AMERICO VIRGINIO DOS SANTOS PROF,161517,"JOAO RODRIGO DE SOUZA ARANHA, SN - VILA SANTANA - 18606003"
72787,JOAO QUEIROZ MARQUES PROF,161518,"JAIRO ZUCARI, SN - DISTRITO DE RUBIAO JUNIOR - 18618002"
72788,RAYMUNDO CINTRA PROF,161519,"TURMA SEIS, SN - VITORIANA - 18619970"
125869,ARMANDO DE SALLES OLIVEIRA DR,161520,"CONDE DE SERRA NEGRA, SN - JARDIM PEABIRU - 18611348"
72789,JOSE PEDRETTI NETTO PROF,161521,"VEIGA RUSSO, SN - JARDIM DONA NICOTA DE BARROS - 18611320"
72790,MITIZ CANEPELLE SANTAREM PROFA,161522,"USINA ACUCAREIRA SMANUEL, SN - US S MANUEL - 18650000"
72791,PEDRO AUGUSTO BARRETO PROF,161523,"CEL FRANCISCO RODRIGUES, 380 - CENTRO - 18670000"
72793,ANGELINO DE OLIVEIRA,161524,"RUA JAGUARIBE, 657 - VILA ANTARTICA - 18608680"
72794,RAFAEL DE MOURA CAMPOS,161525,"PRACA CARLOS GOMES, SN - CENTRO - 18600100"
127830,PEDRO TORRES PROF,161526,"AMANDO DE BARROS, SN - VILA SANTA TEREZINHA - 18602150"
74596,WALTER CARRER PROF,161527,"ABILIO RAMOS FILHO, 350 - CDHU II NUCLEO HABITACIONAL PROFESSOR JOSE INNOCENTI - 18650000"
128443,ATILIO INNOCENTI PROF,161528,"LUIZ RICARDO, 85 - VILA SANTA HELENA - 18650000"
74625,AUGUSTO REIS DR,161529,"AV IRMAS CINTRA, 925 - CENTRO - 18650000"
74654,MARTINHO NOGUEIRA PROF,161530,"R DOUTOR RAPHAEL SAMPAIO, 123 - BOA VISTA - 18600230"
72798,IVENS VIEIRA,161531,"RUA MAJOR PEREIRA DE MORAES, 1228 - CENTRO - 18240970"
72799,CASTANHO DE ALMEIDA CEL,161532,"RUA CORONEL ANDRADE, 152 - CENTRO - 18250000"
72800,CIA AGRICOLA SANTA HELENA SA,161533,"FAZENDA SANTA INES, 251 - FAZ STA INES - 18300000"
72801,FORTUNATO DE CAMARGO DR,161534,"RUA IRMAOS BASILE, 527 - CENTRO - 18240000"
72802,BERNARDES JUNIOR DESEMBARGADOR,161535,"ITAPETININGA, 51 - VILA ARRUDA - 18212198"
72803,PEIXOTO GOMIDE,161536,"PEIXOTO GOMIDE, 198 - CENTRO - 18200160"
125870,SEBASTIAO VILLACA PROF,161537,"ANTONIO BRUNETTI PADRE, 933 - VILA RIO BRANCO - 18208080"
72804,FERNANDO PRESTES CEL,161538,"PEIXOTO GOMIDE, 250 - CENTRO - 18200160"
72805,OSCAR KURTZ CAMARGO,161539,"RUA JOAQUIM AMANTINO FERREIRA, 317 - CENTRO - 18315000"
72806,ADHERBAL DE PAULA FERREIRA,161540,"PEIXOTO GOMIDE, 126 - CENTRO - 18200160"
72807,SEBASTIAO PINTO PROF,161541,"RUBENS VIEIRA DA SILVA, SN - VILA SANTANA - 18210026"
72808,ABILIO FONTES PROF,161542,"JOAO BATISTA DE MACEDO MENDES DOUTOR, SN - VILA ROSA - 18200560"
72809,ARLINDO VIEIRA PADRE,161543,"RUA CAMPOS SALLES, 1141 - CENTRO - 18300410"
72810,FLORA PRESTES CESAR PROFA,161544,"RUA NOSSA SENHORA DAS DORES, 390 - CENTRO - 18225000"
72811,ARCYPRESTE RUGGERI PROF,161545,"RUA RUI BARBOSA, 305 - CENTRO - 18230000"
72812,BAIRRO DA PONTE ALTA 3,161546,"PONTE ALTA, SN -  - 12400000"
125871,DARCY VIEIRA,161547,"FRANCISCO RODRIGUES JUNIOR, 289 - VILA BARTH - 18205590"
72813,VIRGILIO SILVEIRA PROF,161548,"RUA JOAO GALDINO DE CAMARGO, 203 - RECHA - 18217000"
72815,JOSE GOMIDE DE CASTRO,161549,"RUA DR FERNANDO COSTA, 907 - CENTRO - 18230000"
72816,CORINA CACAPAVA BARTH PROFA,161550,"RUA DOUTOR COUTINHO, 1370 - VILA JUDITH - 18200358"
72818,FONSECA MAJOR,161551,"RUA VENANCIO AYRES, 108 - CENTRO - 18200013"
125872,ERNESTA XAVIER RABELO ORSI PROFA,161552,"RUA JUVENAL ROLIN CYRENEU, 42 - JARDIM ITALIA - 18201600"
72819,RENATO DA ROCHA MIRANDA,161553,"RUA PRUDENTE ALVES, SN - CENTRO - 18245000"
72820,RAUL VENTURELLI DOUTOR,161554,"YOITI IKEDA, 170 - JARDIM CRUZEIRO - 18305485"
72821,JACYRA LANDIM STORI DONA PROFA,161555,"RUA BENJAMIN CONSTANT, 631 - CENTRO - 18300000"
72822,MODESTO TAVARES DE LIMA PROF,161556,"RUA ACACIO DE MORAES TERRA, 376 - JARDIM PAULISTA - 18214385"
72823,NESTOR FOGACA,161557,"RUA RUI BARBOSA, 322 - CENTRO - 18230000"
72824,LAZARO SOARES PROFESSOR,161558,"RUA FABRICIO VIEIRA DE LIMA, 298 - CENTRO - 18470000"
72825,ERCILIA VIEIRA DE CAMARGO PROFA,161559,"BAIRRO DA CRUZ DA PENHA, SN - CRUZ DA PENHA - 18460000"
127831,APARICIO BIGLIA FILHO PROFESSOR,161560,"RUA MANOEL TEIXEIRA FERNANDES, 40 - CENTRO - 18475000"
128444,ADELAIDE DE OLIVEIRA TERRON PROFA,161561,"PRACA ANTONIO PRATIANO, SN - STA CRUZ LOPES - 18460000"
125873,EPAMINONDAS FERREIRA LOBO DOUTOR,161562,"MAJOR SALVADOR RUFINO, 59 - VILA OSORIO - 18462056"
74682,HERCULANO PIMENTEL DOUTOR,161563,"RUA SAO PEDRO, 2484 - CENTRO - 18460009"
72828,TOME TEIXEIRA,161564,"XV DE NOVEMBRO, 120 - CENTRO - 18460007"
72829,HEITOR GUIMARAES CORTES,161565,"JOAQUIM DIAS TATIT, 372 - CRUZEIRO - 18460310"
72830,EUGENIO DIAS TATIT PREFEITO,161566,"RUA HONORINA RUIVO HOLTZ, 319 - JD REGIANE - 18460000"
72831,MARIA DA SILVEIRA VASCONCELOS,161567,"RUA ITARARE, 421 - VILA OSORIO - 18460000"
72832,EPITACIO PESSOA,161568,"RUA FREI PACIFICO MONTEFALCO, 1551 - CENTRO - 18480000"
72833,VICENTE RUSSO DO AMARAL CEL,161569,"RAPARICIO FIUZA CARVALHO, 1056 - CENTRO - 18480000"
72834,JOSE LOPES FERNANDEZ,161570,"RUA IPERO, 297 - VILA NOVA - 18400000"
72835,OTAVIO FERRARI,161571,"RUA MARIO PRANDINI, 962 - CENTRO - 18400170"
72837,SIMPLICIANO CAMPOLIM DE ALMEIDA,161572,"RUA SALATIEL DAVID MUZEL, 1515 - CENTRO - 18435000"
72838,BARBARA VIDAL CESAR,161573,"RUA FRANCISCO LOURO, SN - TURIBA DO SUL - 18450000"
72839,GABRIEL PINTO DE FARIA PROFESSOR,161574,"RUA CORONEL ACACIO PIEDADE, 422 - CENTRO - 18440000"
72840,LEONCIO PIMENTEL,161575,"AVENIDA JOAO SIMON SOLA, 298 - CENTRO - 18440000"
72841,HELIO DE MORAIS PROF,161576,"RUA CONCHAS, 451 - VILA APARECIDA - 18400000"
125875,JEMINIANO DAVID MUZEL,161577,"RUA JOAO ANTUNES DE MOURA, 871 - JARDIM EUROPA - 18406470"
72842,NICOTA SOARES PROFESSORA,161578,"RUA ROSELANDIA,  - JARDIM BEVELDERE - 18401050"
72843,SILVIO MARIA DARIO DOM,161579,"R LUCAS DE CAMARGO, 419 - CENTRO - 18400340"
72844,MANOEL DE MORAES BARROS PROF,161580,"RUA UM, SN - V MARINGA - 18400000"
125876,JOSE VASQUES FERRARI PROFESSOR,161581,"HUMBERTO FASCETTI PROFESSOR, 120 - PARQUE CIMENTOLANDIA - 18409620"
72845,ZULMIRA DE OLIVEIRA PROFESSORA,161582,"RUA CAPAO BONITO, 99 - VILA BOM JESUS - 18400690"
72846,VITALINO DE BARROS CEL,161583,"RUA RUI BARBOSA, SN - CENTRO - 18290000"
72847,FRANCELINA FRANCO PROFESSORA,161584,"RUA OLIMPIO NOGUEIRA, 135 - CENTRO - 18290000"
72848,VICENTINA AZEVEDO MINHOTO PROFA,161585,"FAZ FLORA DE CAPAO BONITO, SN - FLOR NACIONAL - 18290000"
127832,SANDRA REGINA PIRES PROFESSORA,161586,"AVENIDA BRASILIA, 825 - CENTRO - 18490000"
72849,JULIETA SYDOW MONTEIRO PROFA,161587,"RUA BENJAMIM CONSTANT, SN - CENTRO - 18290000"
72850,CAETANO CARBONE PROFESSOR,161588,"RUA SOPHIA DIAS MENCK, 715 - SANTA TEREZINHA - 18466050"
72851,EUGENIO EUCLYDES PEREIRA DA MOTTA CORONEL,161589,"ANGELO DIANA, 120 - BAMBU - 18540000"
72852,ERMELINDA SILVEIRA MACHADO PROFA,161590,"R ANTHIGIO CAVECCHINI, 750 - PRQ RES P MEDICI - 13310140"
72853,PAULA SANTOS PROF,161591,"PRUDENTE DE MORAES, 1089 - VILA NOVA - 13322010"
72854,LEONOR FERNANDES DA SILVA PROFA,161592,"RUA BARAO DO RIO BRANCO, 1453 - VILA TEIXEIRA - 13320271"
74710,FRANCISCO NARDY FILHO,161593,"BARTIRA, 64 - VILA LEIS - 13309210"
72858,CICERO SIQUEIRA CAMPOS PROF,161594,"ALAMEDA ALICE, 111 - JARDIM ALBERTO GOMES - 13311170"
72859,PADRE BENTO,161595,"BENTO PADRE, 609 - VILA PADRE BENTO - 13313010"
72860,JOSE LEITE PINHEIRO JR PROF,161596,"GUANABARA, 91 - BRASIL - 13301499"
72861,ANTONIO BERRETA PROF,161597,"SOROCABA, 277 - VILA GATTI - 13300340"
72862,SECKLER MONSENHOR,161598,"AVENIDA MONSENHOR SECKLER, 59 - CENTRO - 18540000"
72863,PEDRO FERNANDES DE CAMARGO PROF,161599,"RUA JOAO MARINOMIO DE CAMARGO, 80 - VILA MARTELI - 18540000"
72864,ESMEDIO CORONEL,161600,"RUA ADHEMAR DE BARROS, 118 - CENTRO - 18540000"
72865,REGENTE FEIJO,161601,"ANDRADAS, 412 - CENTRO - 13300170"
72866,CLAUDIO RIBEIRO DA SILVA PROF,161602,"PRACA QUINZE DE NOVEMBRO, S/N - VILA TEIXEIRA - 13320299"
72867,TANCREDO DO AMARAL,161603,"AV DPEDRO II, 170 - CENTRO - 13320240"
72868,CONVENCAO DE ITU,161604,"PC CONDE DE PARNAIBA, SN - CENTRO - 13300679"
72869,CESARIO MOTTA DR,161605,"THOMAZ SIMON, 280 - CENTRO - 13300030"
125878,VITORIO TOGNI CAPITAO,161606,"ESTRADA 8 DO JACARE, 236 - JACARE - 13318000"
127833,LUCIDIO MOTTA NAVARRO,161607,"AVENIDA MARCIANO XAVIER DE OLIVEIRA, 107 - CENTRO - 13315000"
72870,ACYLINO AMARAL GURGEL PROF,161608,"WINSTON CHURCHIL, 490 - BELA VISTA - 13321370"
72871,ROQUE PLINIO DE CARVALHO PROF,161609,"FAZENDA CAPUAVA, 367 - FAZ CAPUAVA - 18540000"
128445,HORACIO MANLEY LANE,161610,"AVENIDA JOAO PESSOA, 556 - CENTRO - 18130290"
72872,BERNARDINO DE CAMPOS DR,161611,"RMAL DEODORO DA FONSECA, 132 - CENTRO - 18130000"
72873,FREDERICO MARCICANO,161612,"AVENIDA JOAO CIPULO, 51 - RESSACA - 18150000"
72874,BENEDICTO LUIZ BRAGA,161613,"RUA ADAO A GONCALVES, SN - RIO DE UNA - 18150000"
72875,JOSE GABRIEL MACHADO,161614,"BAIRRO DE SOROCABUCU, SN - SOROCABUCU - 18140000"
72876,BARAO DE PIRATININGA,161615,"RJOSE HENRIQUE DA COSTA, 252 - CAMBARA - 18130000"
125879,GERMANO NEGRINI PROFESSOR,161616,"AVENIDA SAO LUIZ, 108 - JARDIM VILLACA - 18135150"
72877,TIBERIO JUSTO DA SILVA PROF,161617,"RPROFA CELIA ASSE JACOB, 3 - MAYLASKY - 18130000"
72878,JOAQUIM DA SILVEIRA SANTOS PROF,161618,"VIA RAPOSO TAVARES KM 46, SN - JUCA ROCHA - 18130000"
125880,HUMBERTO VICTORAZZO PROFESSOR,161619,"RUA APARECIDA, 2 - CENTRO - 18147000"
72880,EUCLIDES MARIA BORBA,161620,"RODOVIA BUNJIRO NAKAO KM595, SN - VOTORANTIM - 18150000"
72881,LINO VIEIRA RUIVO,161621,"RODOVIA PRESIDENTE TANCREDO ALMEIDA NEVES, KM 13 - PIAI - 18150000"
72882,ISAURA KRUGER PROFA,161622,"AV SANTIAGO, 468 - V INDUSTRIAL - 18125000"
72883,LURDES PENNA CARMELO PROFESSORA,161623,"RODOVIA BUNJIRO NAKAO, KM87 - PARURU - 18150000"
72884,ROQUE BASTOS PROFESSOR,161624,"RUA GREGORIO ALMEIDA LIMA, 246 - CENTRO - 18150000"
72885,RODOVALHO COMENDADOR,161625,"RUA ANTONIO DIAS, 20 - VL PAULO DIAS - 18125000"
125881,EPAMINONDAS DE OLIVEIRA PROFESSOR,161626,"RUA HENRIQUE PINHEIRO, 8 - SAO JOAO NOVO - 18140004"
125882,EUCLIDES DE OLIVEIRA PROF,161627,"ROD PREF QUINTINO DE LIMA, KM-8 - CANGUERA - 18130000"
125883,HONORINA RIOS DE CARVALHO MELLO,161628,"RUA FLORIANO VIEIRA, 125 - JARDIM PROGRESSO - 18125000"
74739,HORACIO RIBEIRO PROF,161629,"AVBRASIL/JAPAO, 2530 - SETUBAL - 18120000"
74768,MARIA ANGERAMI SCALAMANDRE,161630,"RUA QUATRO, SN - JARDIM NOVA IBIUNA - 18150000"
72889,LAURINDA VIEIRA PINTO PROFESSORA,161631,"RUA VENEZUELA, 60 - JARDIM NOVA IBIUNA - 18150000"
72890,MANOEL MARTINS VILLACA PROF,161632,"AV DR GASPAR RICARDO JR, 172 - CENTRO - 18120000"
72891,TEREZA CARAMANTE CHESINE PROFA,161633,"RUA BRAULIO VDE MENEZES, 309 - MARMELEIRO - 18120000"
72892,ALTINA JULIA DE OLIVEIRA PROFESSORA,161634,"AVENIDA LAMARTINE NAVARRO, 556 - CENTRO - 18120000"
72893,JOAQUIM IZIDORO MARINS PROFESSOR,161635,"DOLORES BRUNO, 432 - VILA ANGELICA - 18065400"
72894,JOSE ODIN DE ARRUDA PROFESSOR,161636,"SALVADOR MILEGO, 400 - JARDIM VERA CRUZ - 18050010"
125884,GENESIO MACHADO PROFESSOR,161637,"RUA MIGUEL SUTIL, 527 - VILA SANTANA - 18080763"
72895,QUINZINHO DE BARROS,161638,"R JOAQUIM RODRIGUES DE BARROS, 477 - VL HORTENCIA - 18020282"
72896,EZEQUIEL MACHADO NASCIMENTO PROFESSOR,161639,"ANGELO ELIAS, 830 - JARDIM SANTA ROSALIA - 18090100"
72897,PORTO SEGURO VISCONDE DE,161640,"SOUZA PEREIRA, 188 - CENTRO - 18010320"
72898,VERGUEIRO SENADOR,161641,"FERNAO SALLES, 33 - VILA HORTENCIA - 18020266"
72899,JULIO PRESTES DE ALBUQUERQUE DOUTOR,161642,"AVENIDA DOUTOR EUGENIO SALERNO, 204 - CENTRO - 18035430"
72900,FRANCISCO CAMARGO CESAR,161643,"RIUSAKU KANIZAWA, 485 - LOPES DE OLIVEIRA - 18071286"
72901,ALTAMIR GONCALVES PROFESSOR,161644,"ASSIS CHATEAUBRIAND, 70 - JARDIM DAS MAGNOLIAS - 18044560"
125885,ACCACIO DE VASCONCELLOS CAMARGO PROFESSOR,161645,"BENEDITO DE OLIVEIRA,  00312 - APARECIDINHA - 18087261"
72902,FRANCISCO EUPHRASIO MONTEIRO,161646,"GUATEMALA, 313 - VILA BARCELONA - 18025310"
72903,HUMBERTO DE CAMPOS,161647,"SALVADOR STEFANELLI, SN - JARDIM ZULMIRA - 18061050"
72904,JOAO CLIMACO DE CAMARGO PIRES,161648,"RUA PROFESSOR ANTONIO PRUDENTE DE MORAES, 41 - VILA FIORI - 18080440"
72906,BRIGADEIRO TOBIAS,161649,"AZEVEDO FIGUEIREDO, 214 - BRIGADEIRO TOBIAS - 18108000"
125886,ARTHUR CYRILLO FREIRE DOUTOR,161650,"RUA VISCONDE DO RIO BRANCO, 1087 - VILA JARDINI - 18044000"
72907,JOSE QUEVEDO PROFESSOR,161651,"PARANA, 3726 - CAJURU DO SUL - 18105000"
72908,JOAO SOARES MONSENHOR,161652,"NHONHO PIRES, 250 - VILA LUCY - 18043060"
128446,MONTEIRO LOBATO,161653,"ANTONIO APARECIDO FERRAZ, 935 - PARQUE SANTA ISABEL - 18052280"
72909,AGGEO PEREIRA DO AMARAL PROFESSOR,161654,"HERCULES TAVARES, 389 - ALEM PONTE - 18013230"
72910,JOSE REGINATO PROFESSOR,161655,"MARGARIDAS, 414 - JARDIM SIMUS - 18055200"
72911,JULIO BIERRENBACH LIMA PROFESSOR,161656,"VICENTE FUNES MARINS, 95 - JARDIM SANTA ROSALIA - 18090030"
125887,LAURO SANCHEZ PROFESSOR,161657,"ARNALDO CUNHA, 237 - JARDIM NAIR - 18075240"
72912,LUIZ GONZAGA DE CAMARGO FLEURY PROFESSOR,161658,"NHONHO NEVES, 85 - JARDIM GUADALAJARA - 18045540"
125888,OCTAVIO NOVAIS DE CARVALHO PROF,161659,"ASSIS MACHADO, 920 - VILA HORTENCIA - 18020258"
127834,ESCOLASTICA ROSA DE ALMEIDA PROFESSORA,161660,"EMILIO RIBAS DOUTOR, 266 - VILA HARO - 18015205"
74798,OSSIS SALVESTRINI MENDES PROFESSORA,161661,"PAES DE LINHARES, 1198 - VILA FIORI - 18075630"
72916,ENEAS PROENCA DE ARRUDA PROFESSOR,161662,"ANTONIO MARCIANO DA SILVA, 215 - JARDIM MARIA DO CARMO - 18081200"
125890,ANTONIO MIGUEL PEREIRA JUNIOR,161663,"RUA ERICO VERISSIMO, 1050 - CENTRAL PARQUE SOROCABA - 18051100"
72917,ARQUIMINIO MARQUES DA SILVA PROFESSOR,161664,"SYLVIO ROMERO, 242 - JARDIM PAULISTANO - 18040610"
72918,LUIZ NOGUEIRA MARTINS SENADOR,161665,"RUA DOUTOR FERNANDO COSTA, 70 - VILA CARVALHO - 18060035"
72919,FRANCISCO COCCARO PROFESSOR,161666,"JOSE LUIZ FLAQUER, 601 - EDEN - 18103060"
72920,ANTONIO PADILHA,161667,"RUA PROFESSOR TOLEDO, 77 - CENTRO - 18035110"
72921,EGILDO PASCHOALUCCI VEREADOR,161668,"CARLOS MUCCINI, 123 - CENTRO - 18580000"
72922,MARIA DA CONCEICAO OLIVEIRA MARCONDES PROFA,161669,"R CONSTRUTOR JUSTO DEL SANTORO, 300 - JARDIM SAO LUIZ - 18276550"
72923,PLINIO RODRIGUES DE MORAIS,161670,"RUA DO COMERCIO, 373 - CENTRO - 18530000"
125891,LUIZ ANTUNES,161671,"RUA LUIZ FERNANDES DIOGO, 432 - CENTRO - 18530000"
72924,CARLINA ALVES DE LIMA PROFA,161672,"RUA PRESIDENTE KENNEDY, 79 - CENTRO - 18530000"
