72424,DIMARAES ANTONIO SANDEI PROFESSOR,182999,"RUA ARNALDO SERGIO CORDEIRO DAS NEVES, 105 - JARDIM PORTELA - 06694090"
72436,HENRIQUE SAMMARTINO ALFERES,183000,"MARIA APARECIDA PEDROSA, 35 - JARDIM ROSA EMILIA - 06608430"
126146,REPUBLICA DE EL SALVADOR,183032,"MAR VERMELHO, 1101 - JARDIM REGINA ALICE - 06412140"
124567,JOSE LEANDRO DE BARROS PIMENTEL,183021,"PRESIDENTE WASHINGTON LUIZ, 444 - JARDIM SILVEIRA - 06434000"
75441,JOAO NASCIF CHALUPP,183007,"FRANCISCO RODRIGUES PAES, 250 - AMADOR BUENO - 06680370"
72374,ALDEIA DE BARUERI,182991,"RUA RIO PARANA, 206 - NOVA ALDEINHA - 06440160"
75571,ELIZA DE OLIVEIRA RIBEIRO,183008,"RUA LUIZA PREBOTTI TASSO, 360 - PARQUE MIRAFLOR - 06683210"
127808,VICENTE THEMUDO LESSA PROFESSOR,183042,"JOAO BALHESTEIRO, 186 - CENTRO - 06600020"
72373,JOSE WILSON PADINHA PROFESSOR,182990,"DIOGENES RIBEIRO DE LIMA, 369 - JARDIM BELVAL - 06420250"
100719,AIR FERREIRA DO NASCIMENTO PROFESSOR,183014,"ELIAS ALVES DA COSTA, 799 - SAO JOAO - 06675200"
72438,OSWALDO SAMMARTINO,183002,"RUA ALBERTO RUFOLLO, 143 - VILA ANITA COSTA - 06600170"
72414,MARIA CRISTINA LOPES,182994,"RIO GRANDE DO SUL, 59 - JARDIM ALVORADA - 06612220"
75165,NERCY AMELIA MARTELINI DAHER PROFESSORA,183005,"RUA ALUIZIO DE AZEVEDO, 100 - VILA NOVA - 06550000"
126306,IRACEMA RAUEN MACIEL PROFESSORA,183038,"BENFICA, 295 - VILA SANTA RITA - 06660520"
123752,DOLORES GARCIA PASCHOALIN,183016,"RUA JOSE DE ALBUQUERQUE, 68 - JARDIM MASE - 06604150"
72419,CELINA DE BARROS BAIRAO PROFESSORA,182995,"EDUARDO DE ABREU, 101 - VILA DOUTOR CARDOSO - 06654440"
123913,MARIA SOARES SANTOS PROFESSORA,183019,"RUA NELSON EZEQUIEL DE FARIAS, 629 - JARDIM BRIQUET - 06655360"
72421,NACIF AMIN CHALUPE,182997,"RODOVIA ENGENHEIRO RENE BENEDITO SILVA, SN - VILA SANTA FLORA - 06683000"
124935,JOSEPHA PINTO CHIAVELLI PROFESSORA,183026,"JOAO BARBOSA, 243 - CENTRO - 06600070"
124786,GIUSEPPE ANGELO BERTOLLI PADRE,183025,"IMIRIM, 267 - JARDIM NOSSA SENHORA DE FATIMA - 06624010"
126264,MYRTHES THEREZINHA ASSAD VILLELA PROFA,183037,"FIRMO DE OLIVEIRA, 8 - CENTRO - 06401130"
74936,LENIO VIEIRA DE MORAES PROFESSOR,183004,"TABAJARA, 45 - JARDIM SANTA MONICA - 06434250"
74513,REPUBLICA DE CUBA,183003,"RUA GOVERNADOR ADHEMAR PEREIRA DE BARROS, 117 - JARDIM ITAQUITI - 06422020"
125131,PARQUE PAYOL,183028,"RUA ORLANDO BUCCI, 71 - PARQUE PAYOL I - 06550000"
72437,JOSE NEYDE CESAR LESSA DOUTOR,183001,"VARGAS PRESIDENTE, 900 - NOVA ITAPEVI - 06694000"
124690,PARQUE IMPERIAL,183023,"RUA MARTINS FONTES, 412 - PARQUE IMPERIAL - 06462080"
123772,PAULO DE ABREU,183018,"RUA ADILSON SOARES SANTOS, 70 - JARDIM JULIETA - 06653210"
123758,JARDIM PAULISTA,183017,"AVENIDA ANIBAL CORREIA, 2363 - JARDIM PAULISTA - 06447010"
76154,MARIO JOAQUIM ESCOBAR DE ANDRADE,183011,"PINHEIROS, 193 - PARQUE VIANA - 06449000"
123256,IGNES AMELIA OLIVEIRA MACHADO PROFESSORA,183015,"RUA LUIS BELLI, 800 - COHAB II - 06665080"
72420,AMERICO VALENTIN CHRISTIANINI,182996,"ROSEMARY BELLI, 1 - JARDIM SANTA RITA - 06660150"
72369,REPUBLICA DO EQUADOR,182989,"RUA MARIA HELENA, 155 - VILA ENGENHO NOVO - 06415100"
137354,WILMAR SOARES DA SILVA,183045,"GUARUJA, 400 - VILA SAO NICOLAU - 06620020"
134645,TEREZINHA PALONE DA SILVA DOMINGUES PROFA,183044,"BARUERIITAPEVI, SN - JARDIM NOSSA SENHORA DE FATIMA - 06624000"
125813,CLARO CAMARGO RIBEIRO,183030,"RUA BAMBINA AMIRABILLE CHALUPPE, 511 - AMADOR BUENO - 06680420"
127334,ITAJAHY FEITOSA MARTINS PROFESSOR,183041,"RENATA, 191 - PARQUE DOS CAMARGOS - 06436230"
75641,MANOEL AUGUSTO VIEIRA NETO DESEMBARGADOR,183010,"RUA MARQUES DE SANTO AMARO, 66 - VILA GODINHO - 06626130"
72413,DORVALINO ABILIO TEIXEIRA,182993,"RUA DORVALINO ABILIO TEIXEIRA, 327 - JARDIM SANTO ANTONIO - 06608000"
75639,ROMEO MECCA PADRE,183009,"RUA DOS CARIOCAS, 22 - PARQUE SUBURBANO - 06663440"
126216,MOACIR THOMAZ DA SILVA,183035,"ANA MARIA BONFADINI, 200 - JARDIM GABRIELA I - 06624320"
125809,JOSE CHALUPPE,183029,"LARGO ADELINA NUNES COELHO, 2 - VILA SAO FRANCISCO - 06654100"
72365,IVANI MARIA PAES PROFESSORA,182987,"RUA PROFESSORA IVANI MARIA PAES, 21 - VILA BOA VISTA - 06410070"
75214,JOSE THEOTONIO DOS SANTOS PROFESSOR,183006,"FRANCISCA M DA SILVA RIBEIRO, 140 - ESTANCIA SAO FRANCISCO - 06695510"
126319,MARY MALLET CYRINO PROFESSORA,183040,"AVENIDA SERRA DE PARIMA, 20 - JARDIM BELA VISTA - 06656050"
72423,RAUL BRIQUET DOUTOR,182998,"ESCOLASTICA CHALUPPE, 218 - CENTRO - 06653050"
95615,HENRIQUE FERNANDO GOMES ESTUDANTE,183013,"AVENIDA GIOVANI ATTILIO TOLAINE, 115 - VOTUPOCA - 06445000"
74757,ERVIN HORVATH DOUTOR,183057,"AMERICANA, 215 - CIDADE NOVA LOUZADA - 08589009"
72110,BATUIRA,183055,"TUPI, 95 - CENTRO - 08561060"
124059,JOSE OLYMPIO PEREIRA FILHO,183078,"AVENIDA FERNANDO VASCONCELOS ROSSI, 1711 - PEDREIRA - 08572000"
124060,MAURICIO ALVES BRAZ VEREADOR,183079,"PIXINGUINHA, 426 - JARDIM MARAGOJIPE - 08580230"
134001,CEL JTO A EE PAULO EDUARDO OLINTHO REHDER JORNALISTA,183104,"RUA SAO FRANCISCO, 280 - JARDIM RUTH - 08561610"
72103,MARGARIDA DE CAMILLIS,183054,"PORTUGAL, 261 - VILA VARELA - 08558200"
75224,CICERO ANTONIO DE SA RAMALHO PROFESSOR,183062,"FERRAZ DE VASCONCELOS, 1000 - VILA MONTE BELO - 08577540"
109419,CEL JTO A EE ZILDA BRACONI AMADOR PROFA,183103,"BATATAIS, 38 - VILA BARTIRA - 08577440"
128408,ZILDA BRACONI AMADOR PROFESSORA,183103,"BATATAIS, 38 - VILA BARTIRA - 08577440"
116102,CENTRO ATEND SOCIOEDUCATIVO AO ADOLESC TERRA NOVA CI,183071,"RUA ZAIRE, 208 - JARDIM ADRIANE - 08598740"
123648,AMERICO FRANCO,183075,"DOBRADA, 65 - JARDIM SAO JOSE - 08567360"
75308,KAKUNOSUKE HASEGAWA,183063,"SERRA DOS PARECIS, 200 - JARDIM PAINEIRA - 08581210"
72082,EDINA ALVARES BARBOSA PROFESSORA,183052,"RUA SAO ROQUE, 381 - VILA JAPAO - 08599020"
75630,IVONE DA SILVA DE OLIVEIRA PROFESSORA,183065,"PASTEUR, 70 - VILA JULIA - 08551030"
134662,CEEJA DE POA,183105,"CRISCIUMA, 29 - VILA CRISTELO - 08563540"
75408,MARIA APARECIDA FERREIRA PROFESSORA,183105,"CRISCIUMA, 29 - VILA CRISTELO - 08563540"
124431,DOMINGOS MILANO,183083,"RUA MANACA, 114 - JARDIM ODETE - 08598290"
124934,CLOVIS DA SILVA ALVES PROFESSOR,183086,"RUA PADRE BENTO, SN - JARDIM CAROLINA - 08588320"
75206,ESTANCIA PARAISO,183060,"PINHEIRINHO SUZANO, 3268 - PARQUE RECANTO MONICA - 08593000"
127416,CONDOMINIO RESIDENCIAL VILLAGE,183100,"RUA HENRIQUE GIOVANINI XAVIER, 250 - PARQUE RESIDENCIAL SCAFFID II - 08587770"
125149,PARQUE VIVIANE JARDIM ADRIANA,183094,"RONDA ALTA, 34 - PARQUE VIVIANE - 08582110"
124146,PAULO EDUARDO OLINTHO REHDER JORNALISTA,183081,"RUA SAO FRANCISCO, 280 - VILA RUTH - 08561610"
127968,CARMEN NETTO DOS SANTOS PROFESSORA,183102,"SAN GENARO, 320 - PARQUE RESIDENCIAL CALIFORNIA - 08584280"
124956,VILA ERCILIA ALGARVE,183088,"RIO GRANDE DO SUL, 465 - JARDIM DO ALGARVE - 08572700"
71890,BENEDITA GARCIA DA CRUZ PROFESSORA,183048,"LILIA, 115 - CALMON VIANA - 08560250"
71934,EUGENIO VICTORIO DELIBERATO,183049,"VERA CRUZ, 201 - JARDIM GONCALVES - 08573640"
125008,RECANTO MONICA II,183092,"MERENDA, 2000 - MERENDA - 08592390"
137380,DULCE MARIA SAMPAIO PROFESSORA,183110,"GONCALVES DIAS, 961 - PARQUE RESIDENCIAL MARENGO - 08594270"
137405,PARQUE PIRATININGA III,183111,"JOAQUIM SERRA, 98 - PARQUE PIRATININGA - 08583680"
108416,VILA URSULINA,183068,"MARINGA, 368 - VILA URSULINA - 08574310"
74587,VALTER DA SILVA COSTA VEREADOR,183068,"MARINGA, 368 - VILA URSULINA - 08574310"
137379,AMALIA MARIA DOS SANTOS,183109,"VITAL BRASIL, SN - VILA MARIA AUGUSTA - 08570310"
137290,JOAQUIM GONCALVES FERREIRA DA SILVA,183108,"VESPASIANO, SN - ESTANCIA FRATERNIDADE - 08589030"
123435,LACY LENSKI LOPES PROFESSORA,183074,"MONGAGUA, 333 - JARDIM AMERICA - 08555400"
125717,EUSTAQUIO PADRE,183095,"IRAPUA, 80 - JARDIM SELMA HELENA - 08564060"
123891,MARIO MARTINS PEREIRA,183077,"MOMBUCA, 177 - PARQUE RECANTO MONICA - 08592140"
124399,PARQUE PIRATININGA,183082,"JORGE AMADO, 56 - PARQUE PIRATININGA - 08583630"
111080,JARDIM SANTA RITA II,183070,"DOIS, 33 - JARDIM SANTA RITA II - 08596760"
99533,CENTRO ATEND SOCIO ED ADOLESCENTE ITAQUAQUECETUBA I CIP,183067,"PEDRO DA CUNHA ALBUQUERQUE LOPES, 3367 - PEROBAL - 08584584"
99532,CENTRO ATEND SOCIOED AO ADOLESCENTE ITAQUAQUECETUBA CI,183067,"PEDRO DA CUNHA ALBUQUERQUE LOPES, 3367 - PEROBAL - 08584584"
71882,BERTHA CORREA E CASTRO DA ROCHA,183047,"ENEIDA FRANCO PINTO, 55 - VILA ANITA - 08557130"
74985,SILVIA GAMA BALABEN PROFESSORA,183059,"JAIR DE GODOY, 575 - VILA JAU - 08559120"
127354,VERA LUCIA TORRES RODRIGUES AFFONSO PROFESSORA,183097,"RUA DOUTOR PRUDENTE DE MORAES, 90 - VILA JULIA - 08551230"
127784,HOMERO FERNANDO MILANO,183101,"JOAO BARBOSA DE MORAES, 157 - VILA ZEFERINA - 08576070"
137184,ELISEU JORGE PROFESSOR,183106,"MARIA DO ROSARIO, 199 - JARDIM IVONETE - 08553120"
124982,PARQUE PIRATININGA II,183091,"RUA JOAQUIM SERRA, 110 - PARQUE PIRATININGA - 08583680"
123764,JARDIM AMERICA DO,183076,"PEDRO DA CUNHA ALBUQUERQUE LOPES, 3500 - PEROBAL - 08584584"
72091,SIMON SWITZAR PADRE,183053,"CAPANEMA, 76 - CENTRO - 08550310"
125115,JARDIM ODETE III,183093,"GALVAO, 206 - QUINTA DA BOA VISTA RESIDENCIAL - 08597560"
127380,NEMESIO CANDIDO GOMES,183098,"OURINHOS, 475 - VILA VIRGINIA - 08576310"
71977,ODILA LEITE DOS SANTOS PROFESSORA,183051,"R JUNDIAI, 84 - MONTE BELO - 08577320"
126134,ELIAS ZUGAIB PROFESSOR,183096,"JAPAO, 10 - JARDIM OBELISCO - 08565130"
123280,DURVAL EVARISTO DOS SANTOS VEREADOR,183073,"PRACA DOS AMORES, SN - VILA SAO CARLOS - 08599540"
75223,NANCI CRISTINA DO ESPIRITO SANTO PROFESSORA,183061,"FERNANDO DE NORONHA, 100 - JARDIM SANTA HELENA - 08553700"
124924,HELENA LOUREIRO ROSSI PROFESSORA,183084,"AZULAO, 84 - JARDIM NOVA POA - 08568330"
127381,ROSARIA ISOLINA DE MORAES DONA,183099,"RIO PINHEIROS, 25 - VILA NELY - 08599330"
124933,VERA LUCIA LEITE DA COSTA PROFESSORA,183085,"FOZ DE IGUACU, SN - JARDIM SAO PAULO - 08598500"
124062,FILOMENA HENARES MILANO,183080,"JOSE CARLOS FERREIRA, 178 - JARDIM IPE - 08580815"
124954,VILA ARIZONA I,183087,"SEBASTIAO JOSE DE ALMEIDA, SN - JARDIM ZELIA - 08575335"
71959,JOSE GAMA DE MIRANDA,183050,"ALVARES DE CARVALHO, 250 - JARDIM CAIUBI - 08588480"
124981,PEQUENO CORACAO II,183090,"FERNAO DE MAGALHAES, 91 - O PEQUENO CORACAO - 08579590"
74932,JOSE BARBOSA DE ARAUJO VEREADOR,183058,"LUTECIA, 87 - JARDIM FIORELO - 08570430"
124980,JARDIM ITAQUA,183089,"MOTORISTAS, 274 - JARDIM ITAQUA - 08580030"
123246,MARCELO TADEU DE OLIVEIRA CASTRO CAMPOS MARQUES PROFESSOR,183072,"JURUAIA, 40 - PARQUE DIRCE - 08595250"
137217,ROQUE BARBOSA DE MIRANDA,183107,"ESTRADA DO RIBEIRO, 250 - JARDIM JOSELY - 08590500"
72840,LEONCIO PIMENTEL,183119,"AVENIDA JOAO SIMON SOLA, 298 - CENTRO - 18440000"
124659,AGROVILA III,183135,"AGROVILA III, SN - AGROVILA III - 18440000"
74867,ALBERTO PEREIRA PROFESSOR,183123,"RUA CRUZEIRO, 88 - VILA CRUZEIRO - 18440000"
72850,CAETANO CARBONE PROFESSOR,183120,"RUA SOPHIA DIAS MENCK, 715 - SANTA TEREZINHA - 18466050"
72839,GABRIEL PINTO DE FARIA PROFESSOR,183118,"RUA CORONEL ACACIO PIEDADE, 422 - CENTRO - 18440000"
72828,TOME TEIXEIRA,183114,"XV DE NOVEMBRO, 120 - CENTRO - 18460007"
127353,DOROTY DAVID MUZEL PROFESSORA,183138,"RUA SANTA CATARINA, 250 - VILA DOM SILVIO - 18440000"
75669,CHRISTIANO MARQUES BONILHA PROFESSOR,183126,"RUA TRAVESSA QUATRO, 900 - CERRADO - 18460000"
108012,CEL JTO A EE TOME TEIXEIRA,183128,"XV DE NOVEMBRO, 120 - CENTRO - 18460000"
72832,EPITACIO PESSOA,183116,"RUA FREI PACIFICO MONTEFALCO, 1551 - CENTRO - 18480000"
133833,BAIRRO ENGENHEIRO MAIA II,183142,"RUA ANTONIO CASTILHO MURAL, SN - ENGENHEIRO MAIA - 18440000"
74682,HERCULANO PIMENTEL DOUTOR,183122,"RUA SAO PEDRO, 2484 - CENTRO - 18460009"
124558,ELISA DE CAMPOS LIMA NOVELLI DONA,183134,"RUA SEBASTIAO LUCIO RIBEIRO, 511 - ARVAO - 18480000"
124366,BAIRRO ENGENHEIRO MAIA,183132,"AVENIDA ENGENHEIRO MAIA, SN - ENGENHEIRO MAIA - 18440000"
110827,ALDEIA YWY PYHAU,183129,"BAIRRO DOS VITOR, S/N - DOS VITOR - 18490000"
72829,HEITOR GUIMARAES CORTES,183115,"JOAQUIM DIAS TATIT, 372 - CRUZEIRO - 18460310"
124276,BAIRRO DO TOME,183131,"RUA LUIS TOME DO COUTO, 673 - TOME - 18440000"
131725,ALDEIA TEKOAPORA,183141,"BAIRRO VOLTA GRANDE, SN - VOLTA GRANDE - 18480000"
75331,ESTHER CARPINELLI RIBAS PROFESSORA,183125,"LUIZ MARQUES DOS SANTOS, 331 - JARDIM ALVORADA - 18462204"
127831,APARICIO BIGLIA FILHO PROFESSOR,183139,"RUA MANOEL TEIXEIRA FERNANDES, 40 - CENTRO - 18475000"
93836,ALDEIA KARUGWA,183127,"ESTRADA VICINAL, SN - BAIRRO DOS VITOR - 18490000"
124555,JARDIM SANTA INES,183133,"AVENIDA JOAO SIMON SOLA, 451 - JARDIM SANTA INES - 18440000"
72838,BARBARA VIDAL CESAR,183117,"RUA FRANCISCO LOURO, SN - TURIBA DO SUL - 18450000"
123338,MARIA TEREZA DE SOUZA FALCARELI PROFESSORA,183130,"RUA AFONSO SARDINHA, 101 - VILA BANDEIRANTES - 18440000"
74920,OCTAVIO DE ALMEIDA BUENO PROFESSOR,183124,"RUA GERSON DE SOUZA LIMA, 1041 - SANTO ANTONIO - 18480000"
125873,EPAMINONDAS FERREIRA LOBO DOUTOR,183137,"MAJOR SALVADOR RUFINO, 59 - VILA OSORIO - 18462056"
72824,LAZARO SOARES PROFESSOR,183113,"RUA FABRICIO VIEIRA DE LIMA, 298 - CENTRO - 18470000"
74503,MIGUEL JOAO PEREIRA PADILHA,183121,"RUA JOSE PEREIRA PADILHA, 308 - BAIRRO DOS PADILHAS - 18470000"
125864,ANTONIO TONON,183136,"RUA SAO BENEDITO, 452 - CENTRO - 18745000"
127832,SANDRA REGINA PIRES PROFESSORA,183140,"AVENIDA BRASILIA, 825 - CENTRO - 18490000"
72851,EUGENIO EUCLYDES PEREIRA DA MOTTA CORONEL,183144,"ANGELO DIANA, 120 - BAMBU - 18540000"
137375,ANTHENOR FRUET PROF,183200,"ESTADOS UNIDOS, SN - PIRAPITINGUI - 13307010"
74688,BENEDITA DE REZENDE PROFA,183163,"VICENTE DONALISIO, 250 - JARDIM DONALISIO - 13321530"
125136,MERCIA MARIA CAZARINI PROFA,183189,"RUA GECENEY CABREIRA, 73 - BAIRRO PORTAL DO EDEN - 13308531"
109022,PENITENCIARIA ODON RAMOS MARANHAO,183172,"ESTRADA MUNICIPAL DE IPERO, SN - HORTO FLORESTAL DE BELA VISTA - 18560000"
72854,LEONOR FERNANDES DA SILVA PROFA,183146,"RUA BARAO DO RIO BRANCO, 1453 - VILA TEIXEIRA - 13320271"
75332,ROGERIO LAZARO TOCCHETON PROF,183168,"FRANCISCO FALCATO JUNIOR, 465 - SAO LUIZ - 13304170"
72870,ACYLINO AMARAL GURGEL PROF,183156,"WINSTON CHURCHIL, 490 - BELA VISTA - 13321370"
127500,FRANCISCO RIGOLIN PADRE,183195,"EUGENIO COLTRO, 1841 - SALTO VILLE - 13323420"
75469,JOSEANO COSTA PINTO PROF,183169,"BANDEIRAS, 328 - NOSSA SENHORA DO MONTE SERRAT - 13323310"
125039,EUGENIA FERRAREZI NUNES,183188,"RUA ESMERALDA, 60 - JARDIM COLINA DA SERRA - 13318000"
123499,MARIA DE LOURDES MORAES COSTELA PROFA,183178,"AV PRINCESA ISABEL, 1580 - JARDIM SANTA CRUZ - 13323530"
72858,CICERO SIQUEIRA CAMPOS PROF,183147,"ALAMEDA ALICE, 111 - JARDIM ALBERTO GOMES - 13311170"
125290,CEL JTO A EE REGENTE FEIJO,183190,"ANDRADAS, 412 - CENTRO - 13300170"
72865,REGENTE FEIJO,183190,"ANDRADAS, 412 - CENTRO - 13300170"
137270,MARIA APARECIDA FERNANDES LEITE PROFA,183199,"ESTRADA MUNICIPAL PORTO FELIZ A SOROCABA, SN - BOM RETIRO - 18540000"
123498,IRACEMA PINHEIRO FRANCO PROFA,183177,"RUA VALENTIN JOSE MOSCHINI, 300 - JARDIM SALTENSE - 13327270"
132742,PRISCILA DE FATIMA PINTO PROFESSORA,183198,"JANIO DA SILVA QUADROS PRESIDENTE, SN - VILA LUCINDA/ROMANA - 13309729"
126850,ANTONIO ODILON FRANCESCHINI PREFEITO,183194,"RUA CANADA, 361 - VILAREJO - 13318000"
74870,MIRINHA TONELLO,183166,"ESTADOS UNIDOS, 70 - JARDIM AMERICA - 13324220"
72867,TANCREDO DO AMARAL,183154,"AV DPEDRO II, 170 - CENTRO - 13320240"
72861,ANTONIO BERRETA PROF,183149,"SOROCABA, 277 - VILA GATTI - 13300340"
123741,MARIA TEREZA GUIMARAES DE ANGELO PROFA,183181,"PIRASSUNUNGA, 235 - JARDIM MARILIA - 13323023"
126181,BENEDITO LAZARO DE CAMPOS DR,183192,"RUA ANA DA FONSECA BICUDO, 75 - VILA IANNI - 13313160"
74573,ANA MESQUITA LAURINI,183162,"RUA RENATO NIDERAUER ZANCHI, SN - BONFIM - 13319000"
72866,CLAUDIO RIBEIRO DA SILVA PROF,183153,"PRACA QUINZE DE NOVEMBRO, S/N - VILA TEIXEIRA - 13320299"
74500,SALATHIEL VAZ DE TOLEDO PROF,183161,"LUIZ MORATO CASTANHO, 405 - RANCHO GRANDE - 13306050"
107396,CEL JTO A EE PAULA SANTOS PROFA,183170,"PRUDENTE DE MORAES, 1089 - VILA NOVA - 13322010"
72853,PAULA SANTOS PROF,183170,"PRUDENTE DE MORAES, 1089 - VILA NOVA - 13322010"
124997,BENE TEIXEIRA DA FONSECA DO AMARAL GURGEL PROFA,183187,"FELICIDADE, SN - CIDADE NOVA I - 13308050"
124561,DOLORES ANTUNES DA SILVA,183183,"FRANCA, 1425 - JARDIM DAS NACOES - 13322191"
123731,ESTACAO GEORGE OETTERER,183179,"AUGUSTA, 700 - JARDIM MARITA - 18560000"
72863,PEDRO FERNANDES DE CAMARGO PROF,183151,"RUA JOAO MARINOMIO DE CAMARGO, 80 - VILA MARTELI - 18540000"
116684,CENTRO DE PROGRESSAO PENITENCIARIA DE PORTO FELIZ,183174,"ESTRADA VICINAL PORTO FELIZ A RAFARD, SN - JARDIM CONCEICAO - 18540000"
72933,JEFFERSON SOARES DE SOUZA PROF,183158,"RUA MANOEL NOVAES, 1279 - CENTRO - 18535000"
109502,CEL JTO A EE SECKLER MONSENHOR,183173,"MONSENHOR SECKLER, 59 - CENTRO - 18540000"
72940,ARTHUR DA SILVA BERNARDES PRESIDENTE,183159,"AVENIDA WASHINGTON LUIZ, 478 - CENTRO - 18520000"
123119,SYLVIA DE PAULA LEITE BAUER,183175,"LAURO ROGERIO DE ARAUJO CORONEL, SN - JARDIM AEROPORTO I - 13304570"
107561,JOAO ANTONIO MOTTA NAVARRO PROFESSOR,183171,"AVENIDA EMILIO FELIX TORTOSA, 440 - PARQUE RESIDENCIAL POTIGUARA - 13312710"
124865,ESTHER MAURINO RODRIGUES PROFA,183184,"RUA FELIX ROCCO, 203 - JARDIM VANTE ANGELIERI - 18540000"
124234,OTILIA DE PAULA LEITE PROFA,183182,"AFRICA, 51 - JARDIM ELIZABETH - 13326090"
72862,SECKLER MONSENHOR,183150,"AVENIDA MONSENHOR SECKLER, 59 - CENTRO - 18540000"
74710,FRANCISCO NARDY FILHO,183164,"BARTIRA, 64 - VILA LEIS - 13309210"
124996,ROSA MARIA MADEIRA MARQUES FREIRE PROFA,183186,"RUA ALICE DUARTE GUILGER, 65 - JARDIM UNIAO - 13308177"
74869,HELADIO CORREA LAURINI MONSENHOR,183165,"RUA DAS PALMEIRAS, 940 - PINHAL - 13315000"
72923,PLINIO RODRIGUES DE MORAIS,183157,"RUA DO COMERCIO, 373 - CENTRO - 18530000"
72869,CESARIO MOTTA DR,183155,"THOMAZ SIMON, 280 - CENTRO - 13300030"
124902,VICTORIA MARCON BELLUCCI PROFA,183185,"PRACA DOS COLIBRIS, 21 - JARDIM SAO FRANCISCO - 18520000"
123122,JOSE BENEDITO GONCALVES PROF,183176,"BULGARIA, 601 - JARDIM DAS NACOES - 13322181"
126288,MARIA NAZARENA CORREA IRMA,183193,"RUA SAO TIAGO, 82 - JARDIM SAO JUDAS TADEU - 13327395"
72957,GASPAR RICARDO JUNIOR DR,183160,"RUA SANTO ANTONIO, 186 - CENTRO - 18560000"
72860,JOSE LEITE PINHEIRO JR PROF,183148,"GUANABARA, 91 - BRASIL - 13301499"
123740,JOAO MORETTI,183180,"RUA JOAO MARCON, 815 - AGUIA DA CASTELO - 18550000"
127836,MARIO PEDRO VERCELLINO ALFERES,183197,"AVENIDA ALEXANDRINA BERTOLDI VERCELLINO, 361 - VILA GINASIAL - 18550000"
125878,VITORIO TOGNI CAPITAO,183191,"ESTRADA 8 DO JACARE, 236 - JACARE - 13318000"
75086,PERY GUARANY BLACKMAN PROF,183167,"MONACO, SN - VILA ROMA - 13310441"
127833,LUCIDIO MOTTA NAVARRO,183196,"AVENIDA MARCIANO XAVIER DE OLIVEIRA, 107 - CENTRO - 13315000"
73398,BENEDITO ORTIZ CORONEL,183202,"RUA XV DE NOVEMBRO, 335 - CENTRO - 14720000"
125984,JEREMIAS DE PAULA EDUARDO,183229,"GUSTAVO DE GODOY, 1196 - SAO CRISTOVAO - 15910000"
127966,NELLY BAHDUR CANO PROFESSORA,183232,"AVENIDA BARTOLOMEU BUENO, 230 - CONJUNTO HABITACIONAL BANDEIRANTES - 15910000"
105099,BAIRRO CRUZEIRO,183220,"RUA SANTOS DUMONT, 535 - CRUZEIRO - 14730000"
75272,OSWALDO SCHIAVON,183219,"RUA ALFREDO GOMES AREIAS, 1323 - RESIDENCIAL  JARDIM PEDRO MAIA - 14711510"
73515,JOAQUIM BATISTA DOUTOR,183211,"RUA PROFESSOR CARLOS NOBRE ROSA, 100 - JARDIM BELA VISTA - 14883212"
73438,ABILIO MANOEL,183204,"PRACA VALENCIO DE BARROS, 186 - CENTRO - 14700009"
125171,CEEJA HERNANI NOBRE PROFESSOR,183226,"RUA LUCAS EVANGELISTA, 1670 - CENTRO - 14701420"
73445,NENA GIANNASI BUCK PROFESSORA,183206,"PRACA SEBASTIAO BARALDI, 25 - CENTRO - 14730000"
73449,GUSTAVO FERNANDO KUHLMANN,183208,"RUA AVELINO MARIOTINI, 1391 - DISTRITO DE BOTAFOGO - 14718048"
73530,LUIZ LATORRACA PROFESSOR,183215,"AVENIDA CAPITAO ALBERTO MENDES JUNIOR, 711 - NOVA  JABOTICABAL - 14890026"
123350,ORLANDO FRANCA DE CARVALHO PROFESSOR,183224,"ALAMEDA  JOAQUIM LUIZ VIZICATO, 1450 - JARDIM ALVORADA - 14706228"
125985,ROSA MARI DE SOUZA SIMIELLI PROFESSORA,183230,"AVENIDA MAJOR NOVAES, 1905 - SOROCABANO - 14871060"
73564,GAVINO VIRDES JORNALISTA,183217,"RUA VALDEMAR STOQUE, 258 - NOVA GUATAPARA - 14115000"
109504,CEL JTO A EE JOSE PACIFICO,183222,"FERES SADALLA, 330 - CENTRO - 14840000"
73519,JOSE PACIFICO,183222,"FERES SADALLA, 330 - CENTRO - 14840000"
107354,CEL JTO A EE PARAISO CAVALCANTI DOUTOR,183221,"ORLANDO FRANCA DE CARVALHO PROFESSOR, 265 - CENTRO - 14701070"
73429,ANSELMO BISPO DOS SANTOS,183203,"AVENIDA 13 DE MAIO, 416 - CENTRO - 14725000"
124869,AURORA FERRAZ VIANNA DOS SANTOS PROFESSORA DONA,183225,"OSWALDO PEREIRA TEIXEIRA, 217 - PARQUE PRIMEIRO DE MAIO - 14875330"
110341,CENTRO DE DETENCAO PROVISORIA DE TAIUVA,183223,"ROD BRIGADEIRO FARIA LIMA, KM 359 - RURAL - 14720000"
128520,JOSEPHINA DE CAMARGO NEVES PROFESSORA,183233,"AVENIDA LUIS CARLOS LONETTO, 481 - RESIDENCIAL MARIO CAZERI - 14840000"
73441,ELISIO DE CASTRO DOUTOR,183205,"RUA CENTRAL, 198 - CENTRO - 14765000"
127864,JOSE FRANCISCO PASCHOAL,183231,"PAUL HARRIS, 152 - VILA MAJOR CICERO DE CARVALHO - 14702016"
73451,ABILIO ALVES MARQUES,183209,"AVENIDA QUITO STAMATO, 190 - JARDIM SAO JOAO - 14700440"
134264,CEL JTO A EE LUIZ ZACHARIAS DE LIMA DR,183235,"ANANIAS DE CARVALHO, 1344 - CENTRO - 15910000"
73518,LUIZ ZACHARIAS DE LIMA DOUTOR,183235,"ANANIAS DE CARVALHO, 1344 - CENTRO - 15910000"
73448,PARAISO CAVALCANTI DOUTOR,183207,"RUA PROFESSOR ORLANDO FRANCA DE CARVALHO, 265 - CENTRO - 14701070"
73512,CONSTANTE OMETTO,183210,"RUA CASTELO BRANCO, 555 - JARDIM SAO PAULO - 14850000"
75183,JOAO DOMINGOS MADEIRA PROFESSOR,183218,"AVENIDA SANTOS DUMONT, 147 - JARDIM CLAUDIA - 14708028"
73534,ANTONIO JOSE PEDROSO PROFESSOR,183216,"AVENIDA QUINZE DE NOVEMBRO, 630 - XIS - 14870600"
128792,JARDIM SOUZA LIMA DO,183234,"PEDRO LOPES, 300 - RESIDENCIAL BEBEDOURO - 14710032"
125254,CEL JTO A EE AURELIO ARROBAS MARTINS,183227,"RUA SAO SEBASTIAO, 294 - CENTRO - 14870290"
73517,AURELIO ARROBAS MARTINS,183227,"RUA SAO SEBASTIAO, 294 - CENTRO - 14870290"
125567,PENITENCIARIA FEMININA DE GUARIBA,183228,"BRIGADEIRO FARIA LIMA SP326 KM 323, SN - ZONA RURAL - 14840000"
127954,ADHERBAL DE CASTRO PROF,183290,"HOLLYWOOD, 30 - JARDIM CALIFORNIA - 12305740"
124755,MARIA ISABEL NEVES BASTOS PROFA,183276,"MARIA DE LOURDES MAXIMO, 150 - JARDIM RENATA - 07402015"
75659,JOAO VICTOR LAMANNA DR,183262,"CLARA FOGACA DE ALMEIDA, SN - CIDADE JARDIM - 12320560"
72702,JOAO FELICIANO,183248,"ALFREDO RAMOS, 40 - CENTRO - 12308420"
123242,MARIA DAS GRACAS SALES DE OLIVEIRA PROFA,183270,"RUA PREFEITO JOSE BASILIO ALVARENGA, 848 - JARDIM MONTE SERRAT - 07500000"
72701,POMPILIO MERCADANTE DR,183247,"TAMANDARE ALMIRANTE, 141 - SAO JOAO - 12322470"
125032,JOSE SIMPLICIO PROF,183279,"MUNICIPAL FRANCISCO EUGENIO BICUDO, 61 - JARDIM COLINAS - 12319010"
123794,MARIANO BARBOSA DE SOUZA PROF,183272,"DO KONDO, 380 - PEDREIRA - 07405650"
125684,GABRIELA FREIRE LOBO PROFA,183284,"RUA CONEGO BICUDO, 287 - CENTRO - 07500000"
74860,OLIVIA DO AMARAL SANTOS CANETTIERI PROFA,183254,"ROSA MONTEIRO LINO, 507 - PARQUE MEIA LUA - 12335110"
71635,MARIA SANTOS BAIRAO PROFA,183241,"RUA LEOPOLDO DA CUNHA LIMA, 115 - LANIFICIO - 07500000"
76401,JOSE VEIGA PROF,183264,"AVENIDA AMERICA, 254 - NOVA GUANABARA - 08900000"
96363,CENTRO DE ATEND SOCIOEDUC ADOLESCENTE DE JACAREI  CIP,183267,"RODOVIA PRESIDENTE DUTRA,  - PARQUE MEIA LUA - 12335010"
128540,BENEDICTO MAURO DOS SANTOS PROF,183293,"AVENIDA SAO MATHEUS, 474 - JARDIM SAO JOSE - 12327661"
76134,BENEDITA FREIRE DE MACEDO DONA,183263,"RUA LUCIANA DE SOUZA MAGALHAES, 305 - VILA MACHADO - 12321210"
75342,MARIA HELENA DENIS FIGUEIREDO PROFA,183258,"AVENIDA DARCY DE OLIVEIRA REIS, 530 - BELA VISTA - 12309070"
125147,DARCI LOPES PROFA,183281,"OLINDA DE ALMEIDA MERCADANTE PROFESSORA, 3925 - JARDIM PARAISO - 12316550"
125858,DIRCEU JUNQUEIRA DE SOUZA PROF,183287,"AVENIDA JORGE MALAQUIAS PEREIRA, 62 - JARDIM NOVA ESPERANCA - 12324450"
75344,WALDEMAR SALGADO PROF,183260,"RUA JOAO PESSOA, 12 - CENTRO - 12380000"
132505,CENTRO DE ATEND SOCIOEDUC AO ADOLESCENTE DE ARUJA  CI,183294,"WALDOMIRO LUIS COUTINHO, SN - SAO BENTO - 07442200"
71597,AMADEU RODRIGUES NORTE,183239,"PLINIO SALGADO SANTANGELO, 120 - VILA PEDROSO - 07434315"
137251,AMAURY TEIXEIRA VASQUES PROF,183298,"MIGRANTES, 1380 - PARQUE MEIA LUA - 12335000"
74842,GERALDO BARBOSA DE ALMEIDA PREFEITO,183253,"ESTR DOS FERNANDES, 2332 - PEDREIRA - 07404165"
125854,DOROTHOVEO GASPAR VIANNA PROF,183286,"PAULO DE OLIVEIRA BRANCO EXPEDICIONARIO, 130 - JARDIM DAS INDUSTRIAS - 12306020"
71559,RENE DE OLIVEIRA BARBOSA DR,183238,"RUA MELVIN JONES, 52 - JARDIM MODELO - 07401305"
96362,CENTRO ATEND SOCIOEDUC ADOLESCENTE  DE JACAREI  CI,183266,"RODOVIA PRESIDENTE DUTRA, KM 173 - ZONA RURAL - 12335010"
75424,REPUBLICA DOMINICANA,183261,"AVENIDA NOSSA SENHORA APARECIDA, 255A - JORDANOPOLIS - 07411160"
82150,AMANCIA DIAS SAMPAIO PROFA,183265,"ARY DAVILA, 200 - JARDIM TERRAS DE SAO JOAO - 12324772"
75046,BENEDITO MANOEL DOS SANTOS,183256,"BENEDITO ANTONIO RIBEIRO, 425 - JARDIM LIMOEIRO - 07434120"
124697,BRASILISIA MACHADO LOBO PROFA,183275,"RUA MASSAO OGAWA, 210 - JARDIM ELDORADO - 07500000"
75343,MARIA APARECIDA RICO PROFA,183259,"ANTONIO ALVES, 226 - PAGADOR DE ANDRADE - 12334450"
134265,CEL JTO A EE FRANCISCO F FERREIRA DA SILVA PROF,183295,"NOVE DE JULHO, 473 - JARDIM PEREIRA DO AMPARO - 12327682"
128509,FRANCISCO FELICIANO FERREIRA DA SILVA PROF CHICO FERREIRA,183295,"NOVE DE JULHO, 473 - JARDIM PEREIRA DO AMPARO - 12327682"
125683,LAURENTINA LORENA CORREA DA SILVA PROFA,183283,"RUA CENTRO COMUNITARIO, SN - CRUZEIRO - 07500000"
125852,FRANCISCO GOMES DA SILVA PRADO DR,183285,"RUA BARAO DE JACAREI, 910 - CENTRO - 12308001"
123908,FERNANDO ALUISO CORREA PROF,183274,"RUA JOAO ANTONIO MINEIRO, 67 - JARDIM NOVO EDEN - 07500000"
123210,ANTONIO MARTINS DA SILVA PROF,183269,"RUA SANTO IVO, 368 - CIDADE SALVADOR - 12312190"
127933,HYEROCLIO ELOY PESSOA BARROS,183289,"RUA WASHINGTON LUIS, 733 - VILA GUILHERME - 07500000"
72699,CARLOS PORTO CORONEL,183246,"LEITAO, 88 - CENTRO - 12327020"
137183,CARLOS RICHARD STRAUTMANN PASTOR,183296,"AV DR ARMANDO COLANGELO, 1133 - PARQUE RODRIGO BARRETO - 07417325"
