74819,ROBERTA MARIA LOPES CHAVES PROFESSORA,182679,"RUA MARIA DE MENESES COSTA LACERDA, 7 - JARDIM BETEL - 07083300"
123105,RINALDO POLI PREFEITO,182702,"AVENIDA MARTINS JUNIOR, 2884 - JARDIM BELA VISTA - 07141000"
71381,ODETE FERNANDES PINTO DA SILVA PROFA,182668,"RUA CHIBATA, 126 - JARDIM BELA VISTA - 07133040"
117547,PROFESSOR MARCOS HOLANDA ALMEIDA,182701,"FRAIBURGO, 80 - JARDIM SAO DOMINGOS - 07142130"
74536,ANTONIO GROTKOWSKY PASTOR E VEREADOR,182676,"RUA BELEM, 259 - JARDIM NOVO PORTUGAL - 07160550"
127493,ELISIO DE OLIVEIRA NEVES VEREADOR,182731,"RCRISTOBAL CLAUDIO ELILLO, 366 - PARQUE CECAP - 07190065"
75426,HELIO POLESEL PROFESSOR,182687,"RUA CORDEIROS, 20 - VILA NOVA BONSUCESSO - 07175130"
78211,PARQUE PRIMAVERA,182694,"RUA ASTEROIDE BETA, SN - PARQUE PRIMAVERA - 07145220"
126161,FIORAVANTE IERVOLINO,182728,"RUA JORACY DE CAMARGO, 60 - JARDIM PARAVENTI - 07121280"
125119,IDALINA LADEIRA FERREIRA PROFESSORA,182722,"RUA BARRA DA ESTIVA, 182 - CIDADE SOBERANA - 07161520"
124247,MARIA CELIA FALCAO RODRIGUES PROFESSORA,182708,"RUA ARACY VALENTE, 159 - PARQUE MIKAIL - 07142390"
100720,BOM PASTOR II,182695,"AVENIDA PALMIRA ROSSI, 1195 - RECREIO SAO JORGE - 07144170"
125060,RECREIO SAO JORGE II,182717,"RUA ITORORO, 18 - RECREIO SAO JORGE - 07144470"
134379,PENITENCIARIA DESEMBARGADOR ADRIANO MARREY,182739,"RODOVIA PRESIDENTE DUTRA KM 13, SN - PARQUE CECAP - 07034907"
126283,WALDOMIRO POMPEO PREFEITO,182729,"AVENIDA CARILAU CERRI, 60 - JARDIM DIVINOLANDIA - 07133200"
71138,JOAQUIM GARCIA SALVADOR PROFESSOR,182655,"RUA CATULO DA PAIXAO CEARENSE, 242 - JD AMERICA - 07194130"
127527,ZILDA GRACA MARTINS DE OLIVEIRA PROFESSORA,182733,"RUA MANOEL REIS DA SILVA, SN - VILA CARMELA - 07178450"
74683,FLAVIO XAVIER ARANTES PROFESSOR,182678,"RUA MIGUEL FERNANDES MALDONADO, 57 - JARDIM SANTA RITA - 07143222"
128511,HILDA PRATES GALLO PROFESSORA,182737,"AVENIDA BRIGADEIRO FARIA LIMA, 3064 - COCAIA - 07130000"
71216,PLINIO PAULO BRAGA PROFESSOR,182658,"AVENIDA OTAVIO BRAGA DE MESQUITA, 3900 - TABOAO - 07140230"
125061,JARDIM SANTA LIDIA,182718,"RUA JOSE NILSON FERRETTI, 62 - JARDIM SANTA LIDIA - 07142216"
71491,SANDI MIYAKE CAPITAO AVIADOR,182672,"RUA JUAREZ  TAVORA, 47 - JARDIM SAO JOAO - 07151030"
123788,ALEXANDRE LOPES OLIVEIRA,182807,"VATICANO, S/N - JARDIM DAS NACOES - 07183400"
123108,MARIA APARECIDA RODRIGUES PROFESSORA,182799,"BERILO, 72 - CIDADE PARQUE BRASILIA - 07243100"
71424,JOAO CRISPINIANO SOARES,182765,"RUA FRANCISCO ANTUNES, 1078 - VILA AUGUSTA - 07040010"
71450,ZILDA ROMEIRO PINTO MOREIRA DA SILVA PROF,182768,"RUA MACARANI, 382 - JARDIM PRESIDENTE DUTRA - 07171170"
124330,VICTOR CIVITA,182809,"JUAZEIRO DO NORTE, 53 - CIDADE JARDIM CUMBICA - 07180230"
71607,VICENTE MELRO,182776,"RUA BELMONTE, 66 - JARDIM MARIA DIRCE - 07173430"
71281,ANTONIO DE RE VEREADOR,182756,"RUA DA PENHA, 156 - MACEDO - 07197130"
71134,CAPISTRANO DE ABREU,182747,"RU CAPITAO GABRIEL, 393 - SEDE - 07011010"
131555,PIMENTAS VII,182824,"MARGINAL SUL, SN - CONJUNTO MARCOS FREIRE - 07263740"
71295,ARY GOMES CORONEL,182757,"RUA ALEGRE, 213 - VILA SAO RAFAEL - 07053100"
127579,CEL JTO A EE ALICE CHUERY PROFESSORA,182823,"ANTONIO CAMARGO, 130 - JARDIM SAO JORGE - 07114360"
125143,JARDIM NOVA CUMBICA II,182815,"JAGUARIBI, SN - VILA NOVA CUMBICA - 07231360"
71431,JAIR MIRANDA DOUTOR,182766,"RUA FRANCISCO FOOT, SN - JARDIM TRANQUILIDADE - 07051090"
125632,CARLOS MACHADO BITENCOURT MARECHAL,182816,"RUA MADALENA RAMPINELLI, 39 - PONTE GRANDE - 07033110"
75047,SEBASTIAO WALTER FUSCO,182785,"AVENIDA SARGENTO JAIME REGALO PEREIRA, 257 - JARDIM CUMBICA - 07182000"
71574,OSWALDO SAMPAIO ALVES,182773,"OURICURI, 168 - JARDIM MARIA DIRCE - 07242070"
137242,HUGO DE AGUIAR,182829,"AVENIDA JOSE MIGUEL ACKEL, 385 - VILA PARAISO - 07241090"
137216,REPUBLICA DA VENEZUELA,182827,"CAMPO ALEGRE, 221 - JARDIM ARAPONGAS - 07210230"
75629,MAURICIO GOULART DEPUTADO,182787,"ITACARAMBI, 168 - AGUA CHATA - 07251090"
93905,JARDIM ARUJA,182790,"JABOATAO, 385 - JARDIM DOS PIMENTAS - 07272340"
125633,FRANCISCA BATISTA TRINDADE PROFESSORA,182817,"RUA PAULO JOSE BAZZANI, 9 - MACEDO - 07113030"
123655,AGOSTINHO CANO,182805,"CINCOC, 534 - JARDIM NOVA CIDADE - 07252530"
71929,JOAO RIBEIRO DE BARROS COMANDANTE,182779,"RUA JUAZEIRO DO NORTE, 488 - CUMBICA - 07180230"
124776,LAURA DA PURIFICACAO DE CASTRO MENDES PROFESSORA,182812,"IMACULADA, 80 - JARDIM SAO MANOEL - 07183070"
123580,JOAO NUNES PASTOR,182804,"RUA BIRITIBA MIRIM, SN - JARDIM CENTENARIO - 07270160"
101585,CENTRO DE ATEND SOCIOEDUC AO ADOLESC GUARULHOS CI,182794,"RUA MINISTRO HIPOLITO, 3650 - CIDADE ARACILIA - 07250010"
124180,MARIA APARECIDA FELIX PORTO PROFESSORA,182808,"IMPERIAL, 99 - PARQUE DAS NACOES - 07243340"
137222,MARINHA FERREIRA DO NASCIMENTO PROFESSORA,182828,"ARACAJU, 392 - JARDIM LEBLON - 07272090"
126143,MARIO NAKATA PROFESSOR,182821,"EURACHIO MAURICIO, 1271 - PARQUE SAO MIGUEL - 07260070"
125640,WALDEMAR FREIRE VERAS VEREADOR,182818,"RUA DOUTOR BRANDAO VERAS, 44 - VILA TIJUCO - 07091150"
71154,CRISPINIANO CONSELHEIRO,182748,"ARMINDA DE LIMA, 57 - CENTRO - 07095010"
71208,JOSE ALVES DE CERQUEIRA CESAR,182753,"AVENIDA SAO LUIZ, 484 - VILA ROSALIA - 07072000"
137336,CONJUNTO HABITACIONAL BAIRRO DOS PIMENTAS II,182830,"NORTE E SUL, 60 - CONJUNTO MARCOS FREIRE - 07263600"
137147,IZABEL FERREIRA DOS SANTOS PROFESSORA DONA BELINHA,182826,"CIRIACO, 27 - JARDIM VILA GALVAO - 07054011"
125650,HOMERO RUBENS DE SA PROFESSOR,182819,"CEARA, 50 - VILA GALVAO - 07070080"
71583,AUGUST JOHANNES FERDINANDUS STAUDER PADRE,182774,"RUA MINISTRO HIPOLITO, 267 - CIDADE ARACILIA - 07250010"
127544,JARDIM MARIA DIRCE III,182822,"RUA TREZE DE JULHO, 52 - JARDIM MARIA DIRCE - 07173000"
95262,REPUBLICA DA VENEZUELA II,182791,"CAMPO ALEGRE, 273 - JARDIM ARAPONGAS - 07210230"
71845,VALENTIN GONZALEZ ALONSO PADRE,182778,"RUA MISSAO VELHA, 88 - PARQUE UIRAPURU - 07230380"
71405,ALICE CHUERY PROFESSORA,182762,"RUA ANTONIO CAMARGO, 130 - JARDIM SAO JORGE - 07114360"
124922,LINDAMIL BARBOSA DE OLIVEIRA PROFESSORA,182814,"CINCOC, SN - JARDIM NOVA CIDADE - 07252530"
71341,PAULO ROLIM LOUREIRO DOM,182761,"AVENIDA DOMINGOS FANGANIELLO, 251 - PONTE GRANDE - 07032060"
96228,LOUIS BRAILLE,182793,"RUA JOAO AVELINO FAUTHZ, 150 - JARDIM ANGELICA - 07260280"
96227,RAFAEL RODRIGUES FILHO PREFEITO,182792,"DEZ, 561 - SITIO SAO FRANCISCO - 07261450"
123463,CACILDA CACAPAVA DE OLIVEIRA PROFESSORA,182802,"AMELIA RODRIGUES, 592 - JARDIM PRESIDENTE DUTRA - 07172150"
123464,PEDRO MORCELI,182803,"JOAO AVELINO FAUTHZ, 190 - JARDIM ANGELICA - 07260280"
126137,MARIA HILDA ORNELAS DE OLIVEIRA PROFESSORA,182820,"IVINHEMA, 274 - JARDIM SANTO AFONSO - 07215130"
71591,THEREZINHA CLOSA ELEUTERIO PROFESSORA,182775,"RUA CHARLES MIARS COOPER, 432 - PARQUE MARIA HELENA - 07261130"
71833,JOAO DE ALMEIDA BARBOSA,182777,"AVENIDA NOVA CUMBICA, SN - VILA NOVA CUMBICA - 07231000"
71217,IRMA CELESTE LAR,182755,"AVENIDA DOUTOR TIMOTEO PENTEADO, 3035 - TORRES TIBAGI - 07061001"
71168,ALBERTO MENDES JR CAPITAO PM,182749,"PRACA NOSSA SENHORA APARECIDA, 125 - JARDIM VILA GALVAO - 07055000"
71190,ROTARY,182751,"AVENIDA SENADOR ADOLF SCHINDLING, 361 - ITAPEGICA - 07042020"
107704,LEVI VIEIRA DA MAIA PROFESSOR,182796,"RUA IARA, SN - VILA ANY - 07262540"
71567,JOAO CAVALHEIRO SALEM PROFESSOR,182771,"PORTO VELHO, 624 - JARDIM CUMBICA - 07240060"
123106,ORLANDO MINELLA,182797,"CANDELARIA, 376 - JARDIM JACY - 07262110"
71958,ROBERTO HIPOLITO DA COSTA BRIGADEIRO DO AR,182780,"RUA ARCEBURGO, 190 - JARDIM CASTANHA - 07182220"
133574,CENTRO ATEND SOCIOED AO ADOLESC SERRA DA CANTAREIRA CIP,182825,"HIPOLITO MINISTRO, 3750 - CIDADE ARACILIA - 07250010"
106055,CENTRO DE ATEND SOCIOEDUC AO ADOLESCENTE GUAYI  CI,182795,"HIPOLITO MINISTRO, 3700 - CIDADE ARACILIA - 07250010"
71573,GUILHERMINO RODRIGUES DE LIMA,182772,"RUA GUARU, 156 - JARDIM ARUJA - 07272460"
137417,INOCOOP II,182831,"ELIAS DABARIAN, 477 - RESIDENCIAL PARQUE CUMBICA - 07174020"
71315,ERICO VERISSIMO,182760,"RUA PORTUGUESA, 394 - VILA ENDRES - 07041050"
87433,PARQUE JUREMA III,182788,"JAGUAREMA, 23 - PARQUE JUREMA - 07244020"
71458,BRUNO RICCO PADRE,182769,"CRISOPOLIS, 226 - JARDIM PRESIDENTE DUTRA - 07170240"
74753,ALBERTO BACAN PROFESSOR,182784,"JAGUARIBI, 59 - VILA NOVA CUMBICA - 07231360"
75048,LICINIO CARPINELLI PROFESSOR,182786,"AVENIDA CENTENARIO, 159 - JARDIM CENTENARIO - 07270000"
71449,FABIO FANUCCHI PROFESSOR,182767,"AVENIDA FAUSTINO RAMALHO, 307 - JARDIM VILA GALVAO - 07054040"
71298,JOSE ROBERTO FRIEBOLIN PROFESSOR,182758,"BAHIA, 392 - VILA ROSALIA - 07072200"
74752,BARTHOLOMEU DE CARLOS,182783,"ARACAJU, 490 - JARDIM LEBLON - 07272090"
123239,ANTONIO PRATICI PREFEITO,182801,"RUA CARLOS DRUMOND ANDRADE, 372 - RESIDENCIAL PARQUE CUMBICA - 07174015"
71533,CID AUGUSTO GUELLI PROFESSOR,182770,"BRAGA, 312 - JARDIM ANNY - 07262321"
71307,FREDERICO DE BARROS BROTERO PROFESSOR,182759,"RUA JAIMINHO, 82 - VILA PROGRESSO - 07095150"
71196,PAULO NOGUEIRA PROFESSOR,182752,"RUA BARTOLOMEU DE GUSMAO, 2 - JARDIM SANTA FRANCISCA - 07024010"
123109,ALAYDE MARIA VICENTE PROFESSORA,182800,"RUA IDA RICHI, 134 - JARDIM MARIA ALICE - 07263410"
124418,ANNA LAMBERGA ZEGLIO,182810,"RUA DO POENTE, 100 - PIMENTAS - 07263721"
123787,PASCOAL MAIMONI FILHO PROFESSOR,182806,"TELHA, 423 - JARDIM MONTE ALEGRE - 07273280"
71416,JOAO ALVARES DE SIQUEIRA BUENO,182764,"ANTONIO PEREIRA DA SILVA CABO, 438 - JARDIM TRANQUILIDADE - 07051011"
71408,CLARICE LISPECTOR,182763,"RUA MIGUEL BIONDI, 222 - TORRES TIBAGI - 07060080"
124788,CIDADE SOIMCO II,182813,"RUA  SARGENTO PLINIO FERNANDES GONCALVES, 608 - CUMBICA - 07181100"
123107,MARIA LEDA FERNANDES BRIGO PROFESSORA,182798,"RUA WAMBES, 112 - JARDIM OTTAWA - 07230270"
87434,PARQUE JUREMA IV,182789,"TURIM, 150 - PARQUE JUREMA - 07244023"
74692,JOCILA PEREIRA GUIMARAES PROFESSORA,182782,"MARIA ELISA DA NOBREGA, 136 - VILA GALVAO - 07061060"
72269,ANTONIO VIANA DE SOUZA PROFESSOR,182781,"TURIM, 192 - PARQUE JUREMA - 07244023"
71212,EMILIA ANNA ANTONIO PROFESSORA,182754,"RUA MORAS, SN - PARQUE SANTO ANTONIO - 07062071"
71176,JOSE SCARAMELLI PROFESSOR,182750,"PALMEIRAS, 776 - GOPOUVA - 07022000"
124711,JOSE DA COSTA BOUCINHAS PROFESSOR,182811,"ATALAIA DO NORTE, 302 - JARDIM CUMBICA - 07240120"
71127,ENNIO CHIESA PROFESSOR,182746,"MARIANO MANZONI, 88 - JARDIM DOURADO - 07093200"
127361,ANTONIO BALDUSCO PREFEITO,182889,"RUA DAS PRIMAVERAS, 270 - DESPEZIO - 06890000"
137189,MARIA OLIMPIA DE SOUZA QUEIROZ MACIEL,182900,"RUA ANTONIO QUERUBIM, 256 - PARQUE SAO LOURENCO - 06864380"
72381,SEBASTIAO DE MORAES CARDOSO,182838,"R LISBOA, 25 - VL S MARIA - 06856760"
124296,BAIRRO VITALINO,182875,"ESTRADA CACHOEIRA DO FRANCA, 100 - VITALINO - 06950000"
74948,LEONICE DE AQUINO OLIVEIRA,182848,"RUA EGAS DOS SANTOS, 120 - JD SAO PAULO - 06900000"
78272,ANDRE FRANCO MONTORO GOVERNADOR,182862,"RUA JOAO ALFREDO DE MORAES, 300 - CENTRO - 06890000"
127919,LUCIA AKEMI MIYA PROFA,182897,"EST JOAO RODRIGUES DE MORAES, 100 - JD S PEDRO - 06863240"
125123,PAULO DE CASTRO FERREIRA JUNIOR JORNALISTA,182882,"RUA JORGE FADLO, SN - PARQUE PARAISO - 06852335"
124579,JARDIM CAMPESTRE,182879,"RUA PADRE DONIZETI, 765 - JARDIM CAMPESTRE - 06900000"
75436,PEDRO VILLAS BOAS DE SOUZA DOM,182857,"RUA JOAO RIBEIRO CRAVO ROXO, S/Nº - JARDIM CAMPESTRE - 06900000"
75647,JOAQUIM MENDES FELIZ,182858,"RUA JOAO ANTONIO OLIVEIRA, 315 - VAL FLOR - 06900000"
123265,LORIS NASSIF MATTAR PROFA,182864,"ESTRADA MUNICIPAL BEASILIO VIEIRA, 450 - CONGONHAL - 06900000"
72409,JULIA DE CASTRO CARNEIRO,182843,"SOLIMOES, 1875 - CIDADE SANTA JULIA - 06866500"
127477,JARDIM SILVANIA,182895,"MAXIMILIANO PEREIRA, 23 - VILA DIRCE - 06900000"
74950,SALVADOR DE LEONE,182849,"NOVO ALVORECER, 1 - POTUVERA - 06886510"
123416,JOAO ORTIZ RODRIGUES,182870,"ESTR DR ANDRE STUCCHI, 1900 - FILIPINHO - 06900000"
124932,NATERCIA CREMM DE MORAES PEDRO PROFESSORA,182880,"RUA MANDAGUARI, 150 - PARQUE JANDAIA - 06866220"
127463,CHACARA FLORIDA II,182894,"RUA CAMINHO CELIO JOSE PAULO, 90 - CHACARA FLORIDA 2 - 06900000"
75435,HELIO LUIZ DOBROCHINSKI PROF,182856,"AVENIDA HENRIQUE SCHUNCK, 33 - CIPO - 06900000"
125122,LEDA FELICE FERREIRA PROFESSORA,182881,"RUA CRISTALINO WEISHAUPT, 440 - JARDIM PARAISO - 06851050"
137188,BENEVIDES BERALDO COMENDADOR,182899,"SILVIO FERREIRA DOMINGUES, 160 - JARDIM DAS PALMEIRAS - 06871170"
124066,FRANCISCO DE PAULA TEIXEIRA,182873,"RUA SAO DANIEL, 2 - JDPROGRESSO - 06900000"
74591,JARDIM JACIRA,182846,"RUA MONTEIRO LOBATO, 11 - JARDIM JACIRA - 06864170"
124250,EURICO DA SILVA BASTOS DOUTOR PROFESSOR,182874,"RUA CELSO MESQUITA LEITE, 30 - PARQUE PARAISO - 06850290"
74951,MASSAKO HIGASHIOKA PROFESSORA,182850,"RUA ARACATUBA, 36 - RECREIO CAMPESTRE - 06856020"
72384,MARIANINHA QUEIROZ PROFESSORA,182840,"PRACA DEZ DE AGOSTO, 35 - CENTRO - 06890000"
72379,ISABEL A REDENTORA,182836,"JOSE RICARDO FARIA, 1 - JARDIM BRANCA FLOR - 06855870"
123601,SOPHIA MARIA JANUARIA AMARAL,182871,"RUA PENSILVANIA, 2100 - PARQUE PARAISO - 06852620"
126208,JOAQUIM FERNANDO PAES DE BARROS NETO,182887,"RUA PERSIA, 1130 - PARQUE PARAISO - 06852220"
123324,BAIRRO ITAQUACIARA,182867,"ABIAS DA SILVA, 3003 - ITAQUACIARA - 06874260"
126736,JARDIM DO CARMO,182888,"RODOVIA JOSE SIMOES LOURO JUNIOR, 12898 - JARDIM DO EDEM - 06865800"
127410,DONIZETTI APARECIDO LEITE PROFESSOR,182891,"RUA JAVINA SCHUNCK, 37 - CIPO GUACU - 06900000"
124429,LUIZ SCHUNCK,182876,"AVENIDA LUZA AUGUSTO CORREA, 1300 - CIPO - 06900000"
75292,ANTONIO FLORENTINO,182852,"RUA CARLOS DRUMOND DE ANDRADE, 70 - JARDIM JACIRA - 06864400"
127550,ASDRUBAL DO NASCIMENTO QUEIROZ PROFESSOR,182896,"RUA PRESIDENTE COSTA E SILVA, 263 - JARDIM ANALANDIA - 06864640"
123924,BAIRRO NOSSA SENHORA DA CONCEICAO,182872,"RUA OSWALDO BARBOSA GUIMARAES, 400 - NOSSA SENHORA CONCEICAO - 06950000"
123267,BAIRRO DA PALMEIRINHA,182865,"RUA JOAO PEREIRA DA SILVA, 550 - PALMEIRINHA - 06950000"
75294,OLIVIA DE FARIA NOGUEIRA,182853,"ROD JOSE SIMOES LOURO JR, 46 - SANTA ISABEL - 06900000"
127460,ASA BRANCA DA SERRA,182893,"ALMERINDO PEREIRA BUENO, 202 - JARDIM NISALVES - 06871030"
74952,EDUARDO ROBERTO DAHER,182851,"ESTRADA PREFEITO BENTO ROGER DOMINGUES, 197 - MOMBACA - 06868800"
71563,CEL JTO A EE OREDO RODRIGUES DA CRUZ,182834,"31 DE MARCO, 111 - CENTRO - 06950000"
72406,MARIA ANDRE SCHUNCK DONA,182842,"RUA JOSE NOGUEIRA, 22 - CIPO GUACU - 06900000"
72385,ANGENOR DE OLIVEIRA POETA,182841,"JOAO RODRIGUES DE MORAES, 500 - DA LAGOA - 06860400"
127393,ELIANA FISCHER BAMBI DELFINO PINTO PROFESSORA,182890,"RUA DOS LAGOS, 20 - SENHORINHAS - 06950000"
124577,NEIDE CELESTINA DE OLIVEIRA PROFA,182878,"RSEBASTIAO PDE ANDRADE, 91 - R LAGOA GRANDE - 06900000"
72377,CARLOS ALBERTO PEREIRA,182835,"R TERRA NOVA, 400 - JD ITAPECERICA - 06853450"
123268,JORGE NINO SOARES PROFESSOR,182866,"AVENIDA 31 DE MARCO, 1811 - DOS JUSTINOS - 06950000"
75648,ABRAHAO DE MORAES PROFESSOR,182859,"AVENIDA GROENLANDIA, 2165 - PARQUE PARAISO - 06852885"
76678,JARDIM MONTESANO,182860,"OCEANIA, 49 - VILA JOAO MONTESANO - 06853530"
72380,MATILDE MARIA CREMM,182837,"RUA SEBASTIAO PEREIRA DA SILVA, 35 - POTUVERA - 06882110"
107462,CEL JTO A EE NATERCIA CREMM DE MORAES PEDRO PROFESSORA,182863,"MANDAGUARI, 150 - PARQUE JANDAIA - 06866220"
72383,JOAO BAPTISTA DE OLIVEIRA,182839,"R MAJOR MANOEL FRANCISCO DE MORAES, 186 - CENTRO - 06850050"
78265,BAIRRO DOS BARNABES RECANTO DAS ORQUIDEAS,182861,"RUA ANTONIO FRANCISCO PEREIRA, 285 - BAIRRO DOS BARNABES - 06950000"
74652,GERTRUDES EDER,182847,"AVENIDA SOLDADO, 2100 - JARDIM VALO VELHO - 06856700"
75296,BAIRRO DAS PALMEIRAS,182854,"RODOVIA BR 116  KM 317, 125 - DAS PALMEIRAS - 06950000"
74588,BAIRRO DOS BARNABES,182845,"RUA ANTONIO SOARES GODINHO, 413 - BARNABES - 06950000"
128508,ALEXANDRE RODRIGUES NOGUEIRA,182898,"RUA ALEXANDRE RODRIGUES NOGUEIRA, 501 - JARDIM EMILIA - 06900000"
125807,OREDO RODRIGUES DA CRUZ,182885,"AVENIDA 31 DE MARCO, 111 - CENTRO - 06950000"
125805,PORCINO RODRIGUES PROF,182884,"R MARIA APARECIDA PEIXOTO MARINHO BARBOSA, 101 - OLARIA - 06859070"
74512,INSTITUTO MARIA IMACULADA,182844,"EST RESSACA, 1121 - RESSACA - 06887300"
124564,BAIRRO BOA VISTA,182877,"ESTRADA MUNICIPAL DO BAYTON, 1545 - BOA VISTA - 06900000"
75412,JOSE SILVEIRA DA MOTTA PROFESSOR,182855,"PIRACEMA, 95 - JARDIM SAMPAIO - 06851400"
127411,LEVI PEREIRA MARTINS PROFESSOR,182892,"ESTRADA DO BAYNGTON, 155 - PENTEADO - 06900000"
123325,PEDRA BRANCA,182868,"RUA DAS VIOLETAS, 196 - JARDIM PALMEIRAS - 06950000"
123415,MARIO FRANCISCO DE AMORIM,182869,"RUA SOLDADO PACIFICO CARVALHO MACHADO, 50 - CHACARA FLORIDA - 06900000"
125282,CEL JTO A EE ASA BRANCA DA SERRA,182883,"ALMERINDO PEREIRA BUENO, 202 - JARDIM NISALVES - 06871030"
125812,PASCHOAL CARLOS MAGNO,182886,"AV CEL LUIZ TENORIO BRITO, 1000 - CENTRO - 06900000"
71296,CEL JTO A EE PASCHOAL CARLOS MAGNO,182833,"CORONEL LUIZ TENORIO DE BRITO, 1000 - CENTRO - 06900000"
124992,JOSE CELSO DE MELLO PROF,182951,"ALBERTO QUINTO LABRONICE DOUTOR, 62 - CONJUNTO HABITACIONAL ORLANDO LISBOA DE ALMEIDA - 18277390"
72802,BERNARDES JUNIOR DESEMBARGADOR,182907,"ITAPETININGA, 51 - VILA ARRUDA - 18212198"
137225,PERICLES GALVAO PROF,182961,"ESTRADA JOSE CORREA DE MORAES, SN - CHAPADA GRANDE - 18206800"
77395,CARLOS EDUARDO MATTARAZZO CARREIRA PROF,182932,"RUA ANTONIO SOARES DA SILVA, 170 - JARDIM BRASIL - 18214500"
72773,HOLAMBRA II,182903,"DAS POSSES, 55 - CAMPOS DE HOLAMBRA - 18725000"
72937,CHICO PEREIRA,182922,"ANTONIO SANTO, 249 - CENTRO - 18275010"
124551,EURINY DE SOUZA VIEIRA PROFA,182947,"ESTRADA MUNICIPAL JOSE CORREA DE MORAES, 225 - CHAPADINHA - 18206800"
75221,ELISIARIO MARTINS DE MELLO PROF,182927,"RUA ENGENHEIRO CAIO DIAS BATISTA, 240 - VILA REGINA - 18209290"
77404,ALCEU GOMES DA SILVA PROF,182933,"ANTONIO BRUNETTI PADRE, 1800 - VILA RIO BRANCO - 18208080"
72813,VIRGILIO SILVEIRA PROF,182914,"RUA JOAO GALDINO DE CAMARGO, 203 - RECHA - 18217000"
72806,ADHERBAL DE PAULA FERREIRA,182910,"PEIXOTO GOMIDE, 126 - CENTRO - 18200160"
123742,MARIA IMACULADA CERQUEIRA BORHER PROFA,182945,"RUA GABRIEL TADEU ANTUNES MEDEIROS, 67 - VILA SAO JOAO - 18225000"
72808,ABILIO FONTES PROF,182912,"JOAO BATISTA DE MACEDO MENDES DOUTOR, SN - VILA ROSA - 18200560"
72818,FONSECA MAJOR,182916,"RUA VENANCIO AYRES, 108 - CENTRO - 18200013"
72941,ARY DE ALMEIDA SINISGALLI PROF,182923,"CECILIO BONEDER, 428 - VILA ESPERANCA - 18278003"
123337,ORESTES ORIS DE ALBUQUERQUE PROF,182941,"RUA JONAS VILKAS, 47 - JARDIM INGA - 18240000"
72823,NESTOR FOGACA,182919,"RUA RUI BARBOSA, 322 - CENTRO - 18230000"
72810,FLORA PRESTES CESAR PROFA,182913,"RUA NOSSA SENHORA DAS DORES, 390 - CENTRO - 18225000"
72798,IVENS VIEIRA,182904,"RUA MAJOR PEREIRA DE MORAES, 1228 - CENTRO - 18240970"
72936,BARAO DE SURUI,182921,"PRACA PAULO SETUBAL, 101 - CENTRO - 18270380"
72819,RENATO DA ROCHA MIRANDA,182917,"RUA PRUDENTE ALVES, SN - CENTRO - 18245000"
125872,ERNESTA XAVIER RABELO ORSI PROFA,182954,"RUA JUVENAL ROLIN CYRENEU, 42 - JARDIM ITALIA - 18201600"
137150,JAIR BARTH PROF,182960,"JOSE SIDNEY DA CUNHA DOUTOR, SN - JARDIM BELA VISTA - 18207720"
72807,SEBASTIAO PINTO PROF,182911,"RUBENS VIEIRA DA SILVA, SN - VILA SANTANA - 18210026"
95653,CENTRO ATEND SOCIOED ADOLESC ITAPETININGAESPERANCACI,182934,"GLADYS BERNARDES MINHOTO, KM 63 - VILA BELO HORIZONTE - 18211265"
74800,SADAMITA IVASSAKI,182925,"RUA GENTIL CAMARGO, 283 - ABAITINGA - 18230000"
109020,PENITENCIARIA II DE ITAPETININGA,182938,"RODOVIA GLADYS BERNARDES MINHOTO, SN - CAPAO ALTO - 18211265"
127976,MASSANORI KARAZAWA,182958,"ESTRADA VICINAL KUNIHEI ARIGA, SN - BAIRRO COLONIAL PINHAL - 18230000"
74633,EDUARDO SOARES PROF,182924,"IDIARTE MACIEL, SN - CENTRO - 18220000"
108252,CEL JTO A EE PEIXOTO GOMIDE,182935,"AVENIDA PEIXOTO GOMIDE, 198 - CENTRO - 18201600"
72822,MODESTO TAVARES DE LIMA PROF,182918,"RUA ACACIO DE MORAES TERRA, 376 - JARDIM PAULISTA - 18214385"
123500,JOSE BALTAZAR DE SOUZA,182942,"RUA JOSE ANTONIO VIEIRA, 300 - GRAMADAO - 18230000"
72755,ANTONIO LUIZ DUARTE,182902,"RUA JOAQUIM VIEIRA DE MEDEIROS, 1134 - CENTRO - 18720000"
125871,DARCY VIEIRA,182953,"FRANCISCO RODRIGUES JUNIOR, 289 - VILA BARTH - 18205590"
123505,SEMIRAMIS TURELLI AZEVEDO PROFA,182943,"GLADYS BERNARDES MINHOTO DONA, 411 - JARDIM TOKIO - 18279580"
75663,ATALIBA JULIO DE OLIVEIRA PROF,182930,"JOSE SANTANA DE OLIVEIRA, 116 - VILA NOVA ITAPETININGA - 18203300"
109103,PENITENCIARIA II DE GUAREI,182939,"ESTRADA VICINAL DOMICIANO DE SOUZA, SN - CAPELA VELHA - 18250000"
123923,EVONIO MARQUES PROF,182946,"ONORIO SALES, S/Nº - VARGINHA - 18218500"
126267,EZEQUIEL CASTANHO PROF,182955,"PRACA CORONEL ANIBAL CASTANHO, 288 - CENTRO - 18250000"
124808,MARIA ELISA DE OLIVEIRA PROFA,182949,"RUA CORONEL FERNANDO PRESTES, 460 - CENTRO - 18230000"
72816,CORINA CACAPAVA BARTH PROFA,182915,"RUA DOUTOR COUTINHO, 1370 - VILA JUDITH - 18200358"
125870,SEBASTIAO VILLACA PROF,182952,"ANTONIO BRUNETTI PADRE, 933 - VILA RIO BRANCO - 18208080"
72803,PEIXOTO GOMIDE,182908,"PEIXOTO GOMIDE, 198 - CENTRO - 18200160"
123733,ASTOR VASQUES LOPES PROF,182944,"RUA ANTONIO SOARES DA SILVA, 180 - JARDIM BRASIL - 18214500"
72804,FERNANDO PRESTES CEL,182909,"PEIXOTO GOMIDE, 250 - CENTRO - 18200160"
124906,DEOCLES VIEIRA DE CAMARGO PROF,182950,"SETE DE MAIO, 828 - CENTRO - 18275050"
127260,LIENETTE AVALONE RIBEIRO PROFA,182956,"LICINIO ALVES DA CRUZ PROFESSOR, 140 - PARQUE SANTA MARIA - 18271750"
109002,CENTRO DE RESSOCIALIZACAO DE ITAPETININGA,182936,"GLADYS BERNARDES MINHOTO, 63 - VILA BELO HORIZONTE - 18211265"
109480,CEL JTO A EE CHICO PEREIRA,182940,"SANTO ANTONIO, 249 - CENTRO - 18275010"
75170,JOSE DA CONCEICAO HOLTZ PROF,182926,"RUA FRANCISCO ALMEIDA MELO, 143 - GRAMADINHO - 18218000"
72801,FORTUNATO DE CAMARGO DR,182906,"RUA IRMAOS BASILE, 527 - CENTRO - 18240000"
109009,PENITENCIARIA JAIRO DE ALMEIDA BUENO,182937,"GLADYS BERNARDES MINHOTO, SN - VILA BELO HORIZONTE - 18211265"
75468,JUVENAL PAIVA PEREIRA PROF,182929,"PEDRO LOPES DE ALMEIDA, 211 - TUPY - 18207818"
124656,MARIA DE LOURDES BARREIROS CARVALHO PROFA,182948,"WENCESLAU BRAZ, SN - VILA POPULAR - 18213170"
72925,ALTINA MAYNARDES ARAUJO PROFA,182920,"RUA TEOFILO ANDRADE GAMA, 800 - BOQUEIRAO - 18270360"
75467,ERNESTINA LOUREIRO MIRANDA PROFA,182928,"SANTINO LEME DE ALMEIDA, S/N - VILA BELO HORIZONTE - 18211180"
134147,PENITENCIARIA I DE GUAREI,182959,"ESTRADA VICINAL DOMICIANO, SN - CAPELA VELHA - 18250000"
127431,FERNANDO GUEDES DE MORAES PROF,182957,"RUA DOUTOR ANTONIO JARBAS VEIGA DE BARROS, 205 - JARDIM LUCILA - 18277012"
72799,CASTANHO DE ALMEIDA CEL,182905,"RUA CORONEL ANDRADE, 152 - CENTRO - 18250000"
75665,MARIA FRANCISCA DEOCLECIO ARRIVABENE PROFA,182931,"RUA CAMILO MOYSES, 150 - COHAB - 18230000"
128507,CINIRA DANIEL DA SILVA PROFESSORA,182984,"MARTINHO DANIEL DA SILVA, 50 - GUARIZINHO - 18420000"
137319,BAIRRO BOA VISTA INTERVALES,182985,"BAIRRO BOA VISTA, SN - BOA VISTA INTERVALES - 18315000"
123870,JOAO BAPTISTA DO AMARAL VASCONCELLOS PROFESSOR,182976,"RUA PAULO MENDES DE CARVALHO, 34 - VILA APARECIDA - 18303090"
109498,CEL JTO A EE RAUL VENTURELLI DR,182975,"YOITI IKEDA, 170 - JARDIM CRUZEIRO - 18305485"
72820,RAUL VENTURELLI DOUTOR,182975,"YOITI IKEDA, 170 - JARDIM CRUZEIRO - 18305485"
72805,OSCAR KURTZ CAMARGO,182963,"RUA JOAQUIM AMANTINO FERREIRA, 317 - CENTRO - 18315000"
72837,SIMPLICIANO CAMPOLIM DE ALMEIDA,182967,"RUA SALATIEL DAVID MUZEL, 1515 - CENTRO - 18435000"
124278,RICARDO CAMPOLIM DE ALMEIDA NETO,182977,"RUA NELSON ANTUNES CORDEIRO, SN - ITAOCA - 18435000"
125875,JEMINIANO DAVID MUZEL,182979,"RUA JOAO ANTUNES DE MOURA, 871 - JARDIM EUROPA - 18406470"
72845,ZULMIRA DE OLIVEIRA PROFESSORA,182969,"RUA CAPAO BONITO, 99 - VILA BOM JESUS - 18400690"
74506,SILVERIO MONTEIRO PROFESSOR,182971,"BAIRRO PACOVA, SN - PACOVA - 18400970"
126192,CELIA VASQUES FERRARI DUCH PROFESSORA,182981,"RUA BENEDITO PAULINO NOGUEIRA, SN - CENTRO - 18425000"
72809,ARLINDO VIEIRA PADRE,182964,"RUA CAMPOS SALLES, 1141 - CENTRO - 18300410"
72847,FRANCELINA FRANCO PROFESSORA,182970,"RUA OLIMPIO NOGUEIRA, 135 - CENTRO - 18290000"
127556,BAIRRO TURVO DOS ALMEIDAS,182983,"BAIRRO TURVO DOS ALMEIDAS, SN - TURVO DOS ALMEIDAS - 18300990"
75666,ANTONIO DEFFUNE DOUTOR,182973,"PEDRO ANSELMO FERREIRA, 60 - ALTO DA BRANCAL - 18400970"
103657,CEL JTO A EE NICOTA SOARES,182974,"RUA FRANCISCO DE LIMA,  - VILA APARECIDA - 18401050"
72842,NICOTA SOARES PROFESSORA,182968,"RUA ROSELANDIA,  - JARDIM BEVELDERE - 18401050"
75172,GERSON DE BARROS MARGARIDO PROFESSOR,182972,"PRACA LEANDRO COSTA, 78 - SAO ROQUE - 18400970"
72835,OTAVIO FERRARI,182966,"RUA MARIO PRANDINI, 962 - CENTRO - 18400170"
124287,BAIRRO FERREIRA DOS MATOS,182978,"PADRE ARLINDO VIEIRA, SN - FERREIRA DOS MATOS - 18315000"
125876,JOSE VASQUES FERRARI PROFESSOR,182980,"HUMBERTO FASCETTI PROFESSOR, 120 - PARQUE CIMENTOLANDIA - 18409620"
127287,AGROVILA I,182982,"FAZENDA PIRITUBA, SN - 13 DE MAIO - 18400970"
72375,JOSE DOMINGOS DA SILVEIRA PROFESSOR,182992,"VICENTE DE PAULA SAO, 100 - JARDIM MUTINGA - 06463050"
124576,LEONOR MENDES DE BARROS,183022,"LEBLON, 105 - EMPRESARIAL 18 DO FORTE - 06472003"
126261,LUIS DA CAMARA CASCUDO,183036,"ORQUIDEAS, 270 - VILA IPE - 06606325"
123916,AMADOR AGUIAR,183020,"MARTINS FONTES, 412 - PARQUE IMPERIAL - 06462080"
126215,JOAO BATISTA SOLDE,183034,"MAUA VISCONDE, 5 - JARDIM DAS MARGARIDAS - 06622120"
126204,NESTOR DE CAMARGO PREFEITO,183033,"RUA VITORINO, 206 - JARDIM MUTINGA - 06463290"
124785,PAULO DA COSTA PAN CHACON PROFESSOR,183024,"AVENIDA PEDRO PAULINO, SN - JARDIM PAULISTA - 06663000"
124975,ELIANA ANDRES DE ALMEIDA SOUZA PROFESSORA,183027,"RUA EDUARDA RIOS TREVISAN, 88 - VILA ALICIA - 06694730"
83970,JOSE SERGIO PEREIRA PROFESSOR,183012,"SUL AMERICANOS, SN - PARQUE SUBURBANO - 06663650"
126316,JARDIM MARIA HELENA I,183039,"CRISTIANE, 25 - PARQUE DOS CAMARGOS - 06436010"
72366,CAIO PRADO JUNIOR DEPUTADO,182988,"RUA OSCAR BRESSANE, 85 - VILA MORELLATO - 06408060"
125815,CANDIDO RONDON MARECHAL,183031,"AVENIDA RUBENS CARAMEZ, 779 - VILA AURORA - 06657000"
128425,ALAYDE DOMINGUES COUTO MACEDO PROFESSORA,183043,"AVENIDA BRIGADEIRO MANOEL RODRIGUES JORDAO, 1135 - JARDIM TUPA - 06433010"
