76102,ESMERALDA SOARES FERRAZ PROFESSORA,184741,"RUA PRUDENTE DE MORAES, 400 - VILA SA - 19907300"
126116,JOSEPHA CUBAS DA SILVA PROFESSORA,184751,"FRANCISCO DE ALMEIDA JORNALISTA, 463 - PARQUE MINAS GERAIS - 19913155"
74409,JOSE AUGUSTO DE OLIVEIRA PROFESSOR,184734,"RUA SEBASTIAO MIRANDA, 621 - JARDIM AMERICA - 19914050"
74396,JUSTINA DE OLIVEIRA GONCALVES PROFESSORA,184729,"RUA FERNANDO SANCHES, 140 - VILA SAO FRANCISCO - 19905156"
127912,ERNESTO FONSECA DOUTOR,184756,"PRACA DOS ESTUDANTES, 50 - CENTRO - 18970191"
74425,MIGUEL PRIANTE CALDERARO DOUTOR,184738,"RUA PREFEITO PAULO MOREIRA, 237 - CENTRO - 18960000"
109559,CEL JTO A EE LEONIDAS DO AMARAL VIEIRA,184743,"PRACA SAO SEBASTIAO, 831 -  - 18900039"
74907,BIECIO DE BRITTO,184740,"PRACA SAO BOM JESUS, 42 - VILA CAPORANGA - 18925008"
126123,GENESIO BOAMORTE DOUTOR,184754,"RUA FREI MARCOS RIGHI, 43 -  - 18900031"
126115,JULIO MASTRODOMENICO PROFESSOR,184750,"RUA SETE DE SETEMBRO, 815 - CENTRO - 18950000"
126114,HORACIO SOARES,184749,"EUCLIDES DA CUNHA, 821 - CENTRO - 19900043"
110964,CENTRO DE RESSOCIALIZACAO DE OURINHOS,184744,"JACINTO FERREIRA DE SA, 21 - VILA CHRISTONI - 19911720"
74412,LEONIDAS DO AMARAL VIEIRA,184735,"PRACA SAO SEBASTIAO, 831 - CENTRO - 18900039"
74386,MARIO BRIATORE PADRE,184727,"RANGEL PESTANA, 607 - CENTRO - 19920007"
74081,CARLOS SAMPAIO FILHO DOUTOR,184763,"DOUTOR CARLOS SAMPAIO, 40 - CENTRO - 16300019"
76089,ADELINO PETERS,184771,"DOUTOR ANTONIO DEFINE, 1280 - CENTRO - 16300017"
126072,MARIA DE FATIMA GOMES ALVES,184779,"RUA BRASILIA, 10 - CENTRO - 16250000"
74094,FRANCISCO ANTONINO PREFEITO,184768,"PRACA SANTOS DUMONT, SN - CENTRO - 16340000"
137307,LUIZA MARIA BERNARDES NORY PROFESSORA,184780,"JOAQUIM BURANELLO, 40 - JARDIM ELDORADO - 16308208"
74084,MARIA EUNICE MARTINS FERREIRA PROFESSORA,184765,"RUA GUTEMBERG MARTINS FERREIRA, 43 - CENTRO - 16360000"
126070,MANOEL BENTO NETO,184778,"RUA CASSIMIRO NOGUEIRA DA SILVA, 350 - CENTRO - 16240000"
126069,YONE DIAS DE AGUIAR PROFESSORA,184777,"BAHIA, 143 - VILA FATIMA - 16308046"
74093,AUGUSTO PEREIRA DE MORAES,184767,"OLSEN, 315 - CENTRO - 16300025"
74087,JOSE CARLOS DA SILVA PROFESSOR,184766,"RUA PAPA JOAO XXIII, 143 - CENTRO - 16350000"
75147,ESTER EUNICE ALMEIDA FARIA DE OLIVEIRA PROFESSORA,184770,"GABRIEL GAETTI, 513 - CIDADE JARDIM - 16305220"
74079,LUIZ CHRISOSTOMO DE OLIVEIRA,184762,"NOVE DE JULHO, 36 - CENTRO - 16300059"
109361,PENITENCIARIA COMPACTA DE AVANHANDAVA,184773,"RODOVIA MARECHAL RONDON, KM 475 - ROCINHA - 16360000"
74082,DIOGO GARCIA MARTINS EXPEDICIONARIO,184764,"RUA JOAQUIM RIBEIRO, 270 - CENTRO - 16310000"
137358,JOANA HELENA DE CASTILHO MARQUES PROFESSORA,184781,"ALVARO GOMES, 191 A - PARQUE RESIDENCIAL MONREAL - 16303250"
104231,INDIA MARIA ROSA,184772,"POSTO INDIGENA ICATU, SN - GUAPORANGA - 16290000"
74097,JOSE FLORENTINO DE SOUZA,184769,"RUA ENEDIR SAMPAIO, 779 - CENTRO - 16290000"
117545,PROFESSOR JOAO TEIXEIRA SAMPAIO,184776,"EUCLYDES BIS, 315 - LOTEAMENTO RESIDENCIAL PEREIRINHA - 16309214"
111102,CEEJA PROFESSOR JOAO SEGURA,184775,"SANTA CASA, 1595 - VILA SAO JOAO - 16300304"
109560,CEL JTO A EE ADELINO PETERS,184774,"DOUTOR ANTONIO DEFINE, 1280 - CENTRO - 16300017"
123215,RUBENS ZAMITH PROFESSOR,184811,"LIRIOS, 319 - RESIDENCIAL VALE DAS ACACIAS - 12440440"
124878,JOSE AYLTON FALCAO PROFESSOR,184815,"LUIZ FLAVIO MARCONDES DE OLIVEIRA, SN - RESIDENCIAL NOVA ESPERANCA - 12426290"
72649,JOAO MARTINS DE ALMEIDA PROFESSOR,184785,"RUA FREI MAURICIO, 126 - JARDIM BOA VISTA - 12401080"
127405,CELIA KEIKO IKEDA PROFESSORA,184822,"ORLANDO FERREIRA, SN - RESIDENCIAL MARICA - 12411600"
72669,JOAO JOSE DE AZEVEDO MONSENHOR,184793,"RODOVIA DOUTOR CAIO GOMES FIGUEIREDO, SN - BOM SUCESSO - 12404010"
109094,PENITENCIARIA FEMININA SANTA MARIA EUFRASIA PELLETIER,184804,"RUA MONSENHOR AMADOR BUENO, 59 - CENTRO - 12120000"
72665,MARIO TAVARES DOUTOR,184791,"GUILHERME NICOLETTI, 247 - VILA SAO BENEDITO - 12445120"
128292,ESCOLASTICA ANTUNES SALGADO PROFESSORA,184828,"LUIS GONZAGA RIBEIRO, 251 - JARDIM REGINA MOREIRA CESAR - 12442370"
126229,JOSE PINTO MARCONDES PESTANA PROFESSOR,184819,"AVENIDA PRINCESA DO NORTE, SN - CIDADE NOVA - 12414060"
137425,DEMETRIO IVAHY BADARO DOUTOR,184833,"ATTILA BROTERO DE ASSIS, 191 - RESIDENCIAL ARCOIRIS - 12426050"
108107,EXPEDITO CAMARGO FREIRE PROFESSOR,184801,"GENKO SAKANE, 160 - BRANCAS NUVENS - 12460000"
74716,TEIXEIRA POMBO COMENDADOR,184798,"AVENIDA VITORIA REGIA, SN - FLOR DO VALE - 12120000"
72663,EURIPEDES BRAGA PROFESSOR,184789,"JOAO JOSE DE AZEVEDO MONSENHOR, 705 - CRISPIM - 12402010"
72648,JOAO PEDRO CARDOSO DR,184784,"R GODOFREDO PESTANA, 262 - JD ROSELY - 12410740"
71214,BEM VIVER,184783,"CARLOS LOPES GUEDES FILHO, 2625 - RESIDENCIAL NOVA ESPERANCA - 12426201"
110235,PENITENCIARIA FEMININA II DE TREMEMBE,184807,"AMADOR BUENO DA VEIGA, SN - UNA - 12120000"
127821,ALZIRA FRANCO PROFESSORA,184825,"RUA CONDESSA DE VIMIEIRO, 122 - ALTO DO CARDOSO - 12420200"
75656,IVONE NOGUEIRA DE AZEVEDO PROFESSORA,184800,"ROUXINOIS, 171 - TRIANGULO - 12413130"
125847,PEDRO SILVA PROFESSOR,184816,"JOSE BENEDITO QUIRINO, SN - CAMPINAS - 12415030"
137392,ANTONIO APPARECIDO FALCAO PROFESSOR,184832,"PONCIANO PEREIRA, 375 - JARDIM ELOYNA - 12413430"
72668,GABRIELLA MONTEIRO DE ATHAYDE MARCONDES PROFESSORA,184792,"CAPITAO AVELINO ALVES PEREIRA, SN - RIBEIRAO GRANDE - 12404018"
124411,ISIS CASTRO DE MELLO CESAR PROFA,184814,"R BENEDITO MORAIS SOBRINHO, SN - CJ HAB T IPES I SUL - 12443760"
72731,AMALIA GARCIA RIBEIRO PATTO PROFESSORA,184795,"AVENIDA SETE DE JANEIRO, SN - JARDIM SANTANA - 12120000"
127822,AFFONSO DE CARVALHO DESEMBARGADOR,184826,"AVENIDA ANTONIO JOAQUIM OLIVEIRA, 458 - CENTRO - 12450000"
125861,MANUEL CABRAL,184818,"PRACA DA REPUBLICA, SN - CENTRO - 12120000"
111104,JARDIM DOS CISNES,184809,"AVENIDA JUSCELINO KUBITSCHECK, SN - CENTRO - 12490000"
109032,CENTRO DE PROGRESSAO PENIT DR EDGARD MAGALHAES NORONHA,184803,"RODOVIA AMADOR BUENO DA VEIGA, SN - UNA - 12120970"
72670,YOLANDA BUENO DE GODOY PROFESSORA,184794,"JOAO FRANCISCO DA SILVA, 2805 - FEITAL - 12441240"
74392,CLARO CESAR DEPUTADO,184796,"OLIMPIO MARCONDES DE AZEREDO, 78 - LOTEAMENTO JOAO TAMBORINDEGUY FERNANDES - 12441030"
127533,DIRCE LEOPOLDINA CINTRA VILLAS BOAS PROFESSORA,184824,"ALAMEDA DAS GREVILEAS, 275 - CONJUNTO HABITACIONAL TERRA DOS IPES II FASE II - 12444010"
109561,CEL JTO A EE THEODORO CORREA CINTRA PROF,184805,"JOAQUIM CORREA CINTRA, 365 - V PAULISTA - 12460000"
126270,ISMENIA MONTEIRO DE OLIVEIRA PROFESSORA,184820,"SEBASTIAO MACHADO DE ANDRADE, 111 - LOTEAMENTO RESIDENCIAL ANDRADE - 12402500"
74658,IOLANDA VELLUTINI PROFESSORA,184797,"JOAO ANTONIO ROMAO MAESTRO, 255 - JARDIM SANTA CECILIA - 12411270"
75573,ALEXANDRINA GOMES DE ARAUJO RODRIGUES PROFESSORA,184799,"RUA BENEDICTO LUIZ MARCONDES BARROS, 430 - RESIDENCIAL E COMERCIAL CIDADE JARDIM - 12424280"
72662,RYOITI YASSUDA,184788,"GUILHERME SCHMIDT, 340 - JARDIM ROSELY - 12410670"
134235,PENITENCIARIA DR JOSE AUGUSTO CESAR SALGADO DE TREMEMBE II,184830,"RODOVIA AMADOR BUENO DA VEIGA, SN - UNA - 12120000"
126286,EUNICE BUENO ROMEIRO PROFESSORA,184821,"HUNGRIA, 475 - RESIDENCIAL PASIN - 12445590"
127429,ELOYNA SALGADO RIBEIRO PROFESSORA,184823,"JOSE BENEDICTO ALVES DOS SANTOS, SN - RESIDENCIAL E COMERCIAL CIDADE MORUMBI - 12403680"
109030,PENITENCIARIA DR TARCIZO LEONCE PINHEIRO CINTRA,184802,"RODOVIA AMADOR BUENO DA VEIGA, SN - UNA - 12120000"
72655,THEODORO CORREA CINTRA PROFESSOR,184786,"RUA JOAQUIM CORREA CINTRA, 365 - VILA PAULISTA - 12460000"
123723,ANTONIA CARLOTA GOMES PROFESSORA,184813,"RUA SAO LUIZ DO PARAITINGA, 30 - CIDADE NOVA - 12414260"
123214,DIRCE APARECIDA PEREIRA MARCONDES,184810,"RUA ENGENHEIRO ORLANDO DRUMOND MURGEL, 285 - PARQUE SAO DOMINGOS - 12410310"
134278,CEL JTO A EE ALFREDO PUJOL DOUTOR,184831,"PRUDENTE DE MORAES, 376 - CENTRO - 12400230"
72660,MARIO BULCAO GIUDICE PROFESSOR,184787,"RUA IMPERATRIZ LEOPOLDINA, 25 - BAIRRO DO SANTANA - 12403310"
109564,CEL JTO A EE MANUEL CABRAL,184806,"PCA DA REPUBLICA, SN - CENTRO - 12120000"
123722,JOSE WADIE MILAD PROFESSOR,184812,"JOAO BATISTA ORTIZ MONTEIRO DOUTOR, 5 - RESIDENCIAL CAMPOS MAIA - 12422340"
125849,GENESIO CANDIDO PEREIRA DOUTOR,184817,"PRACA GENERAL MARCONDES SALGADO, 57 - CENTRO - 12490000"
128526,WILSON PIRES CESAR PROFESSOR,184829,"JOSE MARIA MONTEIRO, 160 - RESIDENCIAL OURO VERDE - 12412380"
110348,CEL JTO A EE ANTONIA CARLOTA GOMES PROFESSORA,184808,"LUIZ DO PARAITINGA SAO, 30 - CIDADE NOVA - 12414260"
127947,YONNE CESAR GUAYCURU DE OLIVEIRA PROFESSORA,184827,"MANOEL DA SILVA CARVALHO, 40 - NOSSA SENHORA DO PERPETUO SOCORRO - 12421080"
72664,ALFREDO PUJOL DOUTOR,184790,"RUA BARAO HOMEM DE MELLO, 63 - CENTRO - 12400440"
75388,PRUDENTE DOUTOR,184866,"PRACA GAL CARLOS M BITTENCOURT, S/N - CIDADE JARDIM - 13419003"
75585,ADOLPHO CARVALHO PROFESSOR,184868,"MELVIN JONES, 223 - CECAP - 13421520"
108392,MARCIA REGINA MODESTO DE PAULA DA ROCHA PROFESSORA,184876,"NILO PECANHA, 1510 - SANTA TEREZINHA - 13408025"
133781,BENEDICTO EVANGELISTA COSTA PROFESSOR,184905,"AV  DAS OLIVIERAS, 1205 - JARDIM  GILDA - 13412630"
73318,SAMUEL DE CASTRO NEVES DOUTOR,184856,"VIRGINIA VITTORELLI CORRER, 56 - SANTANA - 13411526"
73307,MANOEL DIAS DE ALMEIDA PROFESSOR,184851,"RUA JOAQUIM MENDES PEREIRA, 639 - CENTRO - 13440011"
131512,CENTRO ATEND SOCIOEDUC ADOLESCENTE PIRACICABA CI,184903,"RODOVIA LAERCIO CORTE  SP  147, SN - SANTA ROSA - 13400970"
109784,ATTILIO VIDAL LAFRATA PROFESSOR,184880,"RUA VATICANO, 28 - CAMPESTRE - 13401660"
73296,PEDRO DE MELLO,184845,"RUA 16 DE JULHO, 288 - TUPI - 13428415"
128296,VICENTE LUIS GROSSO,184900,"AVENIDA ANGELO FRANZIN, 831 - JARDIM NOVA ESTANCIA - 13520000"
75599,JETHRO VAZ DE TOLEDO PROFESSOR,184871,"GARCA, 535 - JARDIM ITAPUA - 13402055"
73303,JOSE ABILIO DE PAULA,184849,"JOSE PEDRO ASSINI, 50 - SANTA CRUZ - 13520000"
124617,JURACY NEVES DE MELLO FERRACCIU PROFESSOR,184888,"RUA JOSE PENATTI, 100 - NOIVA DA COLINA - 13420721"
96238,DIONETTI CALLEGARO MIORI PROFESSORA,184875,"RUA DOUTOR ELIAS ROSENTHAL, 570 - AGUA BRANCA - 13426164"
134266,CENTRO DE DETENCAO PROVISORIA PIRACICABA,184907,"RODOVIA 147 PIRACICABA/LIMEIRA, SN - SANTA ROSA - 13414020"
74926,JOAO SAMPAIO DOUTOR,184863,"AMADOR BUENO, 625 - MONTE LIBANO - 13401531"
124200,AUGUSTO MELEGA,184886,"ESTRADA ANTONIO DIAS RODRIGUES, 6100 - CAMPESTRE - 13401841"
73293,HONORATO FAUSTINO,184843,"EDU CHAVES, 914 - SAO DIMAS - 13416020"
73289,ANTONIO DE MELLO COTRIM PROFESSOR,184842,"RUA DONA STELA, 65 - PAULICEIA - 13401544"
124737,AVELINA PALMA LOSSO PROFESSORA,184892,"RUA MILTON TEIXEIRA DE SA, 184 - LOTEAMENTO SANTA ROSA - 13414216"
73322,PEDRO CREM FILHO PROFESSOR,184857,"AVENIDA PAULO MENEGUEL, 330 - RECREIO - 13515000"
109570,CEL JTO A EE ELIAS DE MELLO AYRES PROFESSOR,184879,"FERNANDO FEBELIANO DA COSTA, 429 - ALEMAES - 13416250"
127554,ANIGER FRANCISCO DE MARIA MELILLO DOM,184898,"PAU BRASIL, SN - BOSQUE DOS LENHEIROS - 13412523"
128459,OLIVIA BIANCO PROFESSORA,184901,"RUA PROFESSOR JOSE MARTINS DE TOLEDO, 394 - JARAGUA - 13403032"
124734,MELLITA LOBENWEIN BRASILIENSE PROFESSORA,184889,"RUA ABEL FRANCISCO PEREIRA, 1333 - JARAGUA - 13403016"
133782,BAIRRO SANTO ANTONIO,184906,"RUA ANTONIO LICO, 100 - JARDIM VITORIA - 13402732"
75378,MARIA DE LOURDES SILVEIRA COSENTINO PROFESSORA,184865,"RUA ALTINO ARANTES, 203 - VILA SONIA - 13408029"
73295,MORAIS BARROS,184844,"RUA ALFERES JOSE CAETANO, 600 - CENTRO - 13400120"
124735,EDUIR BENEDICTO SCARPARI PROFESSOR,184890,"LUTERO LUIZ, 150 - JARDIM ALVORADA - 13425688"
125950,JOSE DE MELLO MORAES PROFESSOR,184896,"JOAO SAO, 564 - SAO JUDAS - 13416382"
75717,FRANCISCO MARIANO DA COSTA PROFESSOR,184872,"RUA LAURA FERNANDES DE CAMPOS FERRARI, 47 - JARDIM NOVO HORIZONTE - 13402110"
73309,SUD MENNUCCI,184853,"RUA SAO JOAO, 1121 - ALTO - 13416585"
73326,BENEDITO DUTRA TEIXEIRA PROFESSOR,184859,"RUA CAETANO PARISI, 79 - SANTA HELENA - 13515000"
73288,CATHARINA CASALE PADOVANI PROFESSORA,184841,"VIRGILIO DA SILVA FAGUNDES, 1054 - SANTA TEREZINHA - 13411083"
73284,AUGUSTO SAES PROFESSOR,184838,"RUA DOM PEDRO I, 2517 - NOVA AMERICA - 13417791"
96083,CENTRO ATEND SOCIOEDUC ADOLESCENTE  PIRACICABA  CIP,184874,"ROD LAERCIO CORTE  SP  1475, SN - RURAL - 13400000"
73317,JORGE COURY DOUTOR,184855,"JOAQUIM ANDRE, 326 - PAULISTA - 13400850"
110245,FERNANDO MARIA FACHINI FREI,184881,"RUA DOMINGOS GREGOLIM, 550 - JARDIM LEVORATO - 17370344"
75416,JOSE MARTINS DE TOLEDO PROFESSOR,184867,"JULIO QUINELATTO, 33 - RESIDENCIAL TERRAS DE ARTEMIS ARTEMIS - 13432140"
125172,CEEJA ANTONIO JOSE FALCONE PROFESSOR,184893,"ROSARIO, 272 - CENTRO - 13400180"
74927,JOAO GUIDOTTI,184864,"RUA ANHANGUERA, 409 - MORUMBI - 13420350"
73306,JOSE ROMAO PROFESSOR,184850,"MANOEL CONCEICAO, 381 - VILA REZENDE - 13405230"
132513,EDSON RONTANI,184904,"OLIVIA ANTONICELLA ZANIN, SN - RESIDENCIAL ALTOS DO PIRACICABA - 13412276"
76343,LUIZ GONZAGA DE CAMPOS TOLEDO DOUTOR,184873,"ARTHUR PAULO FURLAN, 525 - VILA INDUSTRIAL - 13412251"
128543,HELIO PENTEADO DE CASTRO PROFESSOR,184902,"IPEUNA, 80 - SANTA TEREZINHA - 13409031"
125948,FRANCISCA ELISA DA SILVA,184894,"RUA PROFESSOR ARMANDO BERGAMIM, 334 - JARDIM MONUMENTO - 13405187"
73302,PEDRO MORAES CAVALCANTI,184848,"DOIS CORREGOS, 3701 - JARDIM NOVA IGUACU - 13423100"
125949,JOAO ALVES DE ALMEIDA PROFESSOR,184895,"RUA DOUTOR ALBERTO COURY, 602 - TANQUINHO GUAMIUM - 13433018"
124736,CAROLINA MENDES THAME PROFESSORA,184891,"ORLANDIA, 401 - LOTEAMENTO SAO FRANCISCO - 13423480"
73310,JACANA ALTAIR PEREIRA GUERRINI PROFESSORA,184854,"RUA DOUTOR PAULO PINTO, 2769 - VILA INDEPENDENCIA - 13418050"
73301,ALFREDO CARDOSO DOUTOR,184847,"MORAIS BARROS, 1884 - ALTO - 13419245"
118280,PENITENCIARIA MASCULINA DE PIRACICABA,184883,"RODOVIA LAERCIO CORTE SP 147, SN - AREIAO - 13414020"
123841,AFFONSO JOSE FIORAVANTI PROFESSOR,184885,"ECA DE QUEIROZ, 2621 - VILA MONTEIRO - 13418530"
73280,ADEMAR VIEIRA PISCO,184835,"RUA CORONEL JOSE ANTONIO FROTA, 381 - CENTRO - 17370031"
108393,EDUARDO MILAD KOAIK DOM,184877,"RUA ARACUAI, 35 - SANTA FE - 13401889"
126309,ANTONIO PINTO DE ALMEIDA FERRAZ DOUTOR,184897,"RUA ANGELINA GEROLAMO TORIN, 300 - JARDIM CAXAMBU - 13425012"
124498,JOAO CHIARINI DOUTOR PROFESSOR,184887,"JORDAO MARTINS, 280 - NOSSA SENHORA DE FATIMA - 13412082"
74598,DARIO BRASIL DOUTOR,184860,"RUA DONA AURORA, 416 - PAULICEIA - 13424150"
73300,RIO BRANCO BARAO DO,184846,"IPIRANGA, 924 - CENTRO - 13400485"
73282,MIRANDOLINA DE ALMEIDA CANTO PROFESSORA,184836,"RUA ARGENTINA, 65 - PIRACICAMIRIM - 13420610"
111031,AROLDO DONIZETTI LEITE,184882,"AVENIDA ANGELO FRANZIN, 1120 - JARDIM BOTANICO - 13520000"
109048,CENTRO DE RESSOCIALIZACAO FEMININO DE PIRACICABA,184878,"JOSE SAO, 260 - CENTRO - 13400330"
73285,JOAO CONCEICAO DOUTOR,184839,"JORGE PACHECO E CHAVES, 2899 - PAULISTA - 13401200"
73283,ALCIDES GUIDETTI ZAGATTO PROFESSOR,184837,"RUA OSVALDO F CAMPOS, 7 - JARDIM ESPLANADA - 13401523"
73287,ELIAS DE MELLO AYRES PROFESSOR,184840,"RUA CORONEL FERNANDO FEBELIANO DA COSTA, 429 - SAO DIMAS - 13416250"
74720,HELIO NEHRING PROFESSOR,184861,"RUA ESCOLASTICA COUTO ARANHA, 170 - SAO JORGE - 13402297"
127858,ABIGAIL DE AZEVEDO GRILLO PROFESSOR,184899,"AVENIDA DOUTOR JOAO TEODORO, 1485 - VILA REZENDE - 13405240"
75587,MARIO DEDINI COMENDADOR,184870,"RICARDO PINTO CESAR, 219 - JARDIM ALGODOAL - 13405432"
75586,MANASSES EPHRAIN PEREIRA PROFESSOR,184869,"RUA DONA STELA, 1039 - MONTE LIBANO - 13401544"
74721,LUCIANO GUIDOTTI COMENDADOR,184862,"ARMANDO CHIQUITO, 35 - JARDIM PARQUE JUPIA - 13403331"
123202,FELIPE CARDOSO,184884,"ESTRADA DOUTOR PLINIO ALVES DE MORAES, 20 - ANHUMAS - 13404755"
137171,PAULO LUIZ VALERIO,184908,"ESTRADA PIRACICABA ANHUMAS  SERROTE, 400 - ANHUMAS - 13404752"
73323,ANGELO FRANZIN,184858,"AVENIDA DOUTOR ANGELO NOGUEIRA VILA, S/Nº - CENTRO - 13528085"
73308,JERONYMO GALLO MONSENHOR,184852,"AVENIDA BARAO DE VALENCA, 518 - VILA REZENDE - 13405233"
74415,CALVINO BARBOSA FERRAZ,184913,"RUA JOSE ANTONIO SALGADO, 170 - CENTRO - 18790000"
74399,BENTO DE QUEIROZ PADRE,184910,"RUA ANTONIO MARANHO, 451 - CENTRO - 18860000"
134659,CEEJA DE PIRAJU,184926,"RUA DOUTOR WASHINGTON OSORIO DE OLIVEIRA, 1115 - VILA PIRATININGA - 18803052"
123622,ISABEL CRISTINA FAVARO PALMA PROFESSORA,184921,"RUA GAMALHER TRISTAO, SN - RIBEIRAO BONITO - 18837006"
127990,MONICA BERNABE GARROTE,184924,"PRACA MARIA HUNGRIA BUCHLER, 80 - AUGUSTO MORINI - 18808384"
128503,JOAQUIM GUILHERME MOREIRA PORTO DOUTOR,184925,"RUA SAO VICENTE DE PAULA, 453 - VILA PIRATININGA - 18803044"
74423,MARCOS RIBEIRO CORONEL,184915,"PRACA DEOCLECIANO RIBEIRO, 143 - CENTRO - 18870011"
76115,QUINZINHO CAMARGO PREFEITO,184918,"RUA NABY ASSAF, 77 - VILA TIBIRICA - 18810404"
109572,CEL JTO A EE JOAQUIM GUILHERME MOREIRA PORTO DR,184919,"RUA SAO VICENTE DE PAULA, 453 - VILA CANTIZANI - 18803044"
127914,JOSE TROMBI MONSENHOR,184923,"AVENIDA SAO CAETANO,  - VILA NOVA - 18870738"
126119,EDGARDO CARDOSO DOUTOR,184922,"RUA CATARINA MILANI MALULY, 374 - CENTRO - 18840000"
74431,ATALIBA LEONEL,184917,"RUA NENE FREITAS, 494 - CENTRO - 18800019"
123619,MARIA GONCALVES DA MOTTA,184920,"PRACA DOUTOR JOSE ATALIBA LEONEL, 5 - CONJUNTO HABITACIONAL HAYDEE ATHIE - 18803440"
74422,NHONHO BRAGA CORONEL,184914,"RUA CORONEL NHONHO BRAGA,  - CENTRO - 18800031"
74410,ORIZENA DE SOUZA ELENA PROFESSORA,184911,"AVENIDA CAPITAO DIOGO GOULART,  - CENTRO - 18830027"
74426,MIGUEL MARVULLO,184916,"RUA RIO DE JANEIRO, 598 - CENTRO - 18780000"
74411,JOAO GOBBO SOBRINHO,184912,"RUA AURELIO GOBBO, 166 - CENTRO - 18890000"
73330,WASHINGTON LUIZ,184938,"LUIZ GAMA, 600 - CENTRO - 13660047"
123195,ARLINDO FAVARO PROFESSOR,184955,"JOSE LOPES SILVA, 1100 - JARDIM EROISI - 13610530"
128461,NOSSA SENHORA DE LORETO,184975,"RUA E 44, SN - ZONA E  AFA - 13643105"
73222,YOLANDA SALLES CABIANCA PROFESSORA,184931,"ALLAN KARDEC, 143 - VILA DONA ROSA ZURITA - 13601361"
73223,FRANCISCO GRAZIANO,184932,"RUA  DAS PALMEIRAS, 35 - JARDIM NOVAS ARARAS - 13601295"
75541,JOSE PEDRO DE MORAES,184948,"RUA JOSE DOS CAMPOS, 98 - ESTRADA MUNICIPAL CAJU - 13617577"
73220,JOSE OMETTO,184929,"LARGO DA IGREJA, 15 - USINA SAO JOAO - 13600970"
127480,HENRIQUE FERREIRA DOS REIS PROFESSOR,184968,"BRASIL, 1124 - VILA ESPERANCA - 13635104"
73341,MANOEL JACINTHO VIEIRA DE MORAES DOUTOR,184942,"PRACA CAPITAO NELSON SALES DE ABREU, 2077 - CENTRO - 13631030"
73344,LAURO BARREIRA,184944,"RUA PRUDENTE DE MORAES, 318 - CENTRO - 13650000"
137166,CARLOTA FERNANDES DE SOUZA RODINI,184976,"LORETO, 1299 - JARDIM CAMPESTRE - 13607179"
123675,THEREZINHA RODRIGUES PROFESSORA,184958,"JOSE PERES, 876 - JARDIM MORUMBI - 13631656"
123510,OSCAR ALVES JANEIRO PROFESSOR,184956,"ARLINDO CRESSONI, 200 - RESIDENCIAL BOSQUE DE VERSALLES - 13609370"
116470,CEL JTO A EE NEWTON PRADO,184952,"JOSE MANOEL DE A OLIVEIRA, 95 - VILA BELA VISTA - 13611420"
126324,PAULO DE BARROS FERRAZ PROFESSOR,184966,"PANAMA, 1082 - VILA ESPERANCA - 13635097"
137212,MARIA ROSA NUCCI PACIFICO HOMEM PROFESSORA,184977,"MARCOS FREIRE, SN - PARQUE DAS ARVORES - 13604188"
127445,MARIA DE LOURDES NASCIMENTO GUERREIRO PROFESSORA,184967,"RUA ANTONIO SILVA, 100 - ETTORE MARQUEZELLI - 13650000"
127537,PEDRO CELESTINO TONOLLI PROFESSOR,184969,"ARAPONGAS, SN - JARDIM SAO JOAQUIM - 13615600"
125953,LUIZ NARCISO GOMES DOUTOR,184962,"RUA DOUTOR JORGE TIBIRICA, 1014 - CENTRO - 13625000"
127850,CESARIO COIMBRA DOUTOR,184970,"RUA DOUTOR ARMANDO SALLES DE OLIVEIRA, 311 - CENTRO - 13600730"
125935,CESAR LACERDA DE VERGUEIRO SENADOR,184961,"AVENIDA PADRE ATILIO, 748 - JARDIM BELVEDERE - 13601100"
109577,CEL JTO A EE MANOEL JACINTHO VIEIRA DE MORAES DOUTOR,184951,"PRACA CAP NELSON SALLES DE ABREU, 2077 - CENTRO - 13631030"
128457,JUSTINIANO WHITAKER DE OLIVEIRA CORONEL,184974,"RUA CORONEL ANDRE ULSON JUNIOR, 32 - CENTRO - 13600060"
73221,VICENTE FERREIRA DOS SANTOS PROFESSOR,184930,"RUA PADRE SANTO MARINO, 157 - JARDIM CANDIDA - 13603009"
73329,PEDRINA PIRES ZADRA PROFESSORA,184937,"AVENIDA FRANCISCO PERIPATO, SN - VILA SIBYLLA - 13664062"
125954,WALDEMAR FERREIRA PROFESSOR,184963,"PROSPERO GRISI, 367 - VILA SAO JOAO - 13614060"
123709,IGNEZ GIARETTA SGUERRA PROFESSORA,184960,"RUA DAS CAMELIAS, SN - JARDIM NOVA SANTA RITA - 13670000"
137327,ALTIMIRA PINKE PROFESSORA,184979,"ANGELO CONSENTINO, 1400 - JARDIM SANTA RITA - 13611334"
77407,PREFEITO ORLANDO LEME FRANCO,184949,"RUA ERMELINDO NERI, 360 - JARDIM ARIANA - 13617555"
137246,RENE ALBERS PROFESSOR DOUTOR,184978,"RUA SANTA EFIGENIA, 298 - VILA SANTA FE - 13640433"
126295,MAXIMILIANO BARUTO DOUTOR,184965,"ELETRICISTA, 750 - JARDIM JOSE OMETTO I - 13606317"
125955,MARIA JOAQUINA DE ARRUDA PROFESSORA,184964,"29 DE AGOSTO, 877 - CENTRO - 13610210"
73327,CARLOS GUIMARAES DOUTOR,184935,"RUA SANTA CRUZ, 206 - CENTRO - 13650000"
109576,CEL JTO A EE CESARIO COIMBRA DR,184950,"ARMANDO SALLES DE OLIVEIRA DOUTOR, 311 - CENTRO - 13600730"
128093,ANTONIO LUIZ DE MORAES PROFESSOR,184973,"ORLANDO LEME FRANCO, SN - TAQUARI PONTE - 13615686"
73225,LIONS CLUBE,184934,"PRACA JOSE FELIX NUNES, SN - JARDIM FATIMA - 13607035"
123681,MARIO AVESANI PREFEITO,184959,"RUA MANOEL PIRES DE CAMPOS, 139 - VILA SANTA TEREZINHA - 13650000"
73342,ELOI CHAVES,184943,"AVENIDA ROSA SENHORINI ZERO, 100 - CACHOEIRA DE EMAS - 13641002"
127956,CUSTODIO ANGELO DE LIMA DOUTOR,184972,"FERNAO DIAS PAES LEME, 945 - JARDIM SANTA RITA - 13611340"
73328,JOSE JORGE NETO PROFESSOR,184936,"AVENIDA DOIS, 315 - CENTRO - 13550000"
73340,FRANCO CORONEL,184941,"RUA CORONEL FRANCO, 937 - CENTRO - 13630136"
123181,JUDITH FERRAO LEGASPE PROFESSORA,184954,"NACERE COSME, SN - JARDIM JOSE OMETTO II - 13606410"
73346,DJALMA FORJAZ DOUTOR,184946,"RUA NELSON PEREIRA LOPES, 557 - PORTO FERREIRA - 13660102"
71201,CENTRO DE EDUCACAO DE JOVENS E ADULTOS DE PIRASSUNUNGA,184928,"JOSE BONIFACIO, 325 - CENTRO - 13630010"
73576,NELSON FERNANDES,184947,"PRACA ZEQUINHA DE ABREU, 624 - CENTRO - 13670000"
73338,PIRASSUNUNGA,184940,"JOSE BONIFACIO, 325 - CENTRO - 13630010"
123670,AUGUSTO DE SOUZA SARDINHA,184957,"RUA DOS MARIANOS, 63 - TAQUARI - 13615762"
123180,VICENTE CASALE PADOVANI PROFESSOR,184953,"LUIZ STEFANI, 150 - VILA DONA ROSA ZURITA - 13601351"
73331,QUEIROZ FILHO PROFESSOR,184939,"RUA  MANOEL ABADE, 730 - CENTRO - 13610020"
137355,JOANITA KAMMER MARTINS PEREIRA PROFESSORA,184980,"VIVIANE CRISTINA HEPFNER, SN - JARDIM JOSE OMETTO II - 13606423"
73224,IGNACIO ZURITA JUNIOR,184933,"PRACA BARAO DE ARARAS, 140 - CENTRO - 13600040"
127923,OSMARINA SEDEH PADILHA PROFESSORA,184971,"PERNAMBUCO, 3711 - VILA BRASIL - 13632375"
73345,NEWTON PRADO,184945,"JOSE MANOEL DE A OLIVEIRA, 95 - VILA BELA VISTA - 13611420"
126098,MARIA JOSE BARBOSA CASTRO TOLEDO PROFESSORA,185022,"RUA MACHADO DE ASSIS, 1258 - VILA MARQUES - 19200000"
74211,FILOMENA SCATENA CHRISTOFANO,184986,"RUA DAS AMERICAS, 517 - CENTRO - 19180000"
76149,CLOTILDE VEIGA DE BARROS PROFESSORA,185008,"ALBERTO ARTONI, 225 - JARDIM SANTANA - 19045720"
128303,CEEJA JOSE LIBANIO FILHO PROFESSOR,185024,"CLAUDIONOR SANDOVAL, 875 - VILA ROSA - 19023200"
75530,JOEL ANTONIO DE LIMA GENESIO PROFESSOR,185003,"ARTUR JORGE GUAZZI, 50 - JARDIM SAO GABRIEL - 19065660"
125273,CEL JTO A EE MONSENHOR SARRION,185016,"MARCONDES FILHO, 93 - VILA ROBERTO - 19013160"
74226,SARRION MONSENHOR,185016,"MARCONDES FILHO, 93 - VILA ROBERTO - 19013160"
74210,CELESTINA DE CAMPOS TOLEDO TEIXEIRA PROFESSORA,184985,"RUA SEBASTIAO RODRIGUES DE SOUZA, 573 - FLORESTA DO SUL - 19120000"
109132,GLAUCIO REINALDO MENDES PEREIRA ASP C RESSOCIALIZACAO,185010,"ESTRADA VICINAL RAIMUNDO MAIOLINI, SN - MONTALVAO - 19020970"
128495,MARIA LUIZA FORMOZINHO RIBEIRO PROFESSORA,185026,"BELLA, 815 - VILA CLAUDIA GLORIA - 19015261"
74200,JOAO ALFREDO DA SILVA,184984,"RUA NOROESTE, 189 - ENEIDA - 19130000"
74199,MARIA LUIZA BASTOS PROFESSORA,184983,"JOSE BONGIOVANI, 1050 - VILA LIBERDADE - 19050680"
74275,CLEOFANO MOTA,184998,"RUA MANOEL HIPOLITO, 240 - CENTRO - 19590000"
74220,JOSE FOZ DOUTOR,184990,"JOSE RAINHO TEIXEIRA, 72 - VILA MARCONDES - 19030200"
74219,ANIBAL VITOR FAVA,184989,"AVENIDA BARAO DO RIO BRANCO, 981 - CENTRO - 19190000"
128500,IVO LIBONI PROFESSOR,185028,"AVENIDA JOSE BONIFACIO, 1 - JARDIM TENIS CLUBE - 19570000"
74217,TANNEL ABBUD COMENDADOR,184988,"QUINTINO BOCAIUVA, 1455 - VILA MARCONDES - 19030000"
74216,ANGELICA DE OLIVEIRA PROFESSORA,184987,"RUA VICENTE DIAS GARCIA, 157 - CENTRO - 19160000"
128499,JOAO BATISTA BERBET,185027,"RUA FRANCISCO PERCINOTO, 41 - TECAINDA - 19505000"
123174,FATIMA APARECIDA COSTA FALCON PROFESSORA,185014,"ALTAIR DE SENNA, 800 - PARQUE CEDRAL - 19067350"
134162,PENITENCIARIA WELLINGTON RODRIGO SEGURA,185030,"ESTRADA VICINAL RAIMUNDO MAIOLINI, SN - MONTALVAO - 19034000"
124517,ANNA DE MELLO CASTRIANI PROFESSORA,185015,"RUA JOSE DA SILVA FORTUNATO, 221 - JARDIM REGINA - 19570000"
74224,FLORIVALDO LEAL,184991,"PIRACICABA, 90 - VILA TABAJARA - 19014150"
128529,PLACIDIO BRAGA NOGUEIRA PROFESSOR,185029,"ABILIO NASCIMENTO, 1333 - JARDIM SANTA MARTA - 19042000"
126097,GILDASIO SILVA LIMA PROFESSOR,185021,"HENRIQUE PEDRO FERREIRA, 450 - CENTRO - 19530000"
74268,OLGA YASUKO YAMASHITA PROFESSORA,184997,"RUA EUCLIDES DA CUNHA, 851 - CENTRO - 19200000"
74229,ANTONIO FIORAVANTE DE MENEZES,184994,"RUA FERNANDO BACCO, 270 - VILA MARINA - 19040080"
74261,JOAO GOMES MARTINS CORONEL,184996,"PADRE JOAO SCHNEIDER, 980 - CENTRO - 19500000"
137384,FRANCISCO PESSOA,185031,"SANTINA DE SOUZA OLIVETTE, 160 - CONJUNTO HABITACIONAL ANA JACINTA - 19064290"
75700,MIRELLA PESCE DESIDERE PROFESSORA,185004,"VINTE E UM DE SETEMBRO, 142 - NUCLEO BARTHOLOMEU BUENO DE MIRANDA - 19066270"
116520,ORACY MATRICARDI PROF,185013,"SANTINA DE SOUZA OLIVETTE, 160  B - CONJUNTO HABITACIONAL ANA JACINTA - 19064290"
108979,PENITENCIARIA TACYAN MENEZES DE LUCENA,185009,"RODOVIA HOMERO SEVERO LINS, 542 - RURAL - 19500000"
76097,MARIA ERNESTINA NATIVIDADE ANTUNES PROFESSORA,185006,"RUA DOUTOR JOAO MUNHOZ, 1184 - VILA GARCES - 19560000"
74228,MARREY JUNIOR DOUTOR,184993,"RUA CORONEL ALBINO, 1637 - PARQUE SAO JUDAS TADEU - 19023350"
