131835,CAMPO DE PESQUISAS,165979,"AGUA PRETA, SN -  - 12400000"
97459,BAIRRO DA FIGUEIRA,165980,"FIGUEIRA, SN -  - 12400000"
97463,BAIRRO DO RIBEIRAO GRANDE,165981,"ESTRLUIZA FERNANDES DE MIRANDA, SN - RIBEIRAO GRANDE - 12401140"
131837,FEITORIA AGUADA,165982,"FEITORIA AGUADA, SN -  - 12400000"
97464,BAIRRO DO BREJAO,161189,"BREJAO, SN -  - 12400000"
97465,FAZENDA SAPUCAIA,165983,"FAZ SAPUCAIA, SN -  - 12400000"
97466,FAZENDA TETEQUERA,165984,"FAZENDA TETEQUERA, SN -  - 12400000"
97467,BAIRRO CAPELA DOS CORREAS,165985,"BAIRRO CAPELA DOS CORREAS, SN -  - 12400000"
97468,BAIRRO DO LAGEADO,165986,"ESTMUNICIPAL STP 218 LAGEAD0, SN - CENTRO - 12450000"
97469,BAIRRO DO RIO PRETO DE BAIXO,165987,"ESTMUNICIPAL SP 42 RIO PRETO, SN - CENTRO - 12450000"
97470,BAIRRO DO RIO PRETO DE BAIXOSEGUNDA,165988,"RIO PRETO DE BAIXO, SN - CENTRO - 12450000"
97471,BAIRRO DO MACHADINHO,165989,"BAIRRO DO MACHADINHO, SN - CENTRO - 12450000"
97472,BAIRRO DO RIO PRETO DE CIMA,165990,"BAIRRO DO RIO PRETO DE CIMA, SN - CENTRO - 12450000"
97473,COLONIA RENOPOLIS,165991,"COLONIA RENOPOLIS, SN - CENTRO - 12450000"
97474,MARIA JULIA DA SILVA,165992,"BAIRRO DO TOLDI, SN - CENTRO - 12490000"
131839,BAIRRO DA BOA VISTA,165993,"BAIRRO DA BOA VISTA, SN - CENTRO - 12450000"
97475,BAIRRO FAZENDA DO PINHAL,165994,"BAIRRO FAZENDA DO PINHAL, SN - CENTRO - 12450000"
97476,BAIRRO DO PINHALZINHO,165995,"BAIRRO DO PINHALZINHO, SN - CENTRO - 12450000"
97477,BAIRRO DA FAZENDINHA,165996,"BAIRRO DA FAZENDINHA, SN - CENTRO - 12450000"
97478,BAIRRO DO SERTAOZINHO,165997,"BAIRRO DO SERTAOZINHO, SN - CENTRO - 12450000"
97479,BAIRRO DO BARREIRINHO DO RIO PRETO,165998,"BBARREIRINHO DO RIO PRETO, SN - CENTRO - 12450000"
97480,BAIRRO DO SERTAOZINHO,165999,"BAIRRO DO SERTAOZINHO, SN - CENTRO - 12450000"
97481,COLONIA RENOPOLIS,166000,"COL RENOPOLIS, SN - CENTRO - 12450000"
97484,BAIRRO DO MONJOLINHO,166001,"BAIRRO DO MONJOLINHO, SN - CENTRO - 12490000"
131841,BAIRRO DO PINHEIRO,166002,"BAIRRO DO PINHEIRO, SN - CENTRO - 12490000"
97485,AGRO PASTORAL VILA MARIA,166003,"BAIRRO DOS SERRANOS, SN - CENTRO - 12490000"
97486,BAIRRO DOS SERRANOS,166003,"BAIRRO DOS SERRANOS, SN - CENTRO - 12490000"
97487,BAIRRO DO CANTAGALO,166004,"BAIRRO DO CANTAGALO, SN - CENTRO - 12490000"
97488,BAIRRO DOS SERRANOS DE CIMA,166005,"BAIRRO DOS SERRANOS DE CIMA, SN - CENTRO - 12490000"
97489,BAIRRO DO SITIO,166006,"BAIRRO DO SITIO, SN - CENTRO - 12490000"
131842,BAIRRO DO TORTO,166007,"BAIRRO DO TORTO, SN - CENTRO - 12490000"
131843,BAIRRO DO CANTAGALO,166008,"CANTAGALO, SN - CENTRO - 12490000"
97491,BAIRRO DOS SERRANOS,166009,"SERRANOS, SN - CENTRO - 12490000"
97492,BAIRRO DO QUILOMBO,166010,"BAIRRO DO QUILOMBO, SN - CENTRO - 12490000"
97493,BAIRRO DAS AREAS,166011,"AREAS, SN - CENTRO - 12490000"
97494,BAIRRO DO BAU VELHO,166012,"BAIRRO DO BAU VELHO, SN - CENTRO - 12490000"
97495,BAIRRO DO BAU DO CENTRO,166013,"BAU DO CENTRO, SN - CENTRO - 12490000"
97496,BAIRRO DO SITIO JOAQUIM EUGENIO,166014,"BAIRRO BAU DE CIMA, SN - CENTRO - 12490000"
97497,BAIRRO DO SITIO JOAQUIM EUGENIO,166015,"S J EUGENIO, SN - CENTRO - 12490000"
97498,BAIRRO DA BOCAINA,166016,"BAIRRO DA BOCAINA, SN - CENTRO - 12490000"
97499,BAIRRO DAS AREAS,166017,"BAIRRO DAS AREAS, SN - CENTRO - 12490000"
97500,BAIRRO DO BAU DO CENTRO,166018,"BAIRRO DO BAU DO CENTRO, SN - CENTRO - 12490000"
97501,BAIRRO DOS FAUSTINOS,166019,"BAIRRO DOS FAUSTINOS, SN - JARDIM SAO GABRIEL - 12340000"
97502,BAIRRO MONTE ALEGRE,166020,"BAIRRO MONTE ALEGRE, SN - CENTRO - 12350000"
72826,BAIRRO CRUZ BRANCA,166021,"CRUZ BRANCA, SN - JARDIM SAO GABRIEL - 12340000"
97503,BAIRRO DO BOM SUCESSO,166022,"BAIRRO DO BOM SUCESSO, SN - CENTRO - 12350000"
97504,BAIRRO BOA VISTA,166023,"BOA VISTA, SN - JARDIM SAO GABRIEL - 12340000"
97505,BAIRRO DA AGUA BRANCA,166024,"BAIRRO DA AGUA BRANCA, SN - JARDIM SAO GABRIEL - 12340000"
72915,BAIRRO DO SOBRADO,166025,"BAIRRO DO SOBRADO, SN -  - 12200000"
97506,BAIRRO ALTO,166026,"BAIRRO ALTO, SN - JARDIM SAO GABRIEL - 12340000"
97507,BAIRRO SANTA LUZIA,166027,"ESTRADA MUNICIPAL SANTA LUZIA, SN - BAIRRO SANTA LUZIA - 12200000"
97508,BAIRRO DOS MACHADOS,166028,"BAIRRO DOS MACHADOS, SN - JARDIM SAO GABRIEL - 12340000"
97509,BAIRRO BOA VISTA,166023,"BOA VISTA, SN - JARDIM SAO GABRIEL - 12340000"
75766,BAIRRO DA HARMONIA,166029,"BAIRRO DA HARMONIA, SN - CENTRO - 12350000"
97510,FAZENDA TECELAGEM PARAHYBA,166030,"BAIRRO JEQUITIBA, SN - CENTRO - 12350000"
97512,BAIRRO DO REMEDIO,166031,"BAIRRO DO REMEDIO, SN -  - 12300000"
97514,ROTARY CLUB,166032,"VERANEIO IJAL, SN -  - 12300000"
97517,BAIRRO DE SAO SEBASTIAO,166033,"SAO SEBASTIAO, SN -  - 12300000"
97518,ROTARY CLUB,166032,"VERANEIO IJAL, SN -  - 12300000"
97520,FAZENDA PARATEI DO MEIO,166034,"PARATEI MEIO, SN -  - 12300000"
97522,BAIRRO DO SANTANA,166035,"SANTANA, SN -  - 12300000"
131848,BAIRRO DO SANTANA,166035,"SANTANA, SN -  - 12300000"
97526,FAZENDA HARMONIA,166036,"FAZENDA HARMONIA, SN -  - 12300000"
97527,BAIRRO DO JARDIM,166037,"BAIRRO DO JARDIM, SN -  - 12300000"
131850,BAIRRO DO JARDIM,166037,"BAIRRO DO JARDIM, SN -  - 12300000"
97532,ESTACAO DO SENHOR BOM JESUS,166038,"MUNICIPAL BOM JESUS, SN - BANDEIRA BRANCA - 12323710"
97533,BAIRRO DOS REMEDIOS,166039,"BAIRRO DOS REMEDIOS, SN -  - 12300000"
97536,ESTACAO DO SENHOR BOM JESUS,166040,"BAIRRO DO BOM JESUS, SN -  - 12300000"
97539,BAIRRO DO RIO ABAIXO,166041,"RIO ABAIXO, SN -  - 12300000"
97540,BAIRRO DO RIO ABAIXO,166041,"RIO ABAIXO, SN -  - 12300000"
97541,BAIRRO DO LAMBARI DE BAIXO,166042,"LAMBARI BAIXO, SN -  - 12300000"
97542,ROTARY CLUB,166032,"VERANEIO IJAL, SN -  - 12300000"
97543,BAIRRO DO PARATEI DE BAIXO,166043,"PARATEI BAIXO, SN -  - 12300000"
97544,BAIRRO DO POCO,166044,"BAIRRO DO POCO, SN -  - 12300000"
97545,BAIRRO DO RIO ABAIXO,166041,"RIO ABAIXO, SN -  - 12300000"
97546,BAIRRO CAPIVARI,166045,"CAPIVARI, SN -  - 12290000"
97547,BAIRRO SANTA CLARA,166046,"BAIRRO SANTA CLARA, SN -  - 12290000"
97548,PEDREIRA SANTO ANTONIO DE PADUA,166047,"TAPANHAO, SN -  - 12290000"
97549,FAZENDA SANTA CRUZ,166048,"FAZENDA SANTA CRUZ, SN -  - 12290000"
97550,BAIRRO DOS TEIXEIRAS,165956,"BAIRRO DOS TEIXEIRAS, SN - CENTRO - 12250000"
97551,BAIRRO DOS FRANCOS,166049,"BAIRRO DOS FRANCOS, SN -  - 12290000"
97552,BAIRRO DAS COLETAS,166050,"BAIRRO DAS COLETAS, SN -  - 12290000"
97553,FAZENDA VELHA,166051,"BAIRRO CAPIVARI, SN -  - 12290000"
97554,BAIRRO DO PIRAI,166052,"BAIRRO DO PIRAI, SN -  - 12290000"
131854,FAZENDA SAO JOAO,166053,"BAIRRO DO VARADOURO, SN -  - 12290000"
97555,ESTRADA DO VARADOURO,166053,"BAIRRO DO VARADOURO, SN -  - 12290000"
131855,BAIRRO DO LAGEADO,166054,"BAIRRO DO LAGEADO, SN - CENTRO - 12260000"
97557,BAIRRO DO TAQUARI,165948,"BAIRRO DO TAQUARI, SN - CENTRO - 12250000"
97559,BAIRRO ENSEADA DAS CANOAS,166055,"BENSEADA DAS CANOAS, SN -  - 12290000"
97560,BAIRRO CAPIVARI,166045,"CAPIVARI, SN -  - 12290000"
131856,BAIRRO TAPANHAO,166056,"BAIRRO DO TAPANHAO, SN -  - 12290000"
97561,PEDREIRA SANTO ANTONIO DE PADUA,166057,"DO TAPANHAO, SN -  - 12290000"
97562,BAIRRO DO CEDRO,166058,"BAIRRO DO CEDRO, SN - CENTRO - 12260000"
97563,BAIRRO DA VARGEM GRANDE,166059,"VARGEM GRANDE, SN - CENTRO - 12260000"
97564,BAIRRO SAO BENEDITO,166060,"SAO BENEDITO, SN - CENTRO - 12260000"
131857,BAIRRO CAPIM DANGOLA DE CIMA,166061,"CAPIM DANGOLA DE CIMA, SN - CENTRO - 12260000"
97565,BAIRRO GIBRALTAR,166062,"BAIRRO GIBRALTAR, SN - CENTRO - 12260000"
97566,BAIRRO DO ALEGRE,166063,"BAIRRO DO ALEGRE, SN - CENTRO - 12260000"
97567,BAIRRO DO CEDRO,166064,"CEDRO, SN - CENTRO - 12260000"
97568,BAIRRO ALTO DA SERRA,166065,"BAIRRO ALTO DA SERRA, SN - CENTRO - 12260000"
97569,BAIRRO DO ALEGRE,166066,"ALEGRE, SN - CENTRO - 12260000"
131858,BAIRRO DOS PIMENTAS,166067,"BAIRRO DOS PIMENTAS, SN - CENTRO - 12260000"
97570,BAIRRO DAS CANOAS,166068,"BAIRRO DAS CANOAS, SN - CENTRO - 12260000"
97571,BAIRRO DAS PITAS,166069,"BAIRRO DAS PITAS, SN - CENTRO - 12260000"
97572,FAZENDA RIO PARDO,166070,"FAZENDA RIO PARDO, SN - RIO PARDO - 12260000"
97573,BAIRRO DO ITAPEVA,166071,"BAIRRO DO ITAPEVA, SN - ITAPEVA - 12260000"
97574,BAIRRO DO ITAPEVA,166072,"ITAPEVA, SN - CENTRO - 12260000"
131859,BAIRRO DO SALTO,166073,"BAIRRO DO SALTO, SN - CENTRO - 12260000"
97575,BAIRRO ALFERES BENTO,166074,"ALFERES BENTO, SN - CENTRO - 12260000"
97576,BAIRRO RIBEIRAO BRANCO,166075,"BAIRRO RIBEIRAO BRANCO, SN - RIBEIRAO BRANCO - 12260000"
97577,BAIRRO DO ILHEUS,166076,"BAIRRO DO ILHEUS, SN - ILHEUS - 12260000"
131860,BAIRRO PINHAL DO LAGEADO,166077,"BAIRRO PINHAL DO LAGEADO, SN - PINHAL DO LAGEADO - 12260000"
97578,BAIRRO DA BRAGANCA,166078,"BAIRRO DA BRAGANCA, SN - CENTRO - 12260000"
97579,BAIRRO CAMPO REDONDO,166079,"BAIRRO CAMPO REDONDO, SN - CENTRO - 12260000"
97580,BAIRRO DO ITAPEVA,166072,"ITAPEVA, SN - CENTRO - 12260000"
97581,BAIRRO DO SALTO,166073,"BAIRRO DO SALTO, SN - CENTRO - 12260000"
97582,BAIRRO DO COMERCIO,166080,"COMERCIO, SN - CENTRO - 12260000"
97583,FAZENDA RIO CLARO,166081,"RIO CLARO, SN - CENTRO - 12260000"
131861,BAIRRO SAO GERALDO,166082,"SAO GERALDO, SN - CENTRO - 12260000"
97584,ESPIRITO SANTO 1,166083,"ESPIRITO SANTO, SN - CENTRO - 12260000"
97585,BAIRRO DO TELES,166084,"TELES, SN - CENTRO - 12260000"
97586,BAIRRO DA FARTURA,166085,"BAIRRO DA FARTURA, SN - CENTRO - 12260000"
97587,BAIRRO ESPIRITO SANTO,166083,"ESPIRITO SANTO, SN - CENTRO - 12260000"
131862,BAIRRO MORRO AZUL,166086,"BAIRRO MORRO AZUL, SN - MORRO AZUL - 12260000"
97588,BAIRRO CAPITAO MANECO,166087,"BAIRRO CAPITAO MANECO, SN - CENTRO - 12260000"
97589,BAIRRO DO LAGEADO,166088,"LAGEADO, SN - CENTRO - 12260000"
97590,BAIRRO DO TELES,166089,"BAIRRO DO TELES, SN - CENTRO - 12260000"
131863,BAIRRO DOS BARRETOS,166090,"BAIRRO DOS BARRETOS, SN - CENTRO - 12380000"
97592,FAZENDA JACARE,166091,"FAZENDA JACARE, SN - CENTRO - 12380000"
97593,FAZENDA BARRA BONITA,166092,"FAZENDA BARRA BONITA, SN - CENTRO - 12380000"
97594,FAZENDA BELA VISTA,166093,"FAZENDA BELA VISTA, SN - CENTRO - 12380000"
131864,FAZENDA SANTA ROSA,166094,"FAZENDA SANTA ROSA, SN - CENTRO - 12380000"
97595,FAZENDA BOA VISTA,166095,"FAZENDA BOA VISTA, SN - CENTRO - 12380000"
97596,BAIRRO DO VALE DA ALEGRIA,166096,"BAIRRO VALE DA ALEGRIA, SN - CENTRO - 12380000"
97597,BAIRRO DA ANGOLA DE CIMA,166097,"BAIRRO DA ANGOLA DE CIMA, SN - CENTRO - 12380000"
97598,BAIRRO DOS BARRETOS,166098,"BARRETOS, SN - CENTRO - 12380000"
131865,FAZENDA BARRA BONITA 112,166099,"FAZ BARRA BONITA, SN - CENTRO - 12380000"
97599,BAIRRO DOS MONOS,166100,"MONOS, SN - CENTRO - 12380000"
97600,FAZENDA LUIZ PORTO,166101,"BAIRRO SERROTE, SN - CENTRO - 12380000"
97601,BAIRRO DOS OURIVES,166102,"OURIVES, SN - CENTRO - 12380000"
97602,FAZENDA LUIZ PORTO,166103,"FAZ LUIZ PORTO, SN - CENTRO - 12380000"
97603,FAZENDA GOMEATINGA,166104,"FAZENDA GOMEATINGA, SN - CENTRO - 12380000"
131866,FAZENDA BOA VISTA 109 1,166095,"FAZENDA BOA VISTA, SN - CENTRO - 12380000"
97604,BAIRRO DA VARGEM GRANDE,166105,"VARGEM GRANDE, SN - CENTRO - 12380000"
97605,BAIRRO DO BOM JESUS DO SERROTE,166106,"BAIRRO DO BOM JESUS DO SERROTE, SN - CENTRO - 12380000"
97606,BAIRRO DOS FONSECAS,166107,"FONSECAS, SN - CENTRO - 12380000"
97608,BAIRRO DO COSTINHA,166108,"BAIRRO DO COSTINHA, SN -  - 12200000"
97611,BAIRRO MATO DENTRO,164316,"MATO DENTRO, SN -  - 12200000"
97612,BAIRRINHO 3,166109,"BAIRRINHO, SN -  - 12200000"
97613,BAIRRINHO 2,166109,"BAIRRINHO, SN -  - 12200000"
131868,BAIRRO SAO GUIDO,166110,"BAIRRO SAO GUIDO, SN - CENTRO - 12260000"
97614,BAIRRO DO GUIRRA,166111,"BAIRRO DO GUIRRA, SN -  - 12200000"
97615,BAIRRO RIO DAS COBRAS,166112,"ESTRADA SANTO AGOSTINHO, SN - RIO DAS COBRAS - 12200000"
97617,ANTONIO GERMANO DOS SANTOS,166113,"FREITAS, SN -  - 12200000"
97618,BAIRRO DO CAFUNDO,166114,"CAFUNDO, SN -  - 12200000"
131869,BAIRRO DO COSTINHA,166108,"BAIRRO DO COSTINHA, SN -  - 12200000"
97619,BAIRRO DOS REMEDIOS,166115,"BAIRRO DOS REMEDIOS, SN -  - 12200000"
97620,BAIRRO DO RONCADOR,166116,"BAIRRO DO RONCADOR, SN -  - 12200000"
97621,BAIRRO DO RIO MANSO,166117,"BAIRRO DO RIO MANSO, SN -  - 12200000"
97622,BAIRRINHO 1,166109,"BAIRRINHO, SN -  - 12200000"
97623,BAIRRO DOS FREITAS,166113,"FREITAS, SN -  - 12200000"
97624,BAIRRO DAS PERNAMBUCANAS,166118,"R HONDURAS, 197 - CAPUAVA - 12225000"
131871,BAIRRO DAS PERNAMBUCANAS DE CIMA,166119,"PERNAMBUCANAS DE CIMA, SN -  - 12200000"
97626,CLPROV1 JTO A JOSE FORTUNATO DA SILVA RAMOS CONEGO,166120,"BAIRRO TORRAO DE OURO, SN -  - 12200000"
97629,BAIRRO SANTA BARBARA,166121,"BAIRRO STA BARBARA, SN -  - 12200000"
97630,BAIRRO SANTA BARBARA,166122,"SANTA BARBARA, SN -  - 12200000"
97631,FAZENDA DO POCO,166123,"FAZENDA DO POCO, SN -  - 12200000"
97632,ESTACAO DO JAGUARI,166124,"JAGUARI, SN -  - 12200000"
97633,ESTACAO DO JAGUARI,166124,"JAGUARI, SN -  - 12200000"
97634,BAIRRO SANTA BARBARA DE CIMA,166122,"SANTA BARBARA, SN -  - 12200000"
97635,BAIRRO DA VARGEM GRANDE,166125,"FAZENDA MONTE ALEGRE, SN -  - 12200000"
97636,BAIRRO SANTA CRUZ,166126,"SANTA CRUZ, SN -  - 12200000"
97637,FAZENDA SANTA RITA,166127,"FAZENDA SANTA RITA, SN -  - 12213000"
97638,BAIRRO DA VARGEM GRANDE,166125,"FAZENDA MONTE ALEGRE, SN -  - 12200000"
97639,BAIRRO SANTA CRUZ,166128,"SANTA CRUZ, SN -  - 12200000"
97640,FAZENDA CURA DARS,166129,"BAIRRO DO JAGUARI, SN -  - 12200000"
97641,FAZENDA CURA DARS,166129,"BAIRRO DO JAGUARI, SN -  - 12200000"
97642,FAZENDA JATAI,166130,"DO JATAI, SN -  - 12200000"
131874,FAZENDA JATAI,166131,"FAZENDA JATAI, SN -  - 12200000"
97644,FAZENDA NOSSA SENHORA DE FATIMA,166129,"BAIRRO DO JAGUARI, SN -  - 12200000"
97646,BAIRRO DO CAJURU,164354,"CAJURU, SN -  - 12200000"
97647,BAIRRO DO CAJURU,164354,"CAJURU, SN -  - 12200000"
97648,FAZENDA SANTA CATARINA,166132,"SANTA CATARINA, SN -  - 12200000"
97649,BAIRRO DO MATO DENTRO,164316,"MATO DENTRO, SN -  - 12200000"
131876,FAZENDA ALVORADA,166133,"ESTRADA MUNICIPAL  JOEL DE PAULA, 5000 - CAPAO GROSSO - 12200000"
97651,BAIRRO SANTO AGOSTINHO DE CIMA,166134,"BAIRRO STO AGOSTINHO DE CIMA, SN -  - 12200000"
97652,FAZENDA TEODORO,166135,"FAZENDA TEODORO, SN - FAZENDA TEODORO - 12140000"
97653,BAIRRO BOM SUCESSO,166136,"ESTRADA DO BOM SUCESSO, SN - BOM SUCESSO - 12211843"
97654,BAIRRO BENGALAR,166137,"TRAVESSA SANTO IVO, 11 - BENGALAR - 12209000"
97655,BAIRRO SANTO AGOSTINHO,166138,"STO AGOSTINHO, SN -  - 12200000"
97656,BAIRRO SANTO AGOSTINHO DE CIMA,166139,"STO AGOSTINHO DE CIMA, SN -  - 12200000"
97657,FAZENDA SINIMBURA 1,166140,"FAZENDA SINIMBURA, SN -  - 12200000"
131877,FAZENDA SINIMBURA 3,166141,"SAO JOSE DOS CAMPOS, SN -  - 12200000"
97659,FAZENDA SINIMBURA 2,166141,"SAO JOSE DOS CAMPOS, SN -  - 12200000"
97661,BAIRRO SAO JOAO,166142,"BAIRRO SAO JOAO, SN -  - 12200000"
97662,FAZENDA MONTES CLAROS,166143,"FAZENDA MONTES CLAROS, SN -  - 12200000"
97665,ESTACAO MARTINS GUIMARAES,166144,"ESTRADA MARTINS GUIMARAES, SN - MARTINS GUIMARAES - 12200000"
97666,BAIRRO DA AGUA SOCA,166145,"BAIRRO DA AGUA SOCA, SN -  - 12200000"
97667,BAIRRO DO CANELAR,166146,"BAIRRO DO CANELAR, SN -  - 12200000"
97668,BAIRRO TURVO DE BAIXO,166147,"BAIRRO DO TURVO, SN -  - 12200000"
97669,BAIRRO DAS LAVRAS,166148,"BAIRRO DAS LAVRAS, SN -  - 12200000"
97674,FAZENDA GRAMADO,166149,"FAZENDA GRAMADO, SN -  - 12280000"
97675,FAZENDA BONFIM,166150,"FAZENDA BONFIM, SN -  - 12280000"
97677,FAZENDA OLHO DAGUA,166151,"FAZENDA OLHO DAGUA, SN -  - 12280000"
97679,BAIRRO DA MARAMBAIA,166152,"BAIRRO DA MARAMBAIA, SN -  - 12280000"
97680,BAIRRO DA TATAUVA,166153,"BAIRRO DA TATAUVA, SN -  - 12280000"
131881,BAIRRO DA BOA VISTA,166154,"BAIRRO DA BOA VISTA, SN -  - 12280000"
97681,BAIRRO DO PEDREGULHO,166155,"BAIRRO DO PEDREGULHO, SN -  - 12280000"
97682,BAIRRO DA PEDRA BRANCA 34,166156,"PEDRA BRANCA, SN -  - 12280000"
97683,BAIRRO DA MAFERSA,166157,"BAIRRO DA MAFERSA, SN -  - 12280000"
97684,BAIRRO CACAPAVA VELHA 3,166158,"CACAPAVA VELHA, SN -  - 12280000"
97685,BAIRRO CACAPAVA VELHA 4,166158,"CACAPAVA VELHA, SN -  - 12280000"
97686,FAZENDA CAMPO GRANDE,166159,"FAZENDA CAMPO GRANDE, SN -  - 12280000"
131882,FAZENDA CAMPO GRANDE,166160,"SA E SILVA, SN -  - 12280000"
97687,BAIRRO COCAIS,166161,"COCAIS, SN - CENTRO - 19700000"
97688,BAIRRO DA GERMANA,166162,"ESTRADA MUNICIPAL JOSE DA SILVA MINEIRO, KM 9 - BAIRRO DA GERMANA - 12280000"
97689,BAIRRO DA GERMANA,166163,"GERMANA, SN -  - 12280000"
97690,BAIRRO CACAPAVA VELHA 1,166158,"CACAPAVA VELHA, SN -  - 12280000"
131883,BAIRRO DO SAPE,166164,"SAPE, SN -  - 12280000"
131884,BAIRRO DO TIJUCO PRETO,166165,"BAIRRO DO TIJUCO PRETO, SN -  - 12280000"
97692,BAIRRO DO SAPE,166164,"SAPE, SN -  - 12280000"
97693,FAZENDA MARMELADA,166166,"BAIRRO DA MARMELADA  FAZENDA MARMELADA, SN - MARMELADA - 12180000"
97694,BAIRRO DO POUSO ALTO,166167,"AVOCTACILIO FERNANDES DA SILVA, SN - CENTRO - 12180000"
131885,BAIRRO DOS SETE PINHEIROS,166168,"BAIRRO DOS REMEDIOS REMEDINHO, SN - REMEDIOS - 12180000"
97695,BAIRRO ALTO,166169,"BAIRRO ALTO, SN - CENTRO - 12180000"
97696,BAIRRO DO SERTAO,166170,"BAIRRO DO SERTAO  PROXIMO A VARGEM GRANDE, SN - SERTAO - 12180000"
97697,BAIRRO DO POUSO ALTO,166171,"BAIRRO DO POUSO ALTO, SN - CENTRO - 12180000"
97698,BAIRRO DO RIO MANSO,166172,"BAIRRO DO RIO MANSO, SN - CENTRO - 12180000"
97699,BAIRRO DO PALMITAL,166173,"BAIRRO DO PALMITAL, SN - CENTRO - 12170000"
131886,BAIRRO DA LAGOINHA,166174,"ESTRADA NATIVIDADE DA SERRA  BAIRRO DAS PALMEIRAS, SN - LAGOINHA - 12180000"
97700,BAIRRO DAS PALMEIRAS,166175,"BAIRRO DAS PALMEIRAS PROXIMO AO HOTEL FAZENDA, SN - PALMEIRAS - 12180000"
97701,BAIRRO MORRO DA PEDRA,166176,"BAIRRO MORRO DA PEDRA, SN - CENTRO - 12180000"
97702,BAIRRO DO SOBRADINHO,166177,"BAIRRO DO SOBRADINHO, SN - CENTRO - 12180000"
97703,BAIRRO DA CACHOEIRA GRANDE,166178,"BAIRRO DA CACHOEIRA GRANDE, SN - CENTRO - 12180000"
97704,BAIRRO DOS PINHEIROS,166179,"BAIRRO DOS PINHEIROS, SN - CENTRO - 12180000"
131887,BAIRRO DO PARAITINGA,166180,"ESTRADA NATIVIDADE DA SERRA  PONTE ALTA, SN - PARAITINGA - 12180000"
97705,BAIRRO DO LARANJAL,166181,"BAIRRO DO LARANJAL, SN - CENTRO - 12180000"
97706,BAIRRO DO SELADO,166182,"ESTRADA NATIVIDADE DA SERRA  BAIRRO DAS PALMEIRAS, SN - SELADO - 12180000"
97707,BAIRRO DO MARTIM,166183,"BAIRRO DO MARTIM  PROXIMO AO BAIRRO ALTO, SN - MARTIM - 12180000"
97708,BAIRRO DO RIBEIRAO,166184,"ESTRADA NATIVIDADE DA SERRA  BAIRRO ALTO, SN - RIBEIRAO - 12180000"
97709,BAIRRO DO COCHO,166185,"BAIRRO DO COCHO, SN - CENTRO - 12180000"
97710,BAIRRO DO RIO DA PRATA,166186,"BAIRRO DO RIO DA PRATA, SN - CENTRO - 12180000"
131888,BAIRRO RODRIGO SOARES,166187,"FAZENDA DO JOAO REZENDE, SN - RODRIGO SOARES - 12180000"
97711,BAIRRO DA PEDRA BRANCA,166154,"BAIRRO DA BOA VISTA, SN -  - 12280000"
97712,BAIRRO DA PARARACA,166188,"ESTRADA POUSO ALTO  BAIRRO ALTO, SN - PARARACA - 12180000"
97713,BAIRRO DOS DIAS,166189,"ESTRADA RODOVIA OSWALDO CRUZ  BAIRRO DAS PALMEIRAS, SN - DIAS - 12180000"
97714,BAIRRO DO POUSO FRIO,166190,"BAIRRO DO POUSO FRIO, SN - CENTRO - 12180000"
97715,FAZENDA TEODORO,166191,"FAZENDA TEODORO, SN - CENTRO - 12140000"
131889,BAIRRO DO SELADINHO,166192,"BAIRRO DO SELADINHO, SN - CENTRO - 12180000"
97716,BAIRRO DA CACHOEIRINHA,166193,"BAIRRO DA CACHOEIRINHA, SN - CENTRO - 12180000"
97717,BAIRRO ESTRELA DA PRATA,166194,"ESTRADA DA VARGEM GRANDE, SN - ESTRELA DA PRATA - 12180000"
97718,BAIRRO DO CARAPEBA,166195,"BAIRRO DO CARAPEBA, SN - CENTRO - 12170000"
97719,BAIRRO DO PINHEIRINHO,166196,"BAIRRO DO PINHEIRINHO, SN - CENTRO - 12170000"
131890,BAIRRO DA SAMAMBAIA,166197,"BAIRRO DA SAMAMBAIA, SN - CENTRO - 12170000"
97720,BAIRRO DA PEDRA GRANDE,166198,"BAIRRO DA PEDRA GRANDE, SN - CENTRO - 12170000"
97721,FAZENDA PONTE ALTA,166199,"FAZPONTE ALTA, SN - CENTRO - 12170000"
97723,BAIRRO DO PIRAI,166200,"BAIRRO DO PIRAI, SN - CENTRO - 12170000"
131891,BAIRRO DAS ROSEIRAS,166201,"BAIRRO DAS ROSEIRAS, SN - CENTRO - 12170000"
97725,BAIRRO DOS AFONSOS,166202,"BAIRRO DOS AFONSOS, SN - CENTRO - 12170000"
97726,BAIRRO DOS MARCAIS,166203,"BAIRRO DOS MARCAIS, SN - CENTRO - 12170000"
97727,BAIRRO DOS VELOSOS,166204,"BAIRRO DOS VELOSOS, SN - CENTRO - 12170000"
97728,BAIRRO DOS LEAIS,166205,"BAIRRO DOS LEAIS, SN - CENTRO - 12170000"
131892,BAIRRO DE CIMA,166206,"BAIRRO DE CIMA, SN - BAIRRO DE CIMA - 12170000"
97729,BAIRRO DO RIBEIRAO,166207,"BAIRRO DO RIBEIRAO, SN - CENTRO - 12170000"
97730,BAIRRO DA LAGOA,166208,"BAIRRO DA LAGOA, SN - CENTRO - 12170000"
97732,BAIRRO SANTA CRUZ DO RIO ABAIXO,166209,"SANTA CRUZ DO RIO ABAIXO, SN - CENTRO - 12140000"
97733,FAZENDA SAO JOSE,166210,"FAZENDA SAO JOSE, SN - FAZENDA SAO JOSE - 12140000"
131893,BAIRRO DO TURVO,166211,"BAIRRO DO TURVO, SN - BAIRRO DO TURVO - 12140000"
97734,BAIRRO DO BRIET,166212,"BAIRRO DO BRIET, SN - BAIRRO DO BRIET - 12140000"
97735,BAIRRO DO CHAPEU,166213,"BAIRRO DO CHAPEU, SN - CENTRO - 12140000"
97736,BAIRRO DO PINGA,166214,"BAIRRO DO PINGA, SN - CENTRO - 12140000"
97737,BAIRRO DE SAO SEBASTIAO,166215,"BAIRRO DE SAO SEBASTIAO, SN - BAIRRO DE SAO SEBASTIAO - 12140000"
97738,BAIRRO DA USINA,166216,"BAIRRO DA USINA, SN - BAIRRO DA USINA - 12140000"
131894,BAIRRO DA CACHOEIRA,166217,"BAIRRO DA CACHOEIRA, SN - BAIRRO DA CACHOEIRA - 12140000"
97739,BAIRRO DO RIO ABAIXO,166218,"BAIRRO DO RIO ABAIXO, SN - BAIRRO DO RIO ABAIXO - 12140000"
97740,BAIRRO DE SAO ROQUE,166219,"BAIRRO DE SAO ROQUE, SN - BAIRRO DE SAO ROQUE - 12140000"
97741,BAIRRO DA BARRA MANSA 89,166220,"BAIRRO DA BARRA MANSA, SN - CENTRO - 12140000"
97743,BAIRRO DO CAMPO GRANDE,166221,"BAIRRO DO CAMPO GRANDE, SN - CENTRO - 12140000"
97744,BAIRRO DA CACHOEIRINHA,166222,"BAIRRO DA CACHOEIRINHA, SN - CENTRO - 12140000"
97745,BAIRRO DO RIO ACIMA,166223,"BAIRRO DO RIO ACIMA, SN - BAIRRO DO RIO ACIMA - 12140000"
97746,BAIRRO DO RANCHO ALEGRE,166224,"BAIRRO DO RANCHO ALEGRE, SN - CENTRO - 12140000"
97747,BAIRRO DOS MEDEIROS,166225,"BAIRRO DOS MEDEIROS, SN - BAIRRO DOS MEDEIROS - 12140000"
97749,BAIRRO DOS LOBOS,166226,"BAIRRO DOS LOBOS, SN - CENTRO - 12140000"
131896,BAIRRO DO RIO CLARO,166227,"RIO CLARO, SN - CENTRO - 12140000"
97750,BAIRRO DO BOM RETIRO,166228,"BAIRRO DO BOM RETIRO, SN - CENTRO - 12140000"
97751,BAIRRO DOS CAETANOS,166229,"BAIRRO DOS CAETANOS, SN - BAIRRO DOS CAETANOS - 12140000"
97752,BAIRRO DO MONTE ALEGRE 100,166230,"BAIRRO DO MONTE ALEGRE, SN - CENTRO - 12140000"
97753,BAIRRO DOS DAMIOES,166231,"BAIRRO DOS DAMIOES, SN - CENTRO - 12140000"
97754,BAIRRO DA BARRA MANSA,166232,"BAIRRO DA BARRA MANSA, SN - BAIRRO DA BARRA MANSA - 12140000"
131897,BAIRRO DO POUSO FRIO,166233,"BAIRRO DO POUSO FRIO, SN - CENTRO - 12140000"
97755,BAIRRO PAMONA,166234,"BAIRRO PAMONA, SN - BAIRRO PAMONA - 12140000"
97756,BAIRRO DA ABERTA GRANDE,166235,"BAIRRO DA ABERTA GRANDE, SN - CENTRO - 12140000"
131898,BAIRRO DOS BENTOS,166236,"BAIRRO DOS BENTOS, SN - CENTRO - 12140000"
97759,BAIRRO DOS ALVARENGAS,166237,"BAIRRO DOS ALVARENGAS, SN - BAIRRO DOS ALVARENGAS - 12140000"
131899,BAIRRO SAO SEBASTIAO,166238,"BAIRRO SAO SEBASTIAO, SN - CENTRO - 12140000"
97761,BAIRRO DO BARREIRO,166239,"BAIRRO DO BARREIRO, SN - BAIRRO DO BARREIRO - 12140000"
97762,BAIRRO DO RIBEIRAO CLARO,166240,"BAIRRO DO RIBEIRAO CLARO, SN - BAIRRO DO RIBEIRAO CLARO - 12140000"
131900,BAIRRO PONTE NOVA,166241,"ESTRADA NATIVIDADE DA SERRA  BAIRRO SANTA CRUZ, SN - RODRIGO SOARES - 12180000"
97764,BAIRRO DO SERTAOZINHO,166242,"BAIRRO DOS CAETANOS, SN - CENTRO - 12140000"
97766,BAIRRO DO ORIENTE,166243,"BAIRRO DO ORIENTE, SN - CENTRO - 12140000"
97767,BAIRRO DO HORTELA,166244,"HORTELA, SN - CENTRO - 12140000"
97768,BAIRRO DO CAMPO GRANDE,166221,"BAIRRO DO CAMPO GRANDE, SN - CENTRO - 12140000"
97769,MONSENHOR IGNACIO GIOIA,166245,"MONS IGNACIO GIOIA, SN - CENTRO - 12140000"
97770,BAIRRO DO MORRO DA LAGE,166246,"BAIRRO MORRO DA LAGE, SN - CENTRO - 12140000"
97771,BAIRRO DO BAIRRINHO,166247,"BAIRRO DO BAIRRINHO, SN - BAIRRO DO BAIRRINHO - 12140000"
97772,BAIRRO DO RIO DAS FLORES,166248,"BAIRRO DO RIO DAS FLORES, SN - CENTRO - 12140000"
97773,FAZENDA SANTA CRUZ,166249,"FAZENDA SANTA CRUZ, SN -  - 12280000"
97774,BAIRRO DO MONJOLINHO,166250,"BAIRRO DO MONJOLINHO, SN -  - 12100000"
97775,BAIRRO DAS SETE VOLTAS,166251,"BAIRRO DAS SETE VOLTAS, SN -  - 12100000"
97776,BAIRRO DO PINHAO,166252,"ESTRADA MUNICIPAL DO BORBA, SN - PINHAO - 12400010"
97777,BAIRRO DO RIBEIRAO,166253,"POUSO FRIO, SN - CENTRO - 12130000"
97778,BAIRRO DOS REMEDIOS,166254,"BAIRRO DOS REMEDIOS, SN -  - 12100000"
97779,BAIRRO DO PINHEIRINHO,166255,"PINHEIRINHO, SN -  - 12100000"
97781,BAIRRO DO PINHEIRINHO,166255,"PINHEIRINHO, SN -  - 12100000"
97782,BAIRRO DA TATAUBA,166256,"BAIRRO DA TATAUBA, SN -  - 12100000"
97783,FAZENDA GUASSAY,166257,"FAZENDA GUASSAY, SN -  - 12100000"
97784,BAIRRO DE SAO GONCALO,166258,"BAIRRO DE SAO GONCALO, SN -  - 12100000"
97785,BAIRRO DA TATAUBA,166256,"BAIRRO DA TATAUBA, SN -  - 12100000"
97786,FAZENDA CAIEIRAS,166259,"CAIEIRAS, SN -  - 12100000"
97787,FAZENDA CAIEIRAS,166259,"CAIEIRAS, SN -  - 12100000"
97788,BAIRRO DO SAPE,166164,"SAPE, SN -  - 12280000"
131904,BAIRRO DA PEDRA NEGRA,166260,"BAIRRO DA PEDRA NEGRA, SN -  - 12100000"
97789,ANTONIO DE ANGELIS,166261,"BAIRRO DO REGISTRO, SN -  - 12100000"
97790,BAIRRO DO PAIOL,166262,"PAIOL, SN -  - 12100000"
97791,BAIRRO DE SANTA LUZIA,166263,"SANTA LUZIA, SN -  - 12100000"
131905,BAIRRO DA GRAMINHA,166264,"GRAMINHA, SN -  - 12100000"
97793,BAIRRO DO RIO COMPRIDO,166265,"B DO RIO COMPRIDO, SN -  - 12300000"
97794,BAIRRO DO MATO DENTRO,166266,"BAIRRO DO MATO DENTRO, SN -  - 12100000"
97795,BAIRRO DO RIBEIRAO DAS ALMAS,166267,"RIBEIRAO DAS ALMAS, SN -  - 12100000"
131906,BAIRRO DO RIO DAS ANTAS,166268,"RIO DAS ANTAS, SN -  - 12100000"
97796,BAIRRO DO MATO DENTRO,166269,"BDO MATO DENTRO, SN -  - 12100000"
97797,BAIRRO DO REGISTRO,166270,"REGISTRO, SN -  - 12100000"
97798,BAIRRO DO RIBEIRAO DAS ALMAS,166267,"RIBEIRAO DAS ALMAS, SN -  - 12100000"
97799,BAIRRO DE SAO FRANCISCO,166271,"SAO FRANCISCO, SN -  - 12100000"
97800,BAIRRO SAO GONCALO 1,166272,"BAIRRO SAO GONCALO, SN -  - 12100000"
97801,BAIRRO SAO GONCALO 2,166273,"BAIRRO SAO GONCALO 2, SN -  - 12100000"
131907,JAYME PEREIRA VIANNA PROF,166274,"JAYME PEREIRA VIANNA, SN -  - 12100000"
97802,BAIRRO PIRACANGUAGUA 2,166275,"BAIRRO PIRACANGUAGUA, SN -  - 12100000"
97803,BAIRRO PONTE ALTA,166276,"BAIRRO PONTE ALTA, SN -  - 12100000"
