91345,BAIRRO DA SERRINHA DA CONCEICAO,167178,"SERRINHA DA CONCEICAO, SN -  - 18400000"
98764,BAIRRO DO JACU,167179,"BAIRRO DO JACU, SN -  - 18400000"
98765,BAIRRO DOS COELHOS,167180,"BAIRRO DOS COELHOS, SN -  - 18400000"
98766,BAIRRO RIBEIRAO CLARO,167181,"BAIRRO RIBEIRAO CLARO, SN -  - 18400000"
98767,BAIRRO DO ITANGUA,167160,"ITANGUA, SN -  - 18400000"
98768,BAIRRO DOS LEMES DE CIMA,167182,"BAIRRO DOS LEMES DE CIMA, SN -  - 18400000"
98769,BAIRRO DAS FORMIGAS,167183,"BAIRRO DAS FORMIGAS, SN -  - 18400000"
123462,BAIRRO DA AREIA BRANCA,167184,"AREIA BRANCA, SN -  - 18400000"
98770,BAIRRO DO AVENCAL,167185,"BAIRRO DO AVENCAL, SN -  - 18400000"
98771,BAIRRO DOS COELHOS,167180,"BAIRRO DOS COELHOS, SN -  - 18400000"
98772,BAIRRO DAS TRES ARVORES,167186,"BAIRRO DAS TRES ARVORES, SN -  - 18400000"
98773,BAIRRO DAS PEDRINHAS,167187,"PEDRINHAS, SN -  - 18400000"
98774,BAIRRO DOS GARCIAS,167188,"BAIRRO DOS GARCIAS, SN - CENTRO - 18470000"
98775,BAIRRO SAO ROQUE 72,167189,"SAO ROQUE, SN -  - 18400000"
123575,BAIRRO RIBEIRAO CLARO,167190,"RIBEIRAO CLARO, SN -  - 18400000"
123632,BAIRRO DOS SUDARIOS,167191,"SUDARIOS, SN -  - 18400000"
98778,BAIRRO DO AVENCAL,167185,"BAIRRO DO AVENCAL, SN -  - 18400000"
98779,BAIRRO DAS TRES ONCAS,167192,"BAIRRO DAS TRES ONCAS, SN -  - 18400000"
98780,BAIRRO DO PACOVA,167193,"BAIRRO DO PACOVA, SN -  - 18400000"
123687,BAIRRO SALTINHO DO COQUEIRAL,167194,"SALT COQUEIRAL, SN -  - 18400000"
98782,BAIRRO DOS MATHIAS,167195,"MATHIAS, SN -  - 18400000"
98785,BAIRRO DA ESTACAO DE ENGENHEIRO BACELAR,167196,"B DA ESTACAO ENG BACELAR, SN -  - 18400000"
98786,BAIRRO DOS LAGES,167197,"BAIRRO DOS LAGES, SN - CENTRO - 18470000"
98787,SITIO BARBOSAS,167198,"SITIO BARBOSA, SN -  - 18400000"
98788,BAIRRO DOS LEMES,167199,"BAIRRO DOS LEMES, SN -  - 18400000"
98789,BAIRRO DAS PEDRINHAS,167187,"PEDRINHAS, SN -  - 18400000"
98790,BAIRRO DA BRANCAL,167200,"BAIRRO DO ALTO DA BRANCAL, SN -  - 18400000"
132080,BAIRRO DOS MINEIROS,167201,"BAIRRO DOS MINEIROS, SN -  - 18400000"
98791,FAZENDA USINA DA BARRA,167202,"FAZUSINA DA BARRA, SN -  - 18400000"
98792,BAIRRO DA TAIPINHA,167203,"BAIRRO DA TAIPINHA, SN -  - 18400000"
98793,BAIRRO DAS PEDRAS,167204,"BAIRRO DAS PEDRAS, SN -  - 18400000"
98794,BAIRRO DO MATO DENTRO,167205,"BAIRRO DO MATO DENTRO, SN -  - 18400000"
98795,ALTO DO BAIRRO DE CIMA,167206,"ALTO DO BAIRRO DE CIMA, SN -  - 18400000"
98796,BAIRRO DOS NICACIOS,167207,"BAIRRO DOS NICACIOS, SN -  - 18400000"
132081,BAIRRO DE CIMA,167130,"BAIRRO DE CIMA, SN -  - 18400000"
98797,BAIRRO TAQUARIMIRIM,167208,"BAIRRO TAQUARI  MIRIM, SN -  - 18400000"
98798,BAIRRO DAS PEDRAS,167204,"BAIRRO DAS PEDRAS, SN -  - 18400000"
98799,BAIRRO DOS PINTOS,167209,"BAIRRO DOS PINTOS, SN -  - 18400000"
98800,BAIRRO DO ESPIGAO DA PACOVINHA,167210,"ESPIGAO DA PACOVINHA, SN -  - 18400000"
98801,BAIRRO DA USINA DA BARRA,167211,"BAIRRO USINA DA BARRA, SN -  - 18400000"
98802,BAIRRO DO TOME,167212,"BAIRRO DO TOME, SN -  - 18400000"
132082,BAIRRO DA SERRINHA DA CONCEICAO,167178,"SERRINHA DA CONCEICAO, SN -  - 18400000"
98803,BAIRRO DOS PINTOS,167209,"BAIRRO DOS PINTOS, SN -  - 18400000"
98804,BAIRRO DO COLEGIO 018,167213,"COLEGIO, SN -  - 18400000"
98805,BAIRRO DE CIMA,167130,"BAIRRO DE CIMA, SN -  - 18400000"
98806,BAIRRO DOS MARIANOS,167214,"BAIRRO DOS MARIANOS, SN -  - 18400000"
98807,BAIRRO DOS MINEIROS,167201,"BAIRRO DOS MINEIROS, SN -  - 18400000"
98808,BAIRRO BRAGANCEIROS,167215,"BAIRRO BRAGANCEIROS, SN -  - 18400000"
132083,BAIRRO DA CABECEIRA DO TOME,167216,"BAIRRO CABECEIRA DO TOME, SN -  - 18400000"
98809,BAIRRO DA CAPUTERA,167143,"BAIRRO DA CAPUTERA, SN -  - 18400000"
98810,FAZENDA OITO MIL REIS,167217,"FAZENDA OITO MIL REIS, SN - CENTRO - 18470000"
98811,BAIRRO DOS FERREIRAS,167218,"BAIRRO DOS FERREIRAS, SN -  - 18400000"
132084,BAIRRO DA ESTACAO DE ENG BACELAR,167219,"EST DE ENGENHEIRO BACELAR, SN -  - 18400000"
98813,BAIRRO VAGUASSU,167220,"BAIRRO VAGUASSU, SN -  - 18400000"
132085,BAIRRO DOS PEREIRAS,167221,"BAIRRO DOS PEREIRAS, SN -  - 18400000"
98815,PATRIMONIO CORACAO DE JESUS,167222,"ESTRADA IRG, 425 - CRUZEIRINHO - 18480000"
98816,PATRIMONIO CORACAO DE JESUS,167223,"BAIRRO CORACAO DE JESUS, SN - CENTRO - 18480000"
98817,BAIRRO LAGEADINHO,167224,"BAIRRO LAGEADINHO, SN - CENTRO - 18480000"
132086,BAIRRO EVANGELISTA 288,167225,"BAIRRO EVANGELISTA, SN - CENTRO - 18480000"
98818,BAIRRO RIBEIRAO BRANCO,167226,"RIBEIRAO BRANCO, SN - CENTRO - 18480000"
98820,PATRIMONIO SAO SEBASTIAO,167227,"RUA NESTOR ALMEIDA CAMARGO, SN - SAO SEBASTIAO - 18480000"
98821,FAZENDA CAMPINA,167228,"FAZENDA CAMPINA, SN - CENTRO - 18480000"
98822,BAIRRO RASQUEADO,167229,"BAIRRO RASQUEADO, SN - CENTRO - 18480000"
132087,BAIRRO RIBEIRAO BRANCO,167226,"RIBEIRAO BRANCO, SN - CENTRO - 18480000"
98825,BAIRRO LAGEADINHO,167230,"BAIRRO LAGEADINHO, SN - CENTRO - 18480000"
98826,BAIRRO RIO VERDE 301,167231,"BAIRRO RIO VERDE, SN - CENTRO - 18480000"
98827,PATRIMONIO SAO SEBASTIAO,167232,"BAIRRO SAO SEBASTIAO, SN - CENTRO - 18480000"
98828,PATRIMONIO SAO SEBASTIAO,167233,"PATRIMONIO SAO SEBASTIAO, SN - CENTRO - 18480000"
98829,PATRIMONIO SAO SEBASTIAO,167233,"PATRIMONIO SAO SEBASTIAO, SN - CENTRO - 18480000"
98830,FAZENDA CORUJAS,167234,"FAZENDA CORUJAS, SN -  - 18400000"
98831,BAIRRO RIO VERDE 159,167231,"BAIRRO RIO VERDE, SN - CENTRO - 18480000"
132089,BAIRRO DOS NARCISOS,167235,"BAIRRO DOS NARCISOS, SN - CENTRO - 18480000"
98832,BAIRRO DO LAGEADO,167236,"BAIRRO LAGEADO, SN - CENTRO - 18480000"
98833,BAIRRO RIO VERDE 160,167231,"BAIRRO RIO VERDE, SN - CENTRO - 18480000"
98834,PATRIMONIO CORACAO DE JESUS,167223,"BAIRRO CORACAO DE JESUS, SN - CENTRO - 18480000"
98835,BAIRRO RASQUEADO,167237,"RASQUEADO, SN - CENTRO - 18480000"
132090,BAIRRO RIBEIRAO BRANCO,167226,"RIBEIRAO BRANCO, SN - CENTRO - 18480000"
98836,FAZENDA BOA ESPERANCA,167238,"FAZENDA BOA ESPERANCA, SN - CENTRO - 18480000"
98837,BAIRRO SAO SEBASTIAO DA BARRA GRANDE,167239,"SAO SEBASTIAO DA BARRA GRANDE, SN - CENTRO - 18480000"
98838,PATRIMONIO CORACAO DE JESUS,167240,"PATRIMONIO CORACAO DE JESUS, SN - CENTRO - 18480000"
132091,BAIRRO DOS SILVAS,167241,"BAIRRO DOS SILVAS, SN - CENTRO - 18480000"
98840,BAIRRO DOS SILVAS,167241,"BAIRRO DOS SILVAS, SN - CENTRO - 18480000"
98841,BAIRRO DA ONCA 292,167242,"ONCA, SN - CENTRO - 18480000"
98842,BAIRRO DA ONCA 293,167242,"ONCA, SN - CENTRO - 18480000"
98843,MOSTEIRO SAO JOSE,167243,"BAIRRO DO MOSTEIRO, SN - CENTRO - 18480000"
98844,BAIRRO DO RETIRO,167244,"BAIRRO DO RETIRO, SN - CENTRO - 18480000"
132092,BAIRRO BREJAO,167245,"BAIRRO BREJAO, SN - CENTRO - 19700000"
132093,BAIRRO TIJUCO PRETO,167246,"BAIRRO TIJUCO PRETO, SN - CENTRO - 18480000"
98846,BAIRRO CAPITUVA,167247,"BAIRRO CAPITUVA, SN - CENTRO - 18480000"
98847,BAIRRO PUTENCHEN,167248,"BAIRRO PUTENCHEN, SN - CENTRO - 18480000"
132094,FAZENDA PAU DALHO,167249,"FAZENDA PAU DALHO, SN - CENTRO - 18480000"
98848,BAIRRO TIJUCO PRETO,167246,"BAIRRO TIJUCO PRETO, SN - CENTRO - 18480000"
98849,FAZENDA VOLTA GRANDE,167250,"FAZENDA VOLTA GRANDE, SN - CENTRO - 18480000"
98850,BAIRRO DOS REMEDIOS,167251,"BAIRRO DOS REMEDIOS, SN - CENTRO - 18480000"
98851,BAIRRO DOS BERNARDES,167252,"BAIRRO DOS BERNARDES, SN - CENTRO - 18480000"
132095,BAIRRO D MARIA JULIA,167253,"D MARIA JULIA, SN - CENTRO - 18480000"
98852,BAIRRO JOAO FLAUZINO,167254,"BAIRRO JOAO FLAUZINO, SN - CENTRO - 18480000"
98853,BAIRRO SANTA TEREZINHA 163,167255,"STA TEREZINHA, SN - CENTRO - 18480000"
98854,BAIRRO NOSSA SENHORA DOS REMEDIOS,167256,"NOSSA SENHORA DOS REMEDIOS, SN - CENTRO - 18480000"
98855,BAIRRO DA ONCA 173,167242,"ONCA, SN - CENTRO - 18480000"
132096,BAIRRO TIJUCO PRETO 162,167257,"TIJUCO PRETO, SN - CENTRO - 18480000"
98857,FAZENDA PAU DALHO,167249,"FAZENDA PAU DALHO, SN - CENTRO - 18480000"
98858,BAIRRO CAPITUVA 172,167258,"CAPITUVA, SN - CENTRO - 18480000"
98859,BAIRRO DONA MARIA JULIA,167259,"BAIRRO DONA MARIA JULIA, SN - CENTRO - 18480000"
98860,BAIRRO BELA VISTA 161,167260,"BELA VISTA, SN - CENTRO - 18480000"
132097,BAIRRO DO ITOPAVA,167261,"ITOPAVA, SN - CENTRO - 18460000"
98867,RESERVA FLORESTAL DO ESTADO,167262,"FAZENDA VENTANIA, SN - CENTRO - 18460000"
98868,BAIRRO DO ITOPAVA,167261,"ITOPAVA, SN - CENTRO - 18460000"
98869,BAIRRO DO RIO VERDE,167263,"RIO VERDE, SN - CENTRO - 18460000"
98870,BAIRRO DA COPAMI,167264,"BAIRRO DA COPAMI, SN - CENTRO - 18460000"
98871,BAIRRO DA CAPELINHA,167265,"BAIRRO DA CAPELINHA, SN - CENTRO - 18460000"
98872,VILA NOVO HORIZONTE,167266,"VILA NOVO HORIZONTE, SN - CENTRO - 18460000"
132100,FAZENDA SANTA ISABEL,167267,"FAZENDA SANTA ISABEL, SN - CENTRO - 18460000"
98873,BAIRRO DA PEDRA BRANCA 188,167268,"PEDRA BRANCA, SN - CENTRO - 18460000"
98874,BAIRRO DA CAPELINHA,167265,"BAIRRO DA CAPELINHA, SN - CENTRO - 18460000"
98875,BAIRRO DA SERRINHA DO BOM SUCESSO 221,167269,"SER B SUCESSO, SN - CENTRO - 18460000"
98876,BAIRRO DA GRAMINHA,167270,"BAIRRO DA GRAMINHA, SN - CENTRO - 18460000"
98877,BAIRRO DO SOBRADINHO,167271,"BAIRRO DO SOBRADINHO, SN - CENTRO - 18460000"
132101,EMERGENCIA DO BAIRRO DO MATAO 206,167272,"MATAO, SN - CENTRO - 18460000"
132102,BAIRRO DOS FORTUNATOS,167273,"FORTUNATOS, SN - CENTRO - 18460000"
132103,BAIRRO DA AGUA NOVA,167274,"BAIRRO DA AGUA NOVA, SN - CENTRO - 18460000"
98879,BAIRRO DA ENXOVIA,167275,"BAIRRO DA ENXOVIA, SN - CENTRO - 18460000"
98880,BAIRRO DO BARRO PRETO,167276,"BAIRRO DO BARRO PRETO, SN - CENTRO - 18460000"
98881,FAZENDA SANTA IZABEL,167277,"FAZENDA SANTA IZABEL, SN - CENTRO - 18460000"
98882,BAIRRO ITOPAVA,167278,"BAIRRO ITOPAVA, SN - CENTRO - 18460000"
98883,BAIRRO DO CEDRO,167279,"BAIRRO DO CEDRO, SN -  - 18400000"
98884,BAIRRO DO MATAO PRIMEIRA,167280,"BAIRRO DO LAGEADO, SN - CENTRO - 18460000"
98885,BAIRRO MORRO VERMELHO,167281,"BAIRRO MORRO VERMELHO, SN - CENTRO - 18460000"
98886,FAZENDA SANTANA,167282,"BAIRRO SANTANA, SN - CENTRO - 18460000"
98887,FAZENDA JOAO CECCHI,167283,"JOAO CECCHI, SN - CENTRO - 18460000"
98888,BAIRRO SAO JOSE,167284,"BAIRRO SAO JOSE, SN - CENTRO - 18460000"
132105,BAIRRO DO BARREIRINHO,167285,"BAIRRO DO BARREIRINHO, SN - CENTRO - 18460000"
98889,BAIRRO PASSO FINO,167286,"BAIRRO DO PASSO FINO, SN - CENTRO - 18460000"
98890,BAIRRO DO CACADOR,167287,"BAIRRO DO CACADOR, SN - CENTRO - 18460000"
98891,BAIRRO DA SERRINHA DOS GERINGS,167288,"SERRINHA DOS GERINGS, SN - CENTRO - 18460000"
98892,FAZENDA BOA VISTA,167289,"BOA VISTA, SN - CENTRO - 18460000"
132106,FAZENDA SANTA MARIA,167290,"FAZENDA SANTA MARIA, SN - CENTRO - 18460000"
98893,BAIRRO DO CERRADO,167291,"CERRADO, SN - CENTRO - 18460000"
98894,BAIRRO DO CERRADO,167291,"CERRADO, SN - CENTRO - 18460000"
132107,FAZENDA JAVA,167292,"FAZENDA JAVA, SN - CENTRO - 18460000"
98897,BAIRRO DO LAGEADO 188,167293,"LAGEADO, SN - CENTRO - 18460000"
98898,BAIRRO DO CACADOR,167287,"BAIRRO DO CACADOR, SN - CENTRO - 18460000"
98899,BAIRRO DAS FURNAS DO BARREIRINHO,167294,"BAIRRO DAS FURNAS, SN - CENTRO - 18460000"
98900,BAIRRO DOS AMERICOS,167295,"BAIRRO DOS AMERICOS, SN - CENTRO - 18460000"
132108,FAZENDA RIO VERDINHO,167296,"FAZENDA RIO VERDINHO, SN - CENTRO - 18460000"
98901,VILA NOVO HORIZONTE,167266,"VILA NOVO HORIZONTE, SN - CENTRO - 18460000"
98902,BAIRRO DO CERRADO,167291,"CERRADO, SN - CENTRO - 18460000"
98903,BAIRRO DO BARRO PRETO,167276,"BAIRRO DO BARRO PRETO, SN - CENTRO - 18460000"
98904,FAZENDA BOA VISTA,167297,"FAZENDA BOA VISTA, SN - CENTRO - 18460000"
98905,FAZENDA JAVA,167292,"FAZENDA JAVA, SN - CENTRO - 18460000"
132109,BAIRRO DE SANTA BARBARA,167298,"BAIRRO DE SANTA BARBARA, SN - CENTRO - 18460000"
98906,BAIRRO DE SANTA BARBARA,167298,"BAIRRO DE SANTA BARBARA, SN - CENTRO - 18460000"
98907,BAIRRO DE SANTA BARBARA,167299,"SANTA BARBARA, SN - CENTRO - 18460000"
98908,BAIRRO DO MORRO AZUL,167300,"BAIRRO MORRO AZUL, SN - CENTRO - 18460000"
98909,BAIRRO DO MATAO,167301,"BAIRRO DO MATAO, SN - CENTRO - 18460000"
98910,BAIRRO DO MATAO AGRUP A 330361,167301,"BAIRRO DO MATAO, SN - CENTRO - 18460000"
132110,ISOLADA DO BAIRRO DO MORRO CHATO,167302,"MORRO CHATO, SN - CENTRO - 18460000"
98911,BAIRRO DO TAQUARUSSU,167303,"TAQUARUSSU, SN - CENTRO - 18460000"
98912,BAIRRO DA SEDA,167304,"BAIRRO DA SEDA, SN - CENTRO - 18460000"
98913,BAIRRO DO QUADRO,167305,"BAIRRO DO QUADRO, SN - CENTRO - 18460000"
98914,BAIRRO DO QUADRO,167305,"BAIRRO DO QUADRO, SN - CENTRO - 18460000"
98915,USINA MARINGA,167306,"USINA MARINGA, SN - CENTRO - 18460000"
132112,BAIRRO DO MATAO DO HERMENEGILDO,167307,"MATAO DO HERMENEGILDO, SN - CENTRO - 18460000"
98916,BAIRRO CAPELINHA,167265,"BAIRRO DA CAPELINHA, SN - CENTRO - 18460000"
98917,FAZENDA ANTONIO HOLMOS,167308,"ANTONIO HOLMOS, SN - CENTRO - 18460000"
98918,FAZENDA DIVA,167309,"FAZENDA DIVA, SN - CENTRO - 18460000"
98919,BAIRRO DA FORQUILHA 210,167310,"CACADOR, SN - CENTRO - 18460000"
98920,FAZENDA PEDRO JARDIM,167311,"FAZENDA PEDRO JARDIM, SN - CENTRO - 18460000"
98921,BAIRRO MATAO DO HERMENEGILDO,167307,"MATAO DO HERMENEGILDO, SN - CENTRO - 18460000"
98922,BAIRRO DOS PRESTES,167312,"BAIRRO DOS PRESTES, SN - CENTRO - 18460000"
98923,BAIRRO APARECIDA DO SALTO,167313,"BAIRRO APARECIDA DO SALTO, SN - CENTRO - 18460000"
98924,SERRINHA DO BOM SUCESSO,167314,"SERRINHA DO BOM SUCESSO, SN - CENTRO - 18460000"
98925,BAIRRO DA AGUA NOVA,167274,"BAIRRO DA AGUA NOVA, SN - CENTRO - 18460000"
98926,BAIRRO CAN CAN,167315,"BAIRRO CAN CAN, SN - CENTRO - 18470000"
98927,BAIRRO SANTA CRUZ,167316,"SANTA CRUZ, SN - CENTRO - 18470000"
132114,FAZENDA OITO MIL REIS,167317,"FAZ OITO MIL REIS, SN - CENTRO - 18470000"
98928,BAIRRO DOS UMBELINOS,167318,"UMBELINOS, SN - CENTRO - 18470000"
98929,FAZENDA SAO JORGE,167319,"SAO JORGE, SN - CENTRO - 18470000"
98930,BAIRRO DA CAPELINHA,167320,"CAPELINHA, SN - CENTRO - 18470000"
98931,BAIRRO DOS GARCIAS 319,167321,"GARCIAS, SN - CENTRO - 18470000"
98932,BAIRRO DO GASPAR,167322,"BAIRRO DO GASPAR, SN - CENTRO - 18470000"
132115,FAZENDA SANTO ANTONIO 224,167323,"SANTO ANTONIO, SN - CENTRO - 18470000"
98933,BAIRRO DOS LAGES,167197,"BAIRRO DOS LAGES, SN - CENTRO - 18470000"
98934,FAZENDA CACHOEIRA,167324,"FAZENDA CACHOEIRA, SN - CENTRO - 18470000"
98935,FAZENDA MITINORI,167325,"FAZENDA MITINORI, SN - CENTRO - 18470000"
98936,BAIRRO DOS FROES,167326,"BAIRRO DOS FROES, SN - CENTRO - 18470000"
98937,BAIRRO DOS FROES,167326,"BAIRRO DOS FROES, SN - CENTRO - 18470000"
132116,BAIRRO DOS GARCIAS,167188,"BAIRRO DOS GARCIAS, SN - CENTRO - 18470000"
98938,BAIRRO DOS FANTES,167327,"BAIRRO DOS FANTES, SN -  - 00000000"
98939,BAIRRO CAN CAN,167328,"CAN CAN, SN - CENTRO - 18470000"
98940,BAIRRO DOS UMBELINOS,167329,"BAIRRO DOS UMBELINOS, SN - CENTRO - 18460000"
98941,BAIRRO DOS AMANCIOS,167330,"BAIRRO DOS AMANCIOS, SN - CENTRO - 18470000"
132117,BAIRRO DOS MENDONCAS,167331,"BAIRRO DOS MENDONCAS, SN - CENTRO - 18470000"
98942,BAIRRO DOS BATISTAS,167332,"BATISTAS, SN - CENTRO - 18470000"
98943,MANOEL RAYMUNDO MARQUES PROF,167333,"BAIRRO BARRA ALEGRE, SN - BARRA ALEGRE - 18470000"
98944,BAIRRO DA TABOA,167334,"BAIRRO DA TABOA, SN - CENTRO - 18470000"
98945,FAZENDA SAO JOAQUIM,167335,"FAZSAO JOAQUIM, SN - CENTRO - 18470000"
132118,BAIRRO BARRA ALEGRE 316,167336,"BARRA ALEGRE, SN - CENTRO - 18470000"
98947,BAIRRO DOS CORREAS,167337,"CORREAS, SN - CENTRO - 18470000"
98948,BAIRRO SANTA CRUZ,167316,"SANTA CRUZ, SN - CENTRO - 18470000"
132119,BAIRRO DOS MENDONCAS,167338,"MENDONCAS, SN - CENTRO - 18470000"
98949,BAIRRO DAS FURNAS,167339,"BAIRRO DAS FURNAS, SN - CENTRO - 18470000"
98950,BAIRRO DOS CORREAS,167337,"CORREAS, SN - CENTRO - 18470000"
98951,BAIRRO DAS PAINEIRAS,167340,"BAIRRO DAS PAINEIRAS, SN - CENTRO - 18470000"
98952,FAZENDA SAO JORGE,167319,"SAO JORGE, SN - CENTRO - 18470000"
98953,BAIRRO DOS MENDONCAS,167338,"MENDONCAS, SN - CENTRO - 18470000"
132120,BAIRRO ROLA BURRO,167341,"BAIRRO ROLA BURRO, SN - CENTRO - 18470000"
98954,RETIRO DOS NUNES,167342,"RETIRO DOS NUNES, SN - JARDIM PAULISTA - 13310000"
98955,BAIRRO BANANAL,167343,"BANANAL, SN - JARDIM PAULISTA - 13310000"
98956,BAIRRO CAI DE BAIXOSEGUNDA,167344,"BAIRRO CAI DE BAIXO, SN - JARDIM PAULISTA - 13310000"
132121,BAIRRO CAI DE BAIXOQUARTA,167344,"BAIRRO CAI DE BAIXO, SN - JARDIM PAULISTA - 13310000"
98957,FAZENDA CACHOEIRA,167345,"FAZENDA CACHOEIRA, SN - JARDIM PAULISTA - 13310000"
98958,BAIRRO ITAGUA,167346,"FAZ ITAGUA, SN - JARDIM PAULISTA - 13310000"
98959,FAZENDA PINHAL,167347,"FAZENDA PINHAL, SN - JARDIM PAULISTA - 13310000"
98960,BAIRRO BANANALTERCEIRA,167343,"BANANAL, SN - JARDIM PAULISTA - 13310000"
132122,BAIRRO CAI DE CIMA,167348,"ESTCLAUDIO GIANINI, SN -  - 13380000"
98961,BAIRRO CAI DE CIMAPRIMEIRA,167349,"BAIRRO CAI DE CIMA, SN - JARDIM PAULISTA - 13310000"
98962,BAIRRO CURURU,167350,"CURURU, SN - JARDIM PAULISTA - 13310000"
98963,BAIRRO DO CURURUTERCEIRA,167350,"CURURU, SN - JARDIM PAULISTA - 13310000"
98964,BAIRRO PIRAI,167351,"PIRAI, SN - JARDIM PAULISTA - 13310000"
98965,BAIRRO BANANAL,167352,"FAZENDA CIDADE DO BEM, SN - JARDIM PAULISTA - 13310000"
98966,FAZENDA PINHAL,167347,"FAZENDA PINHAL, SN - JARDIM PAULISTA - 13310000"
98967,FAZENDA TAGUA,167353,"FAZENDA TAGUA, SN -  - 13380000"
98969,BAIRRO CURURUSEGUNDA,167350,"CURURU, SN - JARDIM PAULISTA - 13310000"
98971,FAZENDA SANTO ANTONIO DO IPE,167354,"BAIRRO ITAIM, SN -  - 13300000"
98972,FAZENDA BEIRA RIO,167355,"FAZENDA BEIRA RIO, SN -  - 13300000"
98973,FAZENDA CURUMIM,167356,"RODOVIA CASTELO BRANCO KM 74, SN - VAREJAO - 13300000"
98974,FAZENDA CURUMIM,167357,"VAREJAO, SN -  - 13300000"
98975,FAZENDA SANTA MARTA,167358,"FAZENDA SANTA MARTA, SN -  - 13300000"
98976,CAMPING SANTA FE,167359,"BAIRRO TAQUARAL, KM 19 - TAQUARAL - 13300000"
98977,BAIRRO VAREJAO,167360,"FAZ SAO JORGE, SN - BAIRRO VAREJAO - 13300000"
98978,FAZENDA BOM CONSELHO,167361,"BAIRRO BOTUXIM, SN -  - 13300000"
98979,FAZENDA CAPUAVA,167362,"FAZ CAPUAVA, SN -  - 13300000"
132126,FAZENDA JAMAICA,167363,"ESTRADA DO PINHEIRINHO, SN - PINHEIRINHO - 13300000"
132127,FAZENDA BOM CONSELHO,167361,"BAIRRO BOTUXIM, SN -  - 13300000"
98980,BAIRRO DO ITAIM,167364,"ESTRADA SETE QUEDAS, SN - BAIRRO DO ITAIM - 13300000"
132128,FAZENDA SANTA MARIA,167365,"BAIRRO PINHEIRINHO, SN -  - 13300000"
98981,BAIRRO CRUZ DAS ALMAS,167366,"RODOVIA WALDOMIRO CORREA DE CAMARGO, SN - CRUZ DAS ALMAS - 13300000"
98982,BAIRRO PIRAPITINGUI,167367,"BAIRRO PIRAPITINGUI, SN -  - 13300000"
98983,BAIRRO DO SOCORRO,167368,"BAIRRO DO SOCORRO, SN - BAIRRO DO SOCORRO - 13300000"
98984,BAIRRO DAS TRES VENDAS,167369,"BAIRRO DAS TRES VENDAS, SN -  - 13300000"
98985,BAIRRO DAS TRES VENDAS,167370,"TRES VENDAS, SN -  - 13300000"
132129,BAIRRO DAS TRES VENDAS,167371,"RONDON MARECHAL, SN - ITAIM - 13312000"
98987,BAIRRO DOS CARVALHOS,167372,"BAIRRO DOS CARVALHOS, SN -  - 13300000"
98988,BAIRRO ITAIM GUASSU,167354,"BAIRRO ITAIM, SN -  - 13300000"
132130,DR FRANCISCO URSAIA 15,167373,"DR FRANCISCO URSAIA, SN -  - 13300000"
98990,FAZENDA SAO CRISTOVAO,167374,"ESTRADA ITU  PORTO FELIZ, SN -  - 13300000"
98991,BAIRRO PIRAPITINGUI,167367,"BAIRRO PIRAPITINGUI, SN -  - 13300000"
98992,FAZENDA SAO CRISTOVAO,167375,"FAZENDA SAO CRISTOVAO, SN -  - 13300000"
98993,RETIRO DOS NUNES,167376,"RETIRO NUNES, SN -  - 13300000"
98994,FAZENDA BOM JARDIM,167377,"FAZENDA BOM JARDIM, SN -  - 13300000"
98995,FAZENDA CANA VERDE,167378,"RODOVIA MARECHAL RONDON, SN - PEDREGULHO - 13300000"
132131,FAZENDA CANA VERDE,167379,"FAZENDA CANA VERDE, SN -  - 13300000"
98996,FAZENDA CONCORDIA,167378,"RODOVIA MARECHAL RONDON, SN - PEDREGULHO - 13300000"
98997,FAZENDA PEDRA AZUL,167380,"FAZ PEDRA AZUL, SN -  - 13300000"
98998,BAIRRO ITAIM GUACU,167381,"BAIRRO ITAIM GUACU, SN -  - 13300000"
98999,TERRAS DE SANTA MARIA,167382,"BAIRRO APOTRIBU, SN -  - 13300000"
99000,FAZENDA BOM JARDIM,167383,"FAZ BOM JARDIM, SN -  - 13300000"
99001,FAZENDA NOVA AMERICA,167384,"F NOVA AMERICA, SN -  - 13300000"
132132,FAZENDA SAO JOSE,167385,"FAZENDA SAO JOSE, SN - FAZENDA SAO JOSE - 13300000"
99002,RETIRO DOS NUNES,167386,"F RETIRO NUNES, SN -  - 13300000"
99003,VALE DAS BRISAS,167387,"RODOVIA CASTELO BRANCO, SN - VALE DAS BRISAS - 13300000"
99004,FAZENDA CURUMIM,167388,"BAIRRO VAREJAO, SN -  - 13300000"
99005,FAZENDA CONCORDIA,167389,"FAZ CONCORDIA, SN -  - 13300000"
132133,FAZENDA VILA NOVA,167390,"FAZENDA VILA NOVA, SN - AVECUIA DO ALTO - 18540000"
99007,COLONIA RODRIGO SILVA,167391,"C RODRIGO SILV, SN - AVECUIA DO ALTO - 18540000"
99008,BAIRRO CRUZ DAS ALMAS,167392,"BAIRRO CRUZ DAS ALMAS, SN - AVECUIA DO ALTO - 18540000"
99009,BAIRRO JUPIRA,167393,"BAIRRO JUPIRA, SN - AVECUIA DO ALTO - 18540000"
99010,BAIRRO JUPIRA,167394,"BAIRRO JUPIRA, SN - AVECUIA DO ALTO - 18540000"
99011,BAIRRO PIMENTA,167395,"BAIRRO PIMENTA, SN - AVECUIA DO ALTO - 18540000"
99012,BAIRRO FAXINAL,167396,"BAIRRO FAXINAL, SN - AVECUIA DO ALTO - 18540000"
132135,BAIRRO INDAIATUBA,167397,"BAIRRO INDAIATUBA, SN - AVECUIA DO ALTO - 18540000"
99013,BAIRRO CAIACATINGA,167398,"BAIRRO CAIACATINGA, SN - AVECUIA DO ALTO - 18540000"
99014,BAIRRO SOAMIM,167399,"SOAMIM, SN - AVECUIA DO ALTO - 18540000"
132136,BAIRRO TABARRO,167400,"BAIRRO TABARRO,  SN - AVECUIA DO ALTO - 18540000"
99015,BAIRRO BOM RETIRO,167401,"BAIRRO BOM RETIRO, SN - AVECUIA DO ALTO - 18540000"
99016,BAIRRO CAMPO LARGO,167402,"CAMPO LARGO, SN - AVECUIA DO ALTO - 18540000"
99017,BAIRRO CEDRINHO,167403,"BAIRRO CEDRINHO, SN - AVECUIA DO ALTO - 18540000"
99018,BAIRRO FAXINAL,167404,"BAIRRO FAXINAL, SN - AVECUIA DO ALTO - 18540000"
132137,GRANJA SHIRO SHINODA,167405,"GRANJA SHIRO SHINODA, SN - AVECUIA DO ALTO - 18540000"
99019,BAIRRO GRAMADO,167406,"BAIRRO GRAMADO, SN - AVECUIA DO ALTO - 18540000"
99020,FAZENDA CONCEICAO,167407,"FAZENDA CONCEICAO, SN - AVECUIA DO ALTO - 18540000"
99021,BAIRRO DA GLORIA,167408,"BAIRRO DA GLORIA, SN - AVECUIA DO ALTO - 18540000"
99022,BAIRRO DA GLORIA,167409,"BAIRRO DA GLORIA, SN - AVECUIA DO ALTO - 18540000"
132138,BAIRRO TABARRO,167410,"TABARRO, SN - AVECUIA DO ALTO - 18540000"
99023,BAIRRO VALPARAISO,167411,"VALPARAISO, SN - AVECUIA DO ALTO - 18540000"
99024,BAIRRO SOAMIM,167412,"BAIRRO SOAMIM, SN - AVECUIA DO ALTO - 18540000"
99025,FAZENDA CAMPO GRANDE,167413,"FAZENDA CAMPO GRANDE, SN - AVECUIA DO ALTO - 18540000"
99026,BAIRRO PIQUIRA,167414,"BAIRRO PIQUIRA, SN - AVECUIA DO ALTO - 18540000"
132139,FAZENDA CONCEICAO,167407,"FAZENDA CONCEICAO, SN - AVECUIA DO ALTO - 18540000"
99027,FAZENDA CONCEICAO  QUINTA,167407,"FAZENDA CONCEICAO, SN - AVECUIA DO ALTO - 18540000"
99028,FAZENDA SOBRADINHO,167415,"FAZENDA SOBRADINHO, SN - AVECUIA DO ALTO - 18540000"
99029,BAIRRO VILA NOVA,167416,"BAIRRO VILA NOVA, SN - AVECUIA DO ALTO - 18540000"
132140,BAIRRO CHAPADAO,167417,"CHAPADAO, SN - AVECUIA DO ALTO - 18540000"
99030,BAIRRO REGISTRO,167418,"REGISTRO, SN - AVECUIA DO ALTO - 18540000"
99032,BAIRRO CHAPADAO,167419,"BAIRRO CHAPADAO, SN - AVECUIA DO ALTO - 18540000"
99033,FAZENDA SOBRADINHO,167415,"FAZENDA SOBRADINHO, SN - AVECUIA DO ALTO - 18540000"
132141,BAIRRO REGISTRO,167418,"REGISTRO, SN - AVECUIA DO ALTO - 18540000"
99034,BAIRRO TANQUINHO,167420,"BAIRRO TANQUINHO, SN - AVECUIA DO ALTO - 18540000"
99035,FAZENDA CONCEICAO,167407,"FAZENDA CONCEICAO, SN - AVECUIA DO ALTO - 18540000"
99036,COLONIA RODRIGO SILVA,167421,"COLONIA RODRIGO SILVA, SN - AVECUIA DO ALTO - 18540000"
132142,FAZENDA CONCEICAO,167407,"FAZENDA CONCEICAO, SN - AVECUIA DO ALTO - 18540000"
99038,FAZENDA SAO JOSE,167422,"FAZENDA SAO JOSE, SN - AVECUIA DO ALTO - 18540000"
99039,FAZENDA ANGELIERI,167423,"FAZENDA ANGELIERI, SN - AVECUIA DO ALTO - 18540000"
99040,BAIRRO ATUAU,167424,"BAIRRO ATUAU, SN - BAIRRO ATUAU - 13320000"
99041,BAIRRO GUARUJA,167425,"BAIRRO GUARUJA, SN - BAIRRO GUARUJA - 13321110"
99042,FAZENDA VESUVIO,167426,"FAZENDA VESUVIO, SN - FAZ VESUVIO - 13321110"
99043,BAIRRO BURU,167427,"BAIRRO BURU, SN - BAIRRO BURU - 13321110"
99044,BAIRRO BURU,167428,"BAIRRO BURU, SN -  - 13320000"
99045,BAIRRO BOA VISTA,167429,"FAZENDA GENOVEVA, SN -  - 13320000"
132144,BAIRRO ATUAU,167430,"BAIRRO ATUAU, SN -  - 13320000"
