98433,BAIRRO SITIO VELHO,166877,"BAIRRO SITIO VELHO, SN -  - 18300000"
132015,BAIRRO DOS CORDEIROS,166878,"BAIRRO DOS CORDEIROS, SN -  - 18300000"
98434,BAIRRO FERREIRA DOS MATOS,166873,"FERREIRA DOS MATOS, SN -  - 18300000"
98435,BAIRRO DOS PROENCAS,166879,"BAIRRO DOS PROENCAS, SN -  - 18300000"
132016,BAIRRO DOS MACHADOS,166880,"BAIRRO DOS MACHADOS, SN -  - 18300000"
98437,BAIRRO SAO JOSE,166881,"BAIRRO SAO JOSE, SN -  - 18300000"
132017,BAIRRO AGUA QUENTE,166882,"BAIRRO AGUA QUENTE, SN -  - 18300000"
98438,BAIRRO SAO JOSE,166881,"BAIRRO SAO JOSE, SN -  - 18300000"
98439,BAIRRO DOS GOMES,166883,"BAIRRO DOS GOMES, SN -  - 18300000"
98440,SITIO DOS GOMES,166884,"SITIO DOS GOMES, SN -  - 18300000"
98441,FAZENDA SANTA TEREZINHA,166885,"FAZENDA SANTA TEREZINHA, SN -  - 18300000"
98442,BAIRRO SAO JOSE,166881,"BAIRRO SAO JOSE, SN -  - 18300000"
132018,BAIRRO DOS HENRIQUES,166886,"BAIRRO DOS HENRIQUES, SN -  - 18300000"
98443,BAIRRO DOS ALVES,166887,"BAIRRO DOS ALVES, SN -  - 18300000"
98444,BAIRRO DOS FERNANDES,166888,"BAIRRO DOS FERNANDES, SN -  - 18300000"
98445,BAIRRO APIAI MIRIM,166876,"BAIRRO APIAI MIRIM, SN -  - 18300000"
98446,BAIRRO APIAI MIRIM,166876,"BAIRRO APIAI MIRIM, SN -  - 18300000"
98447,BAIRRO DOS FREITAS,166889,"BAIRRO DOS FREITAS, SN -  - 18300000"
98448,BAIRRO CAPOEIRA ALTA,166890,"BAIRRO CAPOEIRA ALTA, SN -  - 18300000"
132019,BAIRRO DO BARREIRINHO,166891,"BAIRRO DO BARREIRINHO, SN -  - 18300000"
98449,BAIRRO DOS CRAVOS,166892,"BAIRRO DOS CRAVOS, SN -  - 18300000"
98450,BAIRRO FREI BENTO,166893,"BAIRRO FREI BENTO, SN -  - 18300000"
98451,BAIRRO DOS FREITAS 111,166894,"DOS FREITAS, SN -  - 18300000"
98452,BAIRRO DA PASSAGEM,166895,"BAIRRO DA PASSAGEM, SN -  - 18300000"
98453,BAIRRO LAGOA DOS MOSQUITOS,166896,"BAIRRO LAGOA DOS MOSQUITOS, SN -  - 18300000"
98454,BAIRRO DA BARRINHA,166897,"BAIRRO DA BARRINHA, SN -  - 18300000"
132020,BAIRRO DOS LEMES DE CIMA,166898,"BAIRRO DOS LEMES DE CIMA, SN -  - 18300000"
98455,BAIRRO MATO DENTRO,166899,"MATO DENTRO, SN -  - 18300000"
98456,BAIRRO DA SERRINHA,166900,"SERRINHA, SN -  - 18300000"
98457,BAIRRO DO TIJUCO PRETO,166901,"BAIRRO DO TIJUCO PRETO, SN -  - 18300000"
98458,BAIRRO RAMAL LENHEIRO,166902,"BAIRRO RAMAL LENHEIRO, SN -  - 18300000"
98459,BAIRRO DOS PROENCAS,166879,"BAIRRO DOS PROENCAS, SN -  - 18300000"
98460,BAIRRO DO RAMAL LENHEIRO,166903,"RAMAL LENHEIRO, SN -  - 18300000"
98464,BAIRRO DA JACUTINGA 231,166904,"JACUTINGA, SN - CENTRO - 18250000"
98465,BAIRRO DO CERRO,166905,"BAIRRO DO CERRO, SN - CENTRO - 18250000"
98467,BAIRRO VITORIA DE CIMA,166906,"BAIRRO VITORIA DE CIMA, SN - CENTRO - 18250000"
98469,BAIRRO DA VILETA,166907,"BAIRRO DA VILETA, SN - CENTRO - 18250000"
132023,BAIRRO DO RIBEIRAO GRANDE,166908,"RIBEIRAO GRANDE, SN - CENTRO - 18250000"
132024,BAIRRO AREIA BRANCA DE CIMA,166909,"AREIA BRANCA, SN - CENTRO - 18250000"
98470,BAIRRO DOS BARROS,166910,"BAIRRO DOS BARROS, SN - CENTRO - 18250000"
132025,BAIRRO CAPELA VELHA,166911,"BAIRRO CAPELA VELHA, SN - CENTRO - 18250000"
98472,BAIRRO DO CERRADO,166912,"CERRADO, SN - CENTRO - 18250000"
98473,BAIRRO DOS LOPES,166913,"BAIRRO DOS LOPES, SN - CENTRO - 18250000"
98474,BAIRRO DO BOCO,166914,"BAIRRO DO BOCO, SN - CENTRO - 18250000"
98475,BAIRRO DO CERRITO,166915,"CERRITO, SN - CENTRO - 18250000"
132026,BAIRRO MORRO ALEGRE,166916,"BAIRRO MORRO ALEGRE, SN - CENTRO - 18250000"
98476,BAIRRO DA AREIA BRANCA,166909,"AREIA BRANCA, SN - CENTRO - 18250000"
98477,BAIRRO AREIA BRANCA,166917,"BAIRRO AREIA BRANCA, SN - CENTRO - 18250000"
98478,BAIRRO DO SARANDI,166918,"BAIRRO DO SARANDI, SN - CENTRO - 18250000"
98479,BAIRRO DOS TOMES,166919,"TOMES, SN - CENTRO - 18250000"
132027,BAIRRO DA VILETA 130,166907,"BAIRRO DA VILETA, SN - CENTRO - 18250000"
98480,BAIRRO DOS EVANGELISTAS,166920,"EVANGELISTAS, SN - CENTRO - 18250000"
98481,BAIRRO DA CAMPININHA,166921,"CAMPININHA, SN - CENTRO - 18250000"
98482,BAIRRO DO CERRITO,166922,"DO CERRITO, SN - CENTRO - 18250000"
98483,BAIRRO DOS PEREIRAS,166923,"BAIRRO DOS PEREIRAS, SN - CENTRO - 18250000"
98484,DISTRITO DO MORRO DO ALTO,166924,"DISTRITO DO MORRO ALTO, SN -  - 18200000"
98485,FAZENDA DO BANCO,166925,"FAZ DO BANCO, SN -  - 18200000"
98486,BAIRRO DO SABIA UNA,166926,"SABIA UNA, SN -  - 18200000"
98487,BAIRRO DO CAPAO ALTO 265,166927,"BAIRRO DO CAPAO ALTO, SN -  - 18200000"
98488,BAIRRO RIBEIRAO JURUMIRIM,166928,"BAIRRO RIBEIRAO JURUMIRIM, SN -  - 18200000"
98490,DISTRITO MORRO DO ALTO,166929,"DIS MORRO ALTO, SN -  - 18200000"
132029,FAZENDA FLORESTA ESTADUAL 1,166930,"FAZ FLORESTA ESTADUAL, SN -  - 18200000"
98491,FAZENDA FLORESTA ESTADUALSEGUNDA,166930,"FAZ FLORESTA ESTADUAL, SN -  - 18200000"
98492,FAZENDA MORRO DO ALTO,166931,"FAZ MORRO ALTO, SN -  - 18200000"
98493,FAZENDA FLORESTA ESTADUAL 240,166932,"FAZFLORESTA ESTADUAL, SN -  - 18200000"
98494,BAIRRO DOS CLAROS,166933,"BAIRRO DOS CLAROS, SN -  - 18200000"
98495,BAIRRO TURVO DOS RODRIGUES,166934,"BAIRRO TURVO DOS RODRIGUES, SN -  - 18200000"
98496,PRO MENOR BAIRRO CAPAO ALTO 39,166935,"PRO MENOR BAIRRO CAPAO ALTO, SN -  - 18200000"
98497,BAIRRO TURVO DOS CATOLICOS,166936,"BAIRRO TURVO DOS CATOLICOS, SN -  - 18200000"
98498,BAIRRO TURVO DOS RODRIGUES,166934,"BAIRRO TURVO DOS RODRIGUES, SN -  - 18200000"
98499,BAIRRO DO PAU DALHO,166937,"BAIRRO DO PAU DALHO, SN -  - 18200000"
98500,BAIRRO CABECEIRA RIBEIRAO JURUMIRIM,166938,"CABECEIRA RIB JURUMIRIM, SN -  - 18200000"
98501,BAIRRO TURVO DOS CATOLICOS,166939,"TURVO DOS CATOLICOS, SN -  - 18200000"
98502,BAIRRO CAMPO GRANDE,166940,"BAIRRO CAMPO GRANDE, SN -  - 18200000"
98503,BAIRRO CAPAO ALTO,166941,"CAPAO ALTO, SN -  - 18200000"
132031,FEBEM 42,166942,"FEBEM, SN -  - 18200000"
98505,SITIO SAO PEDRO,166943,"SITIO SAO PEDRO, SN -  - 18200000"
132032,PRO MENOR BAIRRO CAPAO ALTO 40,166941,"CAPAO ALTO, SN -  - 18200000"
98506,PRO MENOR BAIRRO CAPAO ALTO 41,166941,"CAPAO ALTO, SN -  - 18200000"
98507,FEBEM 43,166944,"FEBEM 43, SN -  - 18200000"
98513,CHAPADA GRANDE,166945,"CHAPADA GRANDE, SN -  - 18200000"
98514,BAIRRO DO FUNDAO,166946,"BAIRRO DO FUNDAO, SN -  - 18200000"
132034,BAIRRO DOS BERNARDES,166947,"BAIRRO DOS BERNARDES, SN -  - 18200000"
98515,CHAPADA GRANDE,166945,"CHAPADA GRANDE, SN -  - 18200000"
98516,FAZENDA SAO JOAO 236,166948,"FAZ SAO JOAO, SN -  - 18200000"
98517,FAZENDA VISTA ALEGRE,166949,"FAZENDA VISTA ALEGRE, SN -  - 18200000"
98519,BAIRRO DA LAGOA VERMELHA,166950,"BAIRRO LAGOA VERMELHA, SN -  - 18200000"
98520,BAIRRO DA ROCINHA,166951,"BAIRRO DA ROCINHA, SN -  - 18200000"
98521,BAIRRO DA ROCINHA,166952,"ROCINHA, SN -  - 18200000"
98522,BAIRRO ALTO DO RIO ACIMA,166953,"BAIRRO ALTO DO RIO ACIMA, SN -  - 18200000"
98523,BAIRRO DO RIO ACIMA,166954,"BAIRRO DO RIO ACIMA, SN -  - 18200000"
98524,BAIRRO DO RIO ACIMA,166954,"BAIRRO DO RIO ACIMA, SN -  - 18200000"
98526,BAIRRO DO CERRADO,166955,"BAIRRO DO CERRADO, SN -  - 18200000"
132036,BAIRRO DOS BERNARDES 16,166956,"BERNARDES, SN -  - 18200000"
98527,BAIRRO DA CHAPADA GRANDE,166957,"BAIRRO DA CHAPADA GRANDE, SN -  - 18200000"
98529,BAIRRO DO MOQUEM,166958,"BAIRRO DO MOQUEM, SN -  - 18200000"
98530,BAIRRO RIO ACIMA 32,166959,"RIO ACIMA, SN -  - 18200000"
132037,"33 EEPG EMERGENCIA BAIRRO DA LAGOA VERMELHA",166960,"LAGOA VERMELHA, SN -  - 18200000"
98531,BAIRRO DA CHAPADINHA,166961,"BAIRRO DA CHAPADINHA, SN -  - 18200000"
98532,BAIRRO NOSSA SRA DA PAZ III,166962,"BNS DA PAZ III, SN -  - 18200000"
98533,BAIRRO DA CAPUAVINHA,166963,"CAPUAVINHA, SN -  - 18200000"
98534,BAIRRO DO ATERRADINHO,166964,"BAIRRO DO ATERRADINHO, SN -  - 18200000"
98535,BAIRRO BOA VISTA,166965,"BAIRRO BOA VISTA, SN -  - 18200000"
98536,BAIRRO DO CERCADINHO,166966,"BAIRRO DO CERCADINHO, SN -  - 18200000"
98537,BAIRRO DOS VEADOS,166967,"VEADOS, SN -  - 18200000"
132038,FAZENDA CESARIO,166968,"FAZENDA CESARIO, SN -  - 18200000"
132039,BAIRRO RIBEIRAOZINHO,166969,"BAIRRO RIBEIRAOZINHO, SN -  - 18200000"
98539,ARAIJU,166970,"CHAPADINHA, SN -  - 18200000"
98540,BAIRRO DO PALANQUE,166971,"BAIRRO DO PALANQUE, SN -  - 18200000"
98541,BAIRRO DO PALANQUE 249,166972,"PALANQUE, SN -  - 18200000"
98542,BAIRRO DA CHAPADINHA,166970,"CHAPADINHA, SN -  - 18200000"
98544,BAIRRO CAPAO ALTO,166973,"BAIRRO CAPAO ALTO, SN -  - 18200000"
132040,BAIRRO PASSA TRES,166974,"BAIRRO PASSA TRES, SN -  - 18200000"
98545,BAIRRO DOS ELIAS,166975,"BAIRRO DOS ELIAS, SN -  - 18200000"
98546,BAIRRO DO PALANQUE,166972,"PALANQUE, SN -  - 18200000"
98547,BAIRRO CURUCA,166976,"BAIRRO CURUCA, SN -  - 18200000"
98548,BAIRRO DO PINHAL,166977,"PINHAL, SN -  - 18200000"
98549,SID BARRA MANSA 137,166978,"RECHA, SN -  - 18200000"
132041,VILA MACIEL I,166979,"VMACIEL, SN -  - 18200000"
98550,BAIRRO SAO ROQUE,166980,"BAIRRO SAO ROQUE, SN -  - 18200000"
98553,BAIRRO CANTAGALO,166981,"BAIRRO CANTAGALO, SN -  - 18200000"
132042,BAIRRO DO PICARRAO PRIMEIRA,166982,"BAIRRO DO PICARRAO, SN -  - 18200000"
98555,BAIRRO DO PICARRAO II,166982,"BAIRRO DO PICARRAO, SN -  - 18200000"
98557,BAIRRO DA VARZEA,166983,"BAIRRO DA VARZEA, SN -  - 18200000"
98558,BAIRRO DO ESPIGAO,166984,"BAIRRO DO ESPIGAO, SN -  - 18200000"
132043,BAIRRO VIRACOPOS,166985,"BAIRRO VIRACOPOS, SN -  - 18200000"
98559,BAIRRO DO RETIRO,166986,"BAIRRO DO RETIRO, SN -  - 18200000"
98560,BAIRRO DO RETIRO,166986,"BAIRRO DO RETIRO, SN -  - 18200000"
98561,BAIRRO LAGOA SILVANA,166987,"BAIRRO LAGOA SILVANA, SN -  - 18200000"
98562,BAIRRO DO CERCADINHO,166988,"CERCADINHO, SN -  - 18200000"
98563,BAIRRO DO AREAO,166989,"BAIRRO DO AREAO, SN -  - 18200000"
132044,BAIRRO DO CANTAGALO,166990,"BAIRRO DO CANTAGALO, SN -  - 18200000"
98564,BAIRRO DO PICARRAO,166982,"BAIRRO DO PICARRAO, SN -  - 18200000"
98565,FAZENDA SENDAS,166991,"FAZENDA SENDAS, SN -  - 18200000"
98566,BAIRRO PINHEIRO ALTO,166992,"BAIRRO PINHEIRO ALTO, SN -  - 18200000"
98567,BAIRRO DE SAO ROQUE,166993,"BAIRRO DE SAO ROQUE, SN -  - 18200000"
98568,VILA MACIEL II,166994,"VMACIEL II, SN -  - 18200000"
98569,FAZENDA SENDAS,166995,"PESCARIA, SN -  - 18200000"
88785,FAZENDA FLORESTAL ESTADUAL III,166996,"FAZFLORESTAL ESTADUAL, SN -  - 18200000"
98572,BAIRRO DA BOA VISTA,166997,"BOA VISTA, SN - CENTRO - 18230000"
88814,FAZENDA PAINEIRAS,166998,"FAZENDA PAINEIRAS SEGUNDA, SN - CENTRO - 18230000"
98575,BAIRRO GUARAREMA,166999,"GUARAREMA, SN - CENTRO - 18230000"
98576,BAIRRO DE SANTA CRUZ,167000,"SANTA CRUZ, SN - CENTRO - 18230000"
98577,COLONIA PINHAL,167001,"COLONIA PINHAL, SN - CENTRO - 18230000"
88927,BAIRRO SANTA CRUZ,167000,"SANTA CRUZ, SN - CENTRO - 18230000"
98578,BAIRRO DOS PAULOS,167002,"PAULOS, SN - CENTRO - 18230000"
98579,COLONIA PINHAL,167001,"COLONIA PINHAL, SN - CENTRO - 18230000"
98580,CAPELA DE SAO ROQUE,167003,"CAPELA DE SAO ROQUE, SN - ZONZ RURAL - 18230000"
98581,COLONIA PINHAL,167001,"COLONIA PINHAL, SN - CENTRO - 18230000"
89101,BAIRRO DO FAXINAL DO MEIO,167004,"FAXINAL DO MEIO, SN - CENTRO - 18220000"
98585,BAIRRO GUARAREMA DE CIMA,167005,"GUARAREMA CIMA, SN - CENTRO - 18230000"
98586,BAIRRO CAPELA DE SAO ROQUE,167006,"CAPELA S ROQUE, SN - CENTRO - 18230000"
98587,FAZENDA PAINEIRAS SA,167007,"FAZENDA PAINEIRAS SA, SN - CENTRO - 18230000"
98588,BAIRRO BOA VISTA,166997,"BOA VISTA, SN - CENTRO - 18230000"
98589,BAIRRO GUARAREMA,166999,"GUARAREMA, SN - CENTRO - 18230000"
132046,BAIRRO DOS CABACAIS,167008,"BAIRRO DOS CABACAIS, SN - CENTRO - 18225000"
98590,BAIRRO DOS SOARES,167009,"SOARES, SN - CENTRO - 18230000"
98591,BAIRRO TURVO DA LAGOA,167010,"BAIRRO TURVO DA LAGOA, SN - ZONA RURAL - 18230000"
98592,CENTRAL PARQUE GRAMADAO,167011,"CENTRAL PARQUE GRAMADAO, SN - CENTRO - 18230000"
98593,BAIRRO CURUMIN,167012,"BAIRRO CURUMIN, SN - CENTRO - 18230000"
98594,BAIRRO DO FACAO,167013,"BAIRRO DO FACAO, SN - CENTRO - 18230000"
132047,BAIRRO DA RUFINADA,167014,"BAIRRO DA RUFINADA, SN - CENTRO - 18230000"
98595,FAZENDA FORQUILHA,167015,"FAZ FORQUILHA, SN - CENTRO - 18230000"
98596,BAIRRO DO TURVINHO,167016,"BAIRRO DO TURVINHO, SN - CENTRO - 18230000"
98597,BAIRRO CERRADO DOS TOUROS 146,167017,"BAIRRO CERRADO DOS TOUROS, SN - CENTRO - 18230000"
98598,FAZENDA DOM BOSCO,167018,"FAZENDA DOM BOSCO, SN - CENTRO - 18230000"
98599,FAZENDA ESTIVA,167019,"FAZ ESTIVA, SN - CENTRO - 18230000"
98600,FAZENDA LAGO AZUL,167020,"FAZENDA LAGO AZUL, SN - CENTRO - 18230000"
98601,FAZENDA SAO SEBASTIAO 158,167021,"FAZ SAO SEBASTIAO, SN - CENTRO - 18230000"
98602,FAZENDA DOM BOSCO,167018,"FAZENDA DOM BOSCO, SN - CENTRO - 18230000"
98603,BAIRRO BARRO PRETO,167022,"BAIRRO BARRO PRETO, SN - CENTRO - 18230000"
132049,BAIRRO CAPAO RICO,167023,"BAIRRO CAPAO RICO, SN - CENTRO - 18230000"
98604,BAIRRO FAXINAL DOS ALMEIDAS,167024,"BAIRRO FAXINAL DOS ALMEIDAS, SN - CENTRO - 18230000"
98605,BAIRRO DOS HILARIOS,167025,"BAIRRO DOS HILARIOS, SN - CENTRO - 18230000"
98606,BAIRRO DA JUSTINADA,167026,"BAIRRO DA JUSTINADA, SN - CENTRO - 18230000"
98608,BAIRRO DO RETIRO,167027,"BAIRRO DO RETIRO, SN - CENTRO - 18230000"
132051,BAIRRO DO POCINHO,167028,"BAIRRO DO POCINHO, SN - CENTRO - 18230000"
98609,BAIRRO DO SUMIDOURO,167029,"BAIRRO DO SUMIDOURO, SN - CENTRO - 18230000"
98610,BAIRRO DO TURVINHO,167016,"BAIRRO DO TURVINHO, SN - CENTRO - 18230000"
98611,BAIRRO CAPAO RICO,167023,"BAIRRO CAPAO RICO, SN - CENTRO - 18230000"
98612,BAIRRO DE CABACAIS,167030,"CABACAIS, SN - CENTRO - 18220000"
132052,BAIRRO DA VARZEA,167031,"BAIRRO DA VARZEA, SN - CENTRO - 18225000"
98613,BAIRRO DO RODEIO 262,167032,"RODEIO, SN - CENTRO - 18220000"
98614,BAIRRO DO FAXINAL,167033,"BAIRRO DO FAXINAL, SN - CENTRO - 18220000"
98615,BAIRRO DO FAXINAL DO MEIO,167034,"BAIRRO FAXINAL DO MEIO, SN - CENTRO - 18220000"
98616,BAIRRO DA RESSACA,167035,"BAIRRO DA RESSACA, SN - CENTRO - 18220000"
132053,BAIRRO DO FAXINAL DA ILHA 169,167036,"FAXINAL DA ILHA, SN - CENTRO - 18220000"
98617,SITIO SAO JOAQUIM,167037,"SAO BENTO, SN - CENTRO - 18220000"
98618,BAIRRO DOS TAVARES,167038,"BAIRRO DOS TAVARES, SN - CENTRO - 18220000"
98619,BAIRRO DE MATO DENTRO 169,167039,"MATO DENTRO, SN - CENTRO - 18220000"
98620,FAZENDA SAO MANOEL 183,167040,"FAZSAO MANOEL, SN - CENTRO - 18220000"
98621,BAIRRO DA VARZEA DE BAIXO,167041,"BAIRRO DA VARZEA DE BAIXO, SN - CENTRO - 18220000"
132054,BAIRRO DA PARTE NORTE,167042,"BAIRRO DA PARTE NORTE, SN - CENTRO - 18490000"
98622,BAIRRO DA SERRA DOS PAES,167043,"BAIRRO SERRA DOS PAES, SN - CENTRO - 18490000"
98623,BAIRRO DA SERRA DOS PAES,167043,"BAIRRO SERRA DOS PAES, SN - CENTRO - 18490000"
98624,BAIRRO RIO VERDE,167044,"BAIRRO RIO VERDE,  - CENTRO - 18440000"
98625,BAIRRO SAMAMBAIAL,167045,"BAIRRO SAMAMBAIAL, SN - CENTRO - 18490000"
98626,BAIRRO DOS VIEIRAS,167046,"BAIRRO DOS VIEIRAS, SN - CENTRO - 18490000"
98627,BAIRRO CAZONATO,167047,"BAIRRO CAZONATO, SN - CENTRO - 18490000"
132055,BAIRRO SAMAMBAIAL,167045,"BAIRRO SAMAMBAIAL, SN - CENTRO - 18490000"
98628,BAIRRO DA BARRAGEM,167048,"BAIRRO DA BARRAGEM, SN - CENTRO - 18490000"
98629,BAIRRO SAMAMBAIAL,167045,"BAIRRO SAMAMBAIAL, SN - CENTRO - 18490000"
98630,BAIRRO SAO JOSE,167049,"BAIRRO SAO JOSE, SN - CENTRO - 18490000"
98631,BAIRRO SAMAMBAIAL,167045,"BAIRRO SAMAMBAIAL, SN - CENTRO - 18490000"
132056,BAIRRO DA BARRAGEM,167048,"BAIRRO DA BARRAGEM, SN - CENTRO - 18490000"
98632,BAIRRO DA CORREDEIRA,167050,"BAIRRO DA CORREDEIRA, SN - CENTRO - 18490000"
98633,BAIRRO DA PARTE NORTE AGRUP A 326859,167042,"BAIRRO DA PARTE NORTE, SN - CENTRO - 18490000"
98634,BAIRRO DOS SCHIMIDTS,167051,"BAIRRO DOS SCHIMIDTS, SN - CENTRO - 18490000"
98635,ESTACAO ARACACU,167052,"ESTACAO ARACACU, SN - CENTRO - 18290000"
132057,FAZENDA MANDACAIA,167053,"FAZ MANDACAIA, SN - CENTRO - 18290000"
98636,BAIRRO DO CURRAL VELHO,167054,"BAIRRO CURRAL VELHO, SN - CENTRO - 18290000"
98637,BAIRRO CURRAL VELHO 98,167055,"CURRAL VELHO, SN - CENTRO - 18290000"
98638,FAZENDA MANDACAIA,167056,"FAZ MANDACAIA, SN - CENTRO - 18290000"
98639,FAZENDA AGUA SANTA,167057,"FAZAGUA SANTA, SN - CENTRO - 18290000"
132058,FAZENDA PLANEBRAS,167058,"FAZ PLANEBRAS, SN - CENTRO - 18290000"
98640,BAIRRO DO FUNDAO,167059,"BAIRRO FUNDAO, SN - CENTRO - 18290000"
132059,BAIRRO BARREIRO,167060,"BAIRRO BARREIRO, SN - CENTRO - 18290000"
98641,FAZENDA UNIAO DO BRASIL,167061,"FAZ UNIAO DO BRASIL, SN - CENTRO - 18290000"
98643,FAZENDA NOVA SANTO AMARO,167062,"FAZNOVA SAMARO, SN - CENTRO - 18290000"
98644,FAZENDA SANTA ALBERTINA 118,167063,"FAZSANTA ALBERTINA, SN - CENTRO - 18290000"
98645,BAIRRO TAQUARU USSU,167064,"TAQUARA USSU, SN - CENTRO - 18290000"
98646,FAZENDA SANTA MARIA,167065,"FAZ SANTA MARIA, SN - CENTRO - 18290000"
98648,BAIRRO DA CAPELINHA,167066,"BAIRRO CAPELINHA, SN - CENTRO - 18290000"
98649,BAIRRO DO FUNDAO,167059,"BAIRRO FUNDAO, SN - CENTRO - 18290000"
132061,FAZENDA PROJETO VITORINO,167067,"FAZENDA PROJETO VITORINO, SN - CENTRO - 18290000"
98651,BAIRRO DO GRAMADINHO,167068,"BAIRRO DO GRAMADINHO, SN - CENTRO - 18290000"
98652,BAIRRO DO CHAPEUZINHO,167069,"BAIRRO DO CHAPEUZINHO, SN - CENTRO - 18290000"
98653,BAIRRO DOS COSTAS,167070,"BAIRRO DOS COSTAS, SN - CENTRO - 18290000"
98654,BAIRRO DE INDAIATUBA,167071,"BAIRRO INDAIATUBA, SN - CENTRO - 18290000"
132062,BAIRRO DO LAGEADO,167072,"BAIRRO DO LAGEADO, SN - CENTRO - 18290000"
98655,FAZENDA ALIANCA,167073,"FAZ ALIANCA, SN - CENTRO - 18290000"
98656,BAIRRO DO MATAO,167074,"BAIRRO DO MATAO, SN - CENTRO - 18290000"
98657,BAIRRO DO MORRO VERMELHO,167075,"BAIRRO MORRO VERMELHO, SN - CENTRO - 18290000"
98658,FAZENDA PAINEIRA,167076,"FAZENDA PAINEIRA, SN - CENTRO - 18290000"
98659,ESTACAO DE ARACACU,167077,"ARACACU, SN - CENTRO - 18290000"
132063,ESTACAO DE ARACACU,167077,"ARACACU, SN - CENTRO - 18290000"
98660,BAIRRO DO LAGEADO,167078,"BAIRRO LAGEADO, SN - CENTRO - 18290000"
98661,BAIRRO DA ENXOVIA,167079,"BAIRRO DA ENXOVIA, SN - CENTRO - 18290000"
98662,BAIRRO DO SALTO,167080,"BAIRRO DO SALTO,  - CENTRO - 18440000"
98663,AGROVILA III,167081,"AGROVILA, SN - CENTRO - 18440000"
132064,BAIRRO DO QUARENTEI,167082,"BAIRRO DO QUARENTEI,  - CENTRO - 18440000"
98664,ENGENHEIRO MAIA,167083,"FAZ ENG MAIA, SN - CENTRO - 18440000"
98665,BAIRRO DE ENGENHEIRO MAIA,167084,"BAIRRO DE ENGENHEIRO MAIA, SN - CENTRO - 18440000"
98666,BAIRRO DA SERRINHA DA BOA VISTA,167085,"BAIRRO SERRINHA DA BOA VISTA, SN - CENTRO - 18440000"
98667,BAIRRO DA SERRINHA,167086,"BAIRRO DA SERRINHA, SN - CENTRO - 18440000"
98668,BAIRRO DO CAMBARA,167087,"BAIRRO DO CAMBARA,  - CENTRO - 18440000"
132065,BAIRRO ENGENHEIRO MAIA,167088,"BAIRRO ENGMAIA, SN - CENTRO - 18440000"
98669,BAIRRO DO MANGUEIRO GRANDE,167089,"BAIRRO DO MANGUEIRO GRANDE, SN - CENTRO - 18440000"
98670,VILA FORQUILHA,167090,"VILA FORQUILHA, SN - CENTRO - 18440000"
98671,BAIRRO DA AGUA PRETA,167091,"BAIRRO DA AGUA PRETA, SN - CENTRO - 18440000"
98672,BAIRRO DO TOME,167092,"BAIRRO DO TOME, SN - CENTRO - 18440000"
98673,BAIRRO DO COMUM,167093,"BAIRRO DO COMUM, SN - CENTRO - 18440000"
132066,BAIRRO DO QUARENTEI,167094,"BAIRRO DO QUARENTEI, SN - CENTRO - 18440000"
132067,VILA FORQUILHA,167090,"VILA FORQUILHA, SN - CENTRO - 18440000"
98675,BAIRRO SANTO ANTONIO,167095,"BAIRRO STO ANTONIO, SN - CENTRO - 18440000"
98676,BAIRRO DOS LOBOS,167096,"BAIRRO DOS LOBOS, SN - CENTRO - 18440000"
98677,BAIRRO DOS BERNARDOS,167097,"BAIRRO DOS BERNARDOS, SN - CENTRO - 18440000"
98678,BAIRRO DOS LOBOS,167096,"BAIRRO DOS LOBOS, SN - CENTRO - 18440000"
98679,BAIRRO DO COMUM,167093,"BAIRRO DO COMUM, SN - CENTRO - 18440000"
98680,BAIRRO DA BOA VISTA,167098,"BAIRRO DA BOA VISTA, SN - CENTRO - 18440000"
98681,BAIRRO DO COMUM,167093,"BAIRRO DO COMUM, SN - CENTRO - 18440000"
98682,BAIRRO DO RONCADOR 151,167099,"RONCADOR, SN - CENTRO - 18440000"
98683,BAIRRO DO TARUMA,167100,"BAIRRO DO TARUMA, SN - CENTRO - 18440000"
98684,BAIRRO DO TOME,167092,"BAIRRO DO TOME, SN - CENTRO - 18440000"
132069,BAIRRO DOS QUADROS DE CIMA,167101,"BAIRRO DOS QUADROS DE CIMA, SN - CENTRO - 18440000"
98685,BAIRRO PASSA TRES,167102,"BAIRRO PASSA TRES, SN - CENTRO - 18440000"
98686,BAIRRO DO PASSA TRES,167103,"PASSA TRES, SN - CENTRO - 18440000"
98687,AGROVILA II,167104,"RUA PRINCIPAL, SN - AGROVILA II - 18440000"
98688,COPASUL,167105,"RODOVIA 267,  - CENTRO - 18440000"
98690,CENTRO ATEND SOCIOEDUC AO ADOLESCENTE DE PERUIBE CI         ,167106,"RODOVIA SP 55, KM 347 - ESTANCIA PEROLA NEGRA          - 11750000"
98691,CENTRO ATEND SOCIOEDUC AO ADOLESCENTE DE PERUIBECIP,167107,"RODOVIA SP 55, KM340 - ESTANCIA PEROLA NEGRA - 11750000"
132071,FAZENDA QUITANDINHA,167108,"FAZENDA QUITANDINHA, SN - CENTRO - 18440000"
98692,FAZENDA SELECOES,167109,"FAZENDA SELECOES, SN - CENTRO - 18440000"
98693,BAIRRO LIMEIRINHA,167110,"BAIRRO LIMEIRINHA, SN - CENTRO - 18440000"
98694,FAZENDA AGROLIM,167111,"AGROLIM, SN - CENTRO - 18440000"
98695,BAIRRO AGUA AMARELA,167112,"BAIRRO DA AGUA AMARELA, SN - CENTRO - 18440000"
98696,BAIRRO DOS GOMES,167113,"GOMES, SN - CENTRO - 18440000"
132072,BAIRRO DA AGUA AMARELASEGUNDA,167114,"AGUA AMARELA, SN - CENTRO - 18440000"
98697,BAIRRO CAFEZAL,167115,"BAIRRO CAFEZAL,  - CENTRO - 18440000"
98698,FAZENDA RIBEIRAO BONITO,167116,"FAZENDA RIBEIRAO BONITO, SN - CENTRO - 18440000"
98699,BAIRRO DOS AQUINOS,167117,"BAIRRO DOS AQUINOS,  - CENTRO - 18440000"
98700,BAIRRO RASQUEADO,167118,"BAIRRO RASQUEADO, SN - CENTRO - 18440000"
98701,BAIRRO AGUA AMARELA,167114,"AGUA AMARELA, SN - CENTRO - 18440000"
132073,BAIRRO DA SANBRA,167119,"BAIRRO DA SANBRA, SN -  - 18400000"
98702,BAIRRO DO CAFEZAL,167120,"BAIRRO DO CAFEZAL, SN - CENTRO - 18440000"
98703,FAZENDA RIBEIRAO BONITO,167121,"AQUINOS, SN - CENTRO - 18440000"
98704,FAZENDA LAGOA BONITA,167122,"FAZENDA LAGOA BONITA, SN - CENTRO - 18440000"
98705,BAIRRO DO PIRITUBA 132,167123,"PIRITUBA, SN - CENTRO - 18440000"
132074,BAIRRO TAQUARUCU,167124,"BAIRRO TAQUARUCU, SN - CENTRO - 18440000"
98708,BAIRRO DO CERRADO 147,167125,"CERRADO, SN - CENTRO - 18440000"
98709,BAIRRO DO CERRADO 145,167125,"CERRADO, SN - CENTRO - 18440000"
98710,BAIRRO CAFEZAL VELHO,167126,"BAIRRO CAFEZAL VELHO, SN - CENTRO - 18440000"
98711,BAIRRO DO PASSO FUNDO,167127,"BAIRRO PASSO FUNDO, SN - CENTRO - 18440000"
98712,FAZENDA AGROLIM,167111,"AGROLIM, SN - CENTRO - 18440000"
98713,FAZENDA LIMEIRA,167128,"FAZENDA GRAMA VERDE, SN - CENTRO - 18440000"
98714,BAIRRO DO PIRITUBA,167129,"BAIRRO DO PIRITUBA,  - CENTRO - 18440000"
98715,FAZENDA SELECOES,167109,"FAZENDA SELECOES, SN - CENTRO - 18440000"
98716,BAIRRO DE CIMA,167130,"BAIRRO DE CIMA, SN -  - 18400000"
132077,BAIRRO DO CHICO ADAO,167131,"BAIRRO DO CHICO ADAO, SN - CENTRO - 18440000"
98717,BAIRRO DO SALTINHO 47,167132,"SALTINHO, SN -  - 18400000"
98718,BAIRRO PALMEIRINHA,167133,"BAIRRO PALMEIRINHA, SN -  - 18400000"
98719,BAIRRO DOS BRAGANCEIROS,167134,"BAIRRO DOS BRAGANCEIROS, SN -  - 18400000"
98720,SITIO DOS AZEVEDO,167135,"SITIO DOS AZEVEDO, SN - CENTRO - 18480000"
98721,BAIRRO DOS TORRES,167136,"BAIRRO DOS TORRES, SN -  - 18400000"
98722,BAIRRO DOS ANTUNES,167137,"BAIRRO DOS ANTUNES, SN -  - 18400000"
132078,BAIRRO ITAOCA DE CIMA,167138,"ITAOCA DE CIMA, SN -  - 18400000"
98723,BAIRRO DA SERRINHA DA BRANCAL,167139,"ALTO DA BRANCAL, SN -  - 18400000"
98724,BAIRRO DO CAETE,167140,"BAIRRO DO CAETE, SN -  - 18400000"
98725,FAZENDA PALMEIRAS,167141,"FAZENDA PALMEIRAS, SN -  - 18400000"
98726,BAIRRO ITAOCA,167142,"BAIRRO ITAOCA, SN -  - 18400000"
98727,BAIRRO DA CAPUTERA,167143,"BAIRRO DA CAPUTERA, SN -  - 18400000"
98728,BAIRRO DO ALTO DA BRANCAL,167144,"ALTO BRANCAL, SN -  - 18400000"
89128,BAIRRO FAXINAL DE BAIXO,167145,"FAXINAL BAIXO, SN -  - 18400000"
98729,BAIRRO FAXINAL,167146,"BAIRRO FAXINAL, SN -  - 18400000"
98730,BAIRRO DOS ANTUNES,167137,"BAIRRO DOS ANTUNES, SN -  - 18400000"
98731,BAIRRO ALEGRE DE BAIXO,167147,"BAIRRO ALEGRE DE BAIXO, SN -  - 18400000"
98732,BAIRRO AGUA QUENTE,167148,"BAIRRO AGUA QUENTE, SN -  - 18400000"
98733,BAIRRO DA INVERNADA,167149,"BAIRRO DA INVERNADA, SN -  - 18400000"
98734,BAIRRO DO BARREIRO,167150,"BAIRRO DO BARREIRO, SN -  - 18400000"
89331,BAIRRO SALTINHO DO COQUEIRAL,167151,"BAIRRO SALTINHO DO COQUEIRAL, SN -  - 18400000"
98735,BAIRRO FAXINAL,167152,"FAXINAL, SN -  - 18400000"
98736,BAIRRO DOS BRAGANCEIROS,167153,"BAIRRO DOS BRAGANCEIROS, SN -  - 18400000"
98737,BAIRRO DOS GUILHERMES,167154,"BAIRRO DOS GUILHERMES, SN -  - 18400000"
98738,BAIRRO RIO DAS PEDRAS,167155,"BAIRRO RIO DAS PEDRAS, SN -  - 18400000"
98739,BAIRRO DA CONQUISTA,167156,"BAIRRO DA CONQUISTA, SN -  - 18400000"
89701,BAIRRO PEDREIRA DO TAMANDUA,167157,"BAIRRO PEDREIRA DO TAMANDUA, SN -  - 18400000"
98740,BAIRRO DA SANBRA,167119,"BAIRRO DA SANBRA, SN -  - 18400000"
98741,BAIRRO ITAOCA,167158,"ITAOCA, SN -  - 18400000"
98706,BAIRRO AMARELA VELHA,167159,"BAIRRO AMARELA VELHA, SN -  - 18400000"
89788,BAIRRO DO ITANGUA,167160,"ITANGUA, SN -  - 18400000"
90556,BAIRRO DA AMARELA VELHA,167161,"BAIRRO DA AMARELA VELHA, SN -  - 18400000"
98744,FAZENDA SAO ROBERTO,167162,"FAZENDA SAO ROBERTO, SN -  - 18400000"
98745,BAIRRO CAPOEIRAO,167163,"BAIRRO CAPOEIRAO, SN -  - 18400000"
98747,BAIRRO DO CERCADINHO,167164,"BAIRRO DO CERCADINHO, SN -  - 18400000"
90696,BAIRRO MORRO CAVADO,167165,"BAIRRO DO MORRO CAVADO, SN -  - 18400000"
98749,BAIRRO DA CHAPADA,167166,"BAIRRO DA CHAPADA, SN -  - 18400000"
98750,BAIRRO DA LAGOA,167167,"BAIRRO DA LAGOA, SN -  - 18400000"
98751,BAIRRO DA CAPUTERA,167143,"BAIRRO DA CAPUTERA, SN -  - 18400000"
98752,BAIRRO DA CONQUISTA,167156,"BAIRRO DA CONQUISTA, SN -  - 18400000"
90839,BAIRRO RIO TAQUARI,167168,"BAIRRO RIO TAQUARI, SN -  - 18400000"
98753,BAIRRO CONQUISTA,167169,"BAIRRO CONQUISTA, SN -  - 18400000"
98754,FAZENDA SAO JORGE,167170,"FAZENDA SAO JORGE, SN - CENTRO - 18470000"
98755,FAZENDA PALMEIRAS,167141,"FAZENDA PALMEIRAS, SN -  - 18400000"
98756,FAZENDA MAGON,167171,"FAZENDA MAGON, SN -  - 18400000"
98757,BAIRRO DA CHAPADA,167166,"BAIRRO DA CHAPADA, SN -  - 18400000"
90867,REFLORESTAMENTO PINAL II,167172,"REFLORESTPINAL II, SN -  - 18400000"
98758,BAIRRO LARANJA AZEDA,167173,"BAIRRO LARANJA AZEDA, SN -  - 18400000"
98759,BAIRRO DA CAPUTERA,167143,"BAIRRO DA CAPUTERA, SN -  - 18400000"
98760,ESTACAO DE JAO,167174,"ESTACAO DE JAO, SN -  - 18400000"
98761,BAIRRO RIO TAQUARI,167175,"RIO TAQUARI, SN -  - 18400000"
98762,BAIRRO DA BOA VISTA,167176,"BAIRRO DA BOA VISTA, SN -  - 18400000"
98763,FAZENDA VITORIA,167177,"FAZENDA VITORIA, SN -  - 18400000"
