72925,ALTINA MAYNARDES ARAUJO PROFA,161673,"RUA TEOFILO ANDRADE GAMA, 800 - BOQUEIRAO - 18270360"
72926,JOSE TOMAS BORGES PROF,161674,"R CORONEL GUILHERME, 210 - SANTA CRUZ - 18275760"
72927,ALDO ANGELINI,161675,"NARCISO PIERONI, 1094 - CENTRO - 18260000"
72928,FRANCISCO MENDES DE ALMEIDA PROF,161676,"RUA DO COMERCIO, 691 - CENTRO - 18280000"
72929,CESARIO CARLOS DE ALMEIDA,161677,"DUQUE DE CAXIAS, SN - VILA FELIX - 18500000"
72930,QUINZINHO DO AMARAL,161678,"RUA GENERAL OSORIO, 51 - CENTRO - 18500000"
72931,LUIZ CAMPACCI,161679,"AMADEU MEUCCI, 200 - VILA CAMPACCI - 18500000"
125892,EUGENIO SANTOS,161680,"PC ADELAIDE GUEDES, SN - CENTRO - 18270020"
72932,ELEUTERIO JOSE MOREIRA PROF,161681,"AVENIDA BRASIL, 137 - JARDIM BONANZA - 18530000"
72933,JEFFERSON SOARES DE SOUZA PROF,161682,"RUA MANOEL NOVAES, 1279 - CENTRO - 18535000"
72934,ISABEL ALVES LIMA DONA,161683,"AV AFONSO MATHIAS, SN - DIST MARISTELA - 18500000"
127835,JOAQUIM FRANCISCO DE MIRANDA,161684,"RUA JOAO ROSA DE OLIVEIRA, 233 - CENTRO - 18260000"
72935,RENATO ANGELINI PROF,161685,"ATALIBA COSTA AVILA, 225 - CENTRO - 18265000"
72936,BARAO DE SURUI,161686,"PRACA PAULO SETUBAL, 101 - CENTRO - 18270380"
72937,CHICO PEREIRA,161687,"ANTONIO SANTO, 249 - CENTRO - 18275010"
72938,JOAO FLORENCIO,161688,"PC PAULO SETUBAL, 21 - CENTRO - 18270380"
72939,ROZENDO DUARTE LOBO PROF,161689,"RUA CORONEL JOSE BONINI, 222 - CENTRO - 18580000"
72940,ARTHUR DA SILVA BERNARDES PRESIDENTE,161690,"AVENIDA WASHINGTON LUIZ, 478 - CENTRO - 18520000"
72941,ARY DE ALMEIDA SINISGALLI PROF,161691,"CECILIO BONEDER, 428 - VILA ESPERANCA - 18278003"
72942,JOSE CAMPOS DE ARRUDA BOTELHO CORONEL,161692,"RUA SAO JOAO, 126 - CENTRO - 18550000"
127836,MARIO PEDRO VERCELLINO ALFERES,161693,"AVENIDA ALEXANDRINA BERTOLDI VERCELLINO, 361 - VILA GINASIAL - 18550000"
74827,JOAO TOLEDO PROF,161694,"RUA ACHILES AUDI, 268 - CENTRO - 18520000"
72946,ARISTEU VASCONCELLOS LEITE,161695,"NOSSA SENHORA APARECIDA, 388 - CENTRO - 18285000"
72948,ABIMAEL CARLOS DE CAMPOS PROF,161696,"AV LUIZ DO PFERNANDES, 631 - RIO ACIMA - 18110000"
125893,ANTONIETA FERRARESE PROFESSORA,161697,"RUA MATUSO MATUCHIMA, 180 - VILA SONIA - 18111305"
72949,ARMANDO RIZZO PROFESSOR,161698,"RENATO ARAUJO, 281 - JARDIM ARAUJO - 18114457"
72950,EDITH MAGANINI PROFA,161699,"RUA JOAO CARLOS DE CAMPOS, 359 - VOSSOROCA - 18110000"
72951,JOSE ERMIRIO DE MORAES SENADOR,161700,"ITALIA SALVESTRO MORA, 381 - VILA VOTOCEL - 18115300"
72952,ODILON BATISTA JORDAO VEREADOR,161701,"RUA CORONEL MORAES CUNHA, 969 - CENTRO - 18185000"
72953,ANCHIETA PADRE,161702,"RUA DURVALINO COSTA E SILVA, 158 - CAMPO GRANDE - 18185000"
72954,DANIEL VERANO PROFESSOR,161703,"CARLOS LUVISON, 180 - PARQUE BELA VISTA - 18110435"
72955,LAURO ALVES LIMA PROF,161704,"R CAETANO CORREA DA SILVA, 33 - JD SERRANO - 18110000"
127837,MARIA PAULA RAMALHO PAES PROFESSORA,161705,"RUA FRANCISCO ANTONIO CORREA, 381 - PARQUE DA TORRE - 18170000"
72956,JOAO FERREIRA DA SILVA,161706,"RUA ANGELO BRUNO, 123 - ITAPVOTORATIM - 18110000"
128447,AFONSO VERGUEIRO DOUTOR,161707,"RUA ANTONIO RODRIGUES SIMOES, 310 - CENTRO - 18160000"
72957,GASPAR RICARDO JUNIOR DR,161708,"RUA SANTO ANTONIO, 186 - CENTRO - 18560000"
127838,ANNA CUEVAS GUIMARAES,161709,"RUA BRASIL, 195 - JARDIM DANIEL D HADDAD - 18160000"
72958,JOAO ROSA CORONEL,161710,"AVENIDA SANTA CATARINA, 57 - CENTRO - 18180000"
72959,CARLOS AUGUSTO DE CAMARGO PROFESSOR,161711,"RUA VICENTE GARCIA, 296 - CENTRO - 18170000"
72960,JOSE RODRIGUES DE OLIVEIRA CONEGO,161712,"RUA BENJAMIM CONSTANT, 90 - CENTRO - 18170000"
72961,MARIA ANGELICA BAILLOT PROFESSORA,161713,"RUA MANOEL VIEIRA, 587 - TOLEDOPOLIS - 18190000"
72962,PEDRO DIAS DE CAMPOS CORONEL,161714,"RUA JOAO FELIPE, 200 - CENTRO - 18195000"
72963,HENORY DE CAMPOS GOES PROFA,161715,"RUA LUIZ ROSSI, 57 - JD IRENE - 18560000"
72964,PEREIRA INACIO COMENDADOR,161716,"AVENIDA SANTO ANTONIO, 665 - BARRA FUNDA - 18114345"
72965,OCTAVIO SOARES DE ARRUDA PROF,161717,"TURUNAS, 158 - BRIEDS - 13466185"
72966,RISOLETA LOPES ARANHA PROFESSORA,161718,"TREZE DE MAIO, 471 - JARDIM SAO DOMINGOS - 13471030"
72967,SILVINO JOSE DE OLIVEIRA PROF,161719,"MIGUEL COUTO PROFESSOR, 716 - VILA CORDENONSI - 13472450"
72968,SAO VICENTE DE PAULO,161720,"DOM BARRETO, 1001 - PARAISO - 13465720"
74857,JUVELINA DE OLIVEIRA RODRIGUES PROFA,161721,"RUA JOSE ALEX DE BARROS, 86 - JARDIM PAULISTA - 13456034"
72969,ALCINDO SOARES DO NASCIMENTO PROF,161722,"DINAMARCA, 531 - JARDIM PAULISTANO - 13471600"
72970,INOCENCIO MAIA PROF,161723,"RUA JOAO LINO, 525 - CENTRO - 13450033"
72971,JOSE GABRIEL DE OLIVEIRA,161724,"CILLO, 67 - CENTRO - 13450041"
72972,JAYME DE BARROS CAMARA DOM,161725,"AVENIDA JOSE MANCINI, 501 - JARDIM CARLOS BASSO - 13170040"
125897,MARIA GUILHERMINA LOPES FAGUNDES PROFA,161726,"CARLOS CHAGAS, 253 - VILA LINOPOLIS I - 13450455"
127839,ULISSES DE OLIVEIRA VALENTE PROF,161727,"PRUDENTE DE MORAES, 222 - CENTRO - 13450048"
74885,LUIZ ALVES CEL,161728,"ANCHIETA PADRE, 173 - VILA SIQUEIRA CAMPOS - 13451036"
125898,ANTONIO DE ARRUDA RIBEIRO PROF,161729,"AMADOR BUENO DE CAMPOS, 52 - JARDIM INDUSTRIAL - 13453010"
128448,ANDRE RODRIGUES DE ALKIMIN PROFESSOR,161730,"RUA DOM BARRETO, 1158 - CENTRO - 13170004"
72975,PAULO AZENHA,161731,"RMARIA RAPOSEIRO AZENHA, 455 - VILA AZENHA - 13460000"
72976,ELISABETH STEAGALL PIRTOUSCHEG PROFA,161732,"IRIDIO, 275 - VILA MOLLON IV - 13456500"
74947,MARIA JOSE DE MATTOS GOBBO PROFA,161733,"COELHO NETO, 650 - VILA AMORIM - 13469140"
72977,MARIO PATARRA FRATTINI PROF,161734,"PERNAMBUCO, 353 - VILA NOSSA SENHORA DE FATIMA - 13478570"
125899,MAURA ARRUDA GUIDOLIN PROFA,161735,"DIONISIO RODRIGUES DA SILVA, 650 - CAMPO LIMPO - 13477120"
72978,JOAO DE CASTRO GONCALVES DR,161736,"TIBIRICA, 449 - CONSERVA - 13466044"
72979,MAGI MONSENHOR,161737,"SALGUEIROS, 495 - JARDIM SAO PAULO - 13468080"
72980,ARY MENEGATTO PROF,161738,"RUA SANTA TEREZA, 156 - VILA BELVEDERE - 13473090"
72981,DELMIRA DE OLIVEIRA LOPES PROFA,161739,"NARCISOS, 130 - VILA MATHIESEN - 13467340"
72982,HEITOR PENTEADO DR,161740,"PROFESSORES, 40 - CENTRO - 13465060"
72983,DILECTA CENEVIVA MARTINELLI PROFA,161741,"ORQUIDEAS, 214 - CIDADE JARDIM II - 13467080"
72984,JOAO XXIII,161742,"CAXIAS DUQUE, 550 - VILA SANTA CATARINA - 13466320"
72985,EMILIO ROMI COMENDADOR,161743,"DONA CAROLINA, 11 - JARDIM PANAMBI - 13450515"
125900,ANGELO CAMPO DALL ORTO,161744,"AVENIDA SAO PAULO, 466 - JARDIM  NOVA VENEZA - 13177000"
72986,GUIDO ROSOLEN,161745,"GUIDO ROSOLEM, 201 - JARDIM ROSOLEM - 13185320"
72987,JOAO FRANCESCHINI,161746,"RUA CABO HOFFMANN, 161 - JARDIM SAO PAULO - 13170470"
72988,MANOEL IGNACIO DA SILVA,161747,"RUA LUIZ CAMILO DE CAMARGO, 355 - VILA SAO FRANCISCO - 13184420"
72989,DE CILLOS,161748,"RUA DA ESTACAO, 2 - CILLOS - 13450000"
72990,ANTONIO MATARAZZO PROF,161749,"NORUEGA, 2165 - JARDIM CANDIDO BERTINI - 13455186"
72991,JOAO THIENNE DR,161750,"RUA INDEPENDENCIA, 500 - CENTRO - 13380025"
125901,WADIH JORGE MALUF,161751,"RUA SANTA CLARA, 238 - JARDIM  SANTA CLARA - 13179215"
72992,JOAO SOLIDARIO PEDROSO PROF,161752,"SANTO ONOFRE, 275 - SAO MANOEL - 13472250"
72993,OLYMPIA BARTH DE OLIVEIRA PROFA,161753,"ITAPEMIRIM, 149 - JARDIM IPIRANGA - 13468480"
72994,GERMANO BENENCASE MAESTRO,161754,"ASTEROIDES, 224 - JARDIM ALVORADA - 13479140"
72995,COMENDADOR MULLER,161755,"BAIRRO CARIOBA, 114 - CARIOBA - 13465000"
72996,FRANCISCO TOZZI DR,161756,"PRACA PHILOMENA PULINO TOZZI, 30 - JARDIM PARAISO - 13940000"
72997,JOAO SIMOES PROF,161757,"RUA VICTORIO COPPOS, 134 - BOA ESPERANCA - 13970000"
72998,ARNALDO ROSSI PROF,161758,"PRACA CORONEL JOAO PEDRO, 130 - CENTRO - 13920000"
72999,MORVAN DIAS DE FIGUEIREDO,161759,"TRAVESSA AMOR PERFEITO, 6 - JDM SAO NILO - 13920000"
73000,BAIRRO DA PONTE ALTA 4,161546,"PONTE ALTA, SN -  - 12400000"
125902,JOAO PEDRO DE GODOY MOREIRA CEL,161760,"RUA 15 DE NOVEMBRO, 952 - CENTRO - 13920000"
74976,RAUL DE PAIVA CASTRO,161761,"AVDEPNARCISO PIERONI, 24 - MALEGRE SUL - 13910000"
73005,CLODOVEU BARBOSA PROF,161762,"AV VIRIATO VALENTE, 538 - CENTRO - 13820000"
73006,PEDRO DE TOLEDO,161763,"AVENIDA RIO DO PEIXE, 400 - CENTRO - 13950000"
73007,FRANKLIN DE TOLEDO PIZA FILHO DR,161764,"RODOVIA JOAO BEIRA SP 95 KM 735, SN - ROSEIRA - 13820000"
73008,IBRANTINA CARDONA,161765,"RUA DR JORGE LATOUR, 99 - CENTRO - 13825000"
125903,FRANCISCO XAVIER SANTIAGO PREFEITO,161766,"RUA FRANCISCO DAL BO, SN - GUEDES - 13820000"
73009,AMANCIO BUENO CEL,161767,"RUA CEL AMANCIO BUENO, 400 - CENTRO - 13820000"
73010,JOAQUIM VIEIRA,161768,"RUA EUGENIA CARMEM MOISES, SN - V ELEUTERIO - 13970000"
73011,FENIZIO MARCHINI PROF,161769,"RUA MARCELINA BREDA, SN - BARAO ATALIBA NOGUEIRA - 13986000"
73012,VIRGOLINO DE OLIVEIRA COMENDADOR,161770,"USINA NSRA APARECIDA, SN - N S APARECIDA - 13970000"
73013,PEDRO FERREIRA CINTRA PROF,161771,"RUA ARTUR BERNARDES, 326 - VILA ILZE - 13972129"
73014,NOEDIR MAZZINI,161772,"JORGE JOSE, 20 - JARDIM SAO JOSE - 13901154"
73015,FRANCISCO DA SILVEIRA FRANCO,161773,"JOSE JACOBSEN, 390 - CENTRO ARCADAS - 13908030"
73016,LUIZ LEITE,161774,"ALCEU VIEIRA CAPITAO, 76 - CENTRO - 13900325"
125904,RANGEL PESTANA,161775,"MEIRELES REIS, 153 - CENTRO - 13900376"
128449,NELSON ALVES DE GODOY DR,161776,"RACHID KASSOUF, SN - CENTRO TRES PONTES - 13909010"
73017,CORIOLANO BURGOS DR,161777,"RIACHUELO, 160 - RIBEIRAO - 13904040"
73018,ANTONIO CAIO,161778,"RUA MAJOR JOAO MANOEL, SN - SAO VICENTE - 13974540"
73019,IZAURA DA SILVA VIEIRA DONA,161779,"RUA CEL FRANCISCO VIEIRA, SN - CUBATAO - 13970000"
73020,JULIO MESQUITA DR,161780,"CAMPOS SALLES, 35 - CENTRO - 13970170"
73021,CAETANO MUNHOZ PREFEITO,161781,"AVENIDA BRASIL, 1942 - PRADO - 13973255"
125905,VICENTE RIZZO DR,161782,"RUA MOGI MIRIM, 208 - BELA VISTA - 13940000"
73022,JOVINO SILVEIRA DR,161783,"RUA DOS ESTUDANTES, 92 - CENTRO - 13930000"
73023,SYLVIO DE AGUIAR MAYA DR,161784,"RUA ALFREDO MARTINELLI, 117 - VILA SANTO ANTONIO - 13920000"
73024,HUMBERTO PIVA,161785,"RUA ANTONIO PEDRO, 688 - CENTRO - 13920000"
73025,MARIA DO CARMO DE GODOY RAMOS PROFA,161786,"AVENIDA JUCA PRETO, 1551 - DAS PALMEIRAS - 13930000"
73026,ELVIRA SANTOS DE OLIVEIRA DONA,161787,"PRACA MOGI MIRIM, 10 - SANTA CRUZ - 13974009"
73027,LOURENCO FRANCO DE OLIVEIRA,161788,"RUA TIRADENTES, 173 - CENTRO - 13930000"
125906,CELSO HENRIQUE TOZZI PROFESSOR,161789,"RUA MARECHAL FLORIANO PEIXOTO, 261 - BERLIM - 13820000"
73028,JOSEPHINA GALVAO DE FRANCA ANDREUCCI PROFESSORA,161790,"RODOVIA DOUTOR OTAVIO DE OLIVEIRA SANTOS, KM 06 - ORATORIO - 13960000"
73029,ROSALINA DE FARIA VOTTA VITA PROFA,161791,"RUA ANTONIO DE TOLEDO FO, SN - LAVRAS DE CIMA - 13960000"
73030,NARCISO PIERONI,161792,"RUA VISCONDE DO RIO BRANCO, 424 - CENTRO - 13960000"
73031,OLIMPIO GONCALVES DOS REIS CEL,161793,"RUA ALFREDO DE OLIVEIRA SANTOS, 68 - CENTRO - 13960000"
75005,JOSE FRANCO CRAVEIRO,161794,"AVENIDA DOUTOR RENATO SILVA, 88 - CENTRO - 13960000"
125907,CASPER LIBERO,161795,"RUA DOUTOR CANDIDO FONTOURA DA SILVEIRA, 65 - VILA MOTA - 12903020"
125908,PAULO SILVA PROFESSOR,161796,"PRACA NOVE DE JULHO, 28 - TABOAO - 12900280"
73033,JOSE MAURICIO DA ROCHA DOM,161797,"ROBERTO SIMONSEN SENADOR, 106 - PARQUE BRASIL - 12906330"
73034,JOSE TAVARES PROFESSOR,161798,"RUA ZEFERINO DE LIMA, 574 - CENTRO - 12930000"
73035,ADELIO FERRAZ DE CASTRO,161799,"RUA FIORAVANTE RESTIVO, 165 - CENTRO - 12935000"
73036,JOAO ERNESTO FIGUEIREDO CORONEL,161800,"AVENIDA WALDOMIRO VILLACA, 126 - CENTRO - 12980000"
125909,JOAO APOCALIPSE PROFESSOR,161801,"PRACA NOSSA SENHORA DE LOURDES, 50 - CENTRO - 12990000"
73038,FRANCISCO DEROSA,161802,"PRACA DOUTOR ALVARO GUIAO, SN - CENTRO - 12960000"
73039,JOAO DE MORAES GOES,161803,"AVENIDA JOAO XXIII, SN - CENTRO - 12970000"
73040,TOMAZ GONCALVES DA ROCHA CUNHA CEL,161804,"AVDR CANDIDO RODRIGUES, 83 - CENTRO - 12970000"
73041,ESTANISLAU AUGUSTO PROFESSOR,161805,"RUA MAESTRO BRAGA, 34 - CENTRO - 12995000"
73042,MARIA DO CARMO BARBOSA PROFESSORA,161806,"JOSE SILVA, SN - TANQUE - 12954779"
73043,MATEUS NUNES DE SIQUEIRA PADRE,161807,"PRACA DOUTOR YUGAWA, SN - CAETETUBA - 12951580"
73044,JOSE SIQUEIRA BUENO,161808,"RUA AMAPA, 355 - BATATUBA - 12975000"
73045,GABRIEL DA SILVA PROFESSOR,161809,"AVENIDA SAO JOAO, SN - VILA CARVALHO - 12940260"
73046,ZILAH BARRETO PACITTI PROFESSORA,161810,"RUA ANTONIO CUNHA LEITE, 3100 - PORTAO - 12948110"
73047,JORGE TIBIRICA DR,161811,"RUA CORONEL LEME, SN - CENTRO - 12900000"
73048,FRANCISCO DAMANTE PROFESSOR,161812,"RUA SAO GERALDO, 403 - CENTRO - 12955000"
73049,CIRCE TEIXEIRA MUSA E SILVA PROFESSORA,161813,"RUA WILSON MUTTI, SN - JARDIM MARACANA - 12949291"
73051,JOSE GUILHERME,161814,"CAROLINA DONA, 60 - CENTRO - 12900071"
73052,FRANCISCO DE ASSIS GONCALVES CORONEL,161815,"RUA CAMPOS SALLES, 71 - VILA MUNICIPAL - 12912020"
73053,ALCINDO BUENO DE ASSIS MINISTRO,161816,"RUA CORONEL LUIZ LEME, 381 - CENTRO - 12914010"
